Ad,Inspirasi Belanja,Tiento Baju Pendek Olahraga Wanita Crop Top Kaos Running Gym Lari Yoga,Rp88.000,Rp209.000,58%,Cashback 11%,Bandung,TIENTO,5.0,50+ terjual
Ad,Baju Setelan Senam Yoga Olahraga Gym Wanita BM03 Legging Running LM 07,Rp280.000,Cashback 10%,Denpasar,unique yoga bali,4.0,5 terjual
Ad,Set Baju Olahraga Wanita / Sport Wear Baju SenamGym Fitness Yoga Cewek,Rp143.000,Rp250.000,43%,Cashback 8%,Bekasi,Mallmarket888,4.7,100+ terjual
Ad,Baju Yoga / Bra Yoga Sport / Bra Olahraga Yoga DL 96081 - S,Rp188.000,Cashback 11%,Jakarta Utara,Unique Yoga Shop,1 terjual
Ad,"Baju Yoga / Baju Yoga Manduka / Action Zip Front Bra Black - Black, XS",Rp475.000,Rp745.000,36%,Cashback 6%,Kab. Tangerang,YogaMatIndonesia,5.0,3 terjual
Sportacular,SecondShape - Baju Atasan Gym Wanita Senam Fitness Yoga Tangan Pendek,Rp65.000,Cashback 3%,Jakarta Barat,Second Shape Sports Apparel,4.9,1rb+ terjual
Sportacular,SecondShape - Ashley Top Baju Olahraga Yoga Senam Gym Fitness,Rp79.000,Cashback 3%,Jakarta Barat,Second Shape Sports Apparel,4.8,100+ terjual
Sportacular,SecondShape - Crop Top Baju Olahraga Wanita Tangan Panjang Yoga Gym,Rp62.000,Cashback 3%,Jakarta Barat,Second Shape Sports Apparel,4.9,750+ terjual
Sportacular,Chloe String Crop Top Baju Olahraga Wanita Yoga Senam Zumba Fitness S,Rp119.000,Cashback 3%,Jakarta Barat,Second Shape Sports Apparel,4.9,250+ terjual
Tunik Hijab Set Olahraga Baju Senam Tennis Bersepeda Yoga,Rp79.000,Rp100.000,21%,Cashback 3%,Jakarta Barat,Hitjab & Co,4.9,2rb+ terjual
Ad,"KAOS YOGA WANITA /ATASAN YOGA / BAJU YOGA WANITA / DEKAOS 2630 PEACE - Putih, S",Rp42.800,Cashback 2%,Tangerang Selatan,Dekaosshop,4.9,70+ terjual
Ad,Terlaris,Baju setelan senam aerobik zumba yoga fitness wanita Sela - peach+black,Rp99.800,Cashback 5%,Jakarta Utara,Tulipshop77,4.9,90+ terjual
Ad,"TSHIRT YOGA NEW/ BAJU KAOS YOGA WANITA / ATASAN SENAM WANITA BARU /630 - Abu-abu, S",Rp39.900,Cashback 2%,Tangerang Selatan,Dekaosshop,4.9,500+ terjual
Ad,Sisa 3,Baju Kaos T-shirt Dry Fit Olahraga Sport Yoga Wanita Zoey / Baju Senam,Rp255.000,Cashback 11%,Jakarta Utara,Unique Yoga Shop,5.0,29 terjual
Ad,"sportsstyles Baju Olahraga wanita DTS496 gym fitnes yoga - Brown, S",Rp149.000,Cashback 3%,Jakarta Utara,sportsstyles,5.0,26 terjual
Baju Atasan Olahraga Wanita Kaos Senam Zumba Yoga Gym Lengan Pendek,Rp79.000,Rp120.000,34%,Cashback 2%,Jakarta Barat,Juragan kaus kaki,4.9,250+ terjual
Sportacular,Stella Stripe Crop Top Baju Olahraga Wanita Yoga Zumba Senam Pilates R,Rp99.000,Cashback 3%,Jakarta Barat,Second Shape Sports Apparel,4.8,100+ terjual
Sisa 5,Kaos Olahraga Dry Fit Wanita Sport T shirt Woman Yoga Outdoor Running,Rp54.000,Cashback 3%,Jakarta Pusat,Dojiso,4.7,250+ terjual
Kaos Gym Baju Yoga Wanita REIKO Oversize Atasan Olahraga Lari Zumba,Rp84.000,Rp110.000,24%,Cashback 5%,Jakarta Barat,Reiko Store,4.9,90+ terjual
"Kaos Dry Fit Wanita Yoga Senam Gym Lari Baju Olahraga Mesh Jaring ""BX7",Rp87.500,Cashback 1%,Jakarta Barat,Venditionis_shop,5.0,250+ terjual
ONESET Setelan BAJU Sportbra Wanita olahraga gym fitnes yoga,Rp159.000,Rp229.000,31%,Cashback 3%,Jakarta Utara,sportsstyles,4.9,250+ terjual
Set Baju Olahraga Wanita / Sport Wear Baju SenamGym Fitness Yoga Cewek,Rp143.000,Rp250.000,43%,Cashback 8%,Bekasi,Mallmarket888,4.7,100+ terjual
RNNR KAOS CROP TOP FIT BAJU OLAHRAGA WANITA SENAM YOGA GYM LARI LARIS,Rp60.000,Cashback 5%,Jakarta Barat,rnnr,4.9,100+ terjual
P81 Baju Kaos Sport Wanita Gym Fitness Yoga Senam Jogging Lari Running,Rp68.000,Cashback 1%,Jakarta Barat,Oxlikes,4.9,1rb+ terjual
Sportacular,Stella Bra & Celana Legging Setelan Baju Olahraga Wanita Yoga Set Zumb,Rp169.999,Cashback 3%,Jakarta Barat,Second Shape Sports Apparel,4.8,100+ terjual
Ad,T-shirt Yoga New/ T-shirt Just Breath Murah/ Baju Yoga Terlengkap,Rp185.000,Cashback 11%,Jakarta Utara,Unique Yoga Shop,4.9,30+ terjual
Ad,setelan 2pcs baju olahraga wanita /pendek/sporty gym fitness yoga,Rp165.000,Cashback 3%,Jakarta Utara,sportsstyles,4.9,500+ terjual
Ad,Baju Olahraga Senam Yoga Wanita Lengan Panjang Dry Fit WT317,Rp250.000,Cashback 11%,Jakarta Utara,Unique Yoga Shop,4.6,70+ terjual
Ad,"REGINA T-SHIRT QUICK DRY BAJU KAOS OLAHRAGA WANITA DRY FIT Gym Yoga - Pink, M",Rp147.000,Cashback 5%,Kab. Bogor,TICTACSPORTSWEAR,5.0,9 terjual
Ad,"Kaos Olahraga Senam Yoga Casual Wanita Lengan Pendek / Baju Top Clara  - Hitam, S",Rp215.000,Cashback 11%,Jakarta Utara,Unique Yoga Shop,5.0,7 terjual
Terlaris,NERO NET TEE baju senam aerobic yoga gym zumba fitnes,Rp60.000,Cashback 1%,Bandung,Nats baju senam,4.8,100+ terjual
TSHIRT YOGA NEW/ BAJU KAOS YOGA WANITA / ATASAN SENAM WANITA BARU /630,Rp39.900,Cashback 2%,Tangerang Selatan,Dekaosshop,4.9,500+ terjual
Swimsuit Collection Crop Top Baju Olahraga Yoga Sport Senam 1135,Rp74.999,Rp200.000,63%,Cashback 7%,Jakarta Barat,Swimsuit Collection,4.9,50+ terjual
DX-805 Baju Kaos Sport Wanita Gym Fitness Yoga Senam Jogging Running,Rp81.500,Cashback 1%,Jakarta Barat,Oxlikes,4.9,100+ terjual
Terlaris,Kaos baju sport lengan panjang senam gym yoga lari olahraga wanita,Rp84.900,Cashback 4%,Jakarta Utara,Tulipshop77,4.9,250+ terjual
 Baju Olahraga Wanita Tanktop Yoga Aerobik Zumba Premium 594,Rp64.766,Rp122.200,47%,Cashback 1%,Kab. Tangerang,active wear,5.0,24 terjual
setelan 2pcs baju olahraga wanita /pendek/sporty gym fitness yoga,Rp165.000,Cashback 3%,Jakarta Utara,sportsstyles,4.9,500+ terjual
Set Baju Olahraga Senam Yoga Wanita Muslimah Syari Ukuran Jumbo Sporty,Rp216.000,Rp240.000,10%,Cashback 1%,Tangerang Selatan,Rocella Store ID,4.9,100+ terjual
PASAR,Terrel sportswear basic tanktop black women jersey baju lari gym yoga,Rp45.700,Rp124.000,63%,Cashback 7%,Bandung,Terrelsportswear,4.9,100+ terjual
Baju senam kaos sport gym yoga fitness olahraga running wanita murah,Rp39.800,Cashback 14%,Jakarta Barat,Teks - Lock,5.0,100+ terjual
Sisa 5,Kaos Olahraga Dry Fit Wanita Sport T shirt Woman Yoga Outdoor Running,Rp54.000,Cashback 3%,Jakarta Pusat,Dojiso,4.7,250+ terjual
Baju Olahraga Aerobik Yoga Lengan Pendek DX034,Rp118.000,Cashback 10%,Jakarta Pusat,MooMoo16,4.9,30+ terjual
Baju Olahraga Aerobik Yoga Lengan Pendek DX2287,Rp145.000,Cashback 8%,Jakarta Pusat,SvkaSvka,5.0,20 terjual
Baju Olahraga Aerobik Yoga Lengan Pendek DX818,Rp148.000,Cashback 8%,Jakarta Pusat,SvkaSvka,5.0,14 terjual
Baju Olahraga Aerobik Yoga Lengan Pendek DX2287,Rp145.000,Cashback 6%,Jakarta Pusat,MooMoo16,5.0,10 terjual
Baju Olahraga Aerobik Yoga Lengan Pendek DX818,Rp148.000,Cashback 6%,Jakarta Pusat,MooMoo16,4.7,4 terjual
Baju Senam Wanita/Tank Top Zumba/Atasan Olahraga Senam Zumba Yoga Wani,Rp40.000,Jakarta Pusat,Rancakcollection,4.2,21 terjual
Ad,"Baju Olahraga Muslimah Modern Lengan Panjang Sepeda Running Zumba Yoga - MAROON, S",Rp69.500,Cashback 5%,Jakarta Barat,CV Fufu Baju Olahraga Indonesia,5.0,40+ terjual
Ad,"Baju Olahraga Lengan Panjang Yoga Top Atasan Senam Gym Pilates WT 388 - Ungu, S",Rp260.000,Cashback 10%,Denpasar,unique yoga bali
Ad,Sportacular,"Baju Yoga Lengan Panjang / Top Yoga Long Sleeve Gym Zumba Fitness - Hitam, S",Rp230.000,Cashback 11%,Jakarta Utara,Unique Yoga Shop,4.8,70+ terjual
Ad,"BAJU KAOS YOGA WANITA / ATASAN YOGA WANITA / DEKAOS 2812 NAMASTE BULAT - Pink fusia, S",Rp41.800,Cashback 2%,Tangerang Selatan,Dekaosshop,5.0,60+ terjual
Ad,"baju olahraga wanita shirt kaos gym fitnes yoga - purple, L",Rp85.000,Cashback 3%,Jakarta Utara,sportsstyles,4.8,250+ terjual
sportsstyles Baju Olahraga wanita DTS496 gym fitnes yoga,Rp149.000,Cashback 3%,Jakarta Utara,sportsstyles,5.0,26 terjual
Baju Kaos Olahraga Jumbo Big Size Gym Senam Yoga Cewek Wanita Original,Rp53.394,Rp56.394,5%,Cashback 3%,Jakarta Barat,Wyloz Original,4.9,500+ terjual
UC | LANA long sleeve baju kaos atasan lengan panjang olahraga yoga,Rp79.475,Rp93.500,15%,Cashback 1%,Kab. Tangerang,UC_Unicore,4.9,30+ terjual
Inspirasi Belanja,Tiento Baju Pendek Olahraga Wanita Crop Top Kaos Running Gym Lari Yoga,Rp88.000,Rp209.000,58%,Cashback 11%,Bandung,TIENTO,5.0,50+ terjual
KAOS LARI BAJU SENAM YOGA FITNESS GYM OLAHRAGA KERAH BULAT RNNR,Rp65.000,Cashback 5%,Jakarta Barat,rnnr,4.9,100+ terjual
Sportacular,Baju Yoga Lengan Panjang / Top Yoga Long Sleeve Gym Zumba Fitness,Rp230.000,Cashback 11%,Jakarta Utara,Unique Yoga Shop,4.8,70+ terjual
Reytorrm Hoodie Olahraga Wanita Lengan Panjang yoga &Sport kemeja polo,Rp189.000,Cashback 4%,Jakarta Barat,Reytorrm sports,4.8,100+ terjual
Sportacular,Stella Bra & Hot Pants Setelan Baju Olahraga Wanita Yoga Set Zumba,Rp185.000,Cashback 3%,Jakarta Barat,Second Shape Sports Apparel,4.9,100+ terjual
Baju Atasan Olahraga Senam Yoga Pilates / Tank Top Ruby Wanita Dry Fit,Rp195.000,Cashback 11%,Jakarta Utara,Unique Yoga Shop,5.0,19 terjual
Sportacular,Stella Crop Top & Celana Legging Setelan Baju Olahraga Wanita Yoga Set,Rp189.999,Cashback 3%,Jakarta Barat,Second Shape Sports Apparel,4.9,100+ terjual
AirFit - Kaos Sport Baju Atasan Olahraga Yoga Tennis Wanita Fitness,Rp99.000,Cashback 13%,Kab. Tangerang,AirFit,5.0,19 terjual
KAOS YOGA WANITA /ATASAN YOGA / BAJU YOGA WANITA / DEKAOS 1187 NAMASTE,Rp43.900,Cashback 2%,Tangerang Selatan,Dekaosshop,5.0,100+ terjual
setelan 2pcs baju olahraga wanita sporty gym fitness yoga,Rp179.000,Cashback 3%,Jakarta Utara,sportsstyles,5.0,250+ terjual
NEOSAVA Atasan Baju Senam Olahraga Wanita Sport Gym Fitness Yoga,Rp99.999,Cashback 5%,Jakarta Barat,Neosava,5.0,30+ terjual
Wyloz Baju Kaos Singlet Tanktop Olahraga Gym Fitness Yoga Wanita Sport,Rp40.000,Rp47.607,16%,Cashback 3%,Jakarta Barat,Wyloz Original,4.9,26 terjual
baju olahraga wanita shirt kaos gym fitnes yoga,Rp85.000,Cashback 3%,Jakarta Utara,sportsstyles,4.8,250+ terjual
SETELAN BAJU SENAM AEROBIC SET COLOURCROSS JUMBO BAJU ZUMBA YOGA GYM,Rp83.000,Cashback 1%,Tangerang,yenz sportswear,5.0,16 terjual
RNNR Baju olahraga Wanita / Kaos GYM/ YOGA/lari DRIFIT Nyaman Putih,Rp65.000,Cashback 3%,Jakarta Barat,rnnr,4.8,100+ terjual
Terlaris,Sport Bra Pastel Yoga Bra Baju Gym Wanita Premium Olahraga,Rp75.000,Cashback 1%,Jakarta Barat,Venditionis_shop,4.9,750+ terjual
Set Baju dan Celana Pendek Setelan Olahraga Gym Yoga Wanita 1150,Rp69.999,Rp200.000,65%,Cashback 7%,Jakarta Barat,Swimsuit Collection,4.6,30+ terjual
KAOS YOGA WANITA /ATASAN YOGA / BAJU YOGA WANITA / DEKAOS 1180 LOTUS,Rp43.900,Tangerang Selatan,Dekaosshop,4.9,70+ terjual
BAJU KAOS YOGA WANITA / ATASAN YOGA WANITA / DEKAOS 2812 NAMASTE BULAT,Rp41.800,Cashback 2%,Tangerang Selatan,Dekaosshop,5.0,60+ terjual
Sportacular,Kaos Yoga Senam Baju Yoga Pilates/ Tshirt Yoga Onetwopunch Vania T896,Rp238.000,Cashback 11%,Jakarta Utara,Unique Yoga Shop,4.8,100+ terjual
Baju Setelan Olahraga Lengan Panjang Dryfit Muslimah Yoga Gym Running,Rp69.900,Cashback 5%,Jakarta Barat,CV Fufu Baju Olahraga Indonesia,4.9,90+ terjual
JC915 Pakaian Fitness Baju Atasan Wanita Gym Yoga Top Cewek,Rp165.000,Cashback 4%,Jakarta Barat,JakartaCheapCheap,4.6,30+ terjual
Sport-FR T-Shirt Sport Wanita Olahraga Baju atasan Yoga Gym Fitnnes,Rp79.900,Cashback 3%,Jakarta Barat,Sport-FR,4.7,20 terjual
UC | MIA baju kaos atasan lengan panjang olahraga yoga gym fitness,Rp74.400,Rp80.000,7%,Cashback 1%,Kab. Tangerang,UC_Unicore,5.0,40+ terjual
CROP TOP YOGA WANITA / BAJU KAOS YOGA WANITA / DEKAOS 1187CROP NAMASTE,Rp53.800,Cashback 2%,Tangerang Selatan,Dekaosshop,4.8,60+ terjual
Reytorrm Plus Ukuran Wanita Yoga T-Shirt Olahraga Lari Gym Luar Ruanga,Rp149.000,Cashback 4%,Jakarta Barat,Reytorrm sports,4.9,40+ terjual
Reytorrm Kaos T-Shirt Wanita Lengan Pendek Untuk Gym&Lari&Yoga sport,Rp71.900,Rp75.000,4%,Cashback 4%,Jakarta Barat,Reytorrm sports,4.9,100+ terjual
Sisa 3,Baju Kaos T-shirt Dry Fit Olahraga Sport Yoga Wanita Zoey / Baju Senam,Rp255.000,Cashback 11%,Jakarta Utara,Unique Yoga Shop,5.0,29 terjual
Baju Senam Wanita/Tank Top Zumba/Atasan Olahraga Senam Zumba Yoga Wani,Rp40.000,Jakarta Pusat,Rancakcollection,4.2,21 terjual
KOTECH Training T-Shirt Yoga Slim Lengan Panjang Wanita CX605,Rp290.975,Rp449.000,35%,Cashback 2%,Jakarta Barat,Kotech Fashion,5.0,23 terjual
HITJAB - Baju Olahraga Wanita Tangan Panjang Sport Lari Jogging Yoga,Rp55.000,Cashback 3%,Jakarta Barat,Hitjab,4.9,100+ terjual
PREMIUM Baju Sportbra Crop Top Wanita Lengan Pendek Yoga/Olahraga,Rp135.200,Rp169.000,20%,Cashback 4%,Jakarta Barat,FAN collection,5.0,12 terjual
Ad,Terlaris,Balok Yoga Cork / Yoga Block Cork,Rp150.000,Cashback 11%,Jakarta Utara,Unique Yoga Shop,4.9,500+ terjual
Ad,"Reytorrm Hoodie Olahraga Wanita Lengan Panjang yoga &Sport kemeja polo - Hijau, L",Rp189.000,Cashback 4%,Jakarta Barat,Reytorrm sports,4.8,100+ terjual
Ad,Sportacular,Kaos Yoga Senam Baju Yoga Pilates/ Tshirt Yoga Onetwopunch Vania T896,Rp238.000,Cashback 11%,Jakarta Utara,Unique Yoga Shop,4.8,100+ terjual
Ad,"sportsstyles baju olahraga wanita CX009 fitness gym yoga - Brown, M",Rp159.000,Cashback 3%,Jakarta Utara,sportsstyles,5.0,10 terjual
Ad,Baju Senam Yoga Denlus DL 97334 - M,Rp260.000,Cashback 11%,Jakarta Utara,Unique Yoga Shop,3 terjual
