,Title,Total,Price,Location
0,MAUSTORE 5 Pcs Celana Pendek Motif Pria Wanita / BOXER UNISEX / BOXER PRIA WANITA / BOXER MOTIF DEWASA / KOLOR PRIA / KOLOR,10RB+ Terjual,Rp49.300,KOTA SURAKARTA (SOLO)
1,CELANA CHINO PENDEK DIAMOND STREATCH KUALITAS PREMIUM,"1,4RB Terjual",Rp58.400,KOTA JAKARTA SELATAN
2,BARU!! CELANA CHINO CINO PENDEK PRIA DEWASA,10RB+ Terjual,Rp35.900,KAB. PEKALONGAN
3,CELANA CHINO PENDEK DIAMOND STREATCH KUALITAS PREMIUM,"7,9RB Terjual",Rp60.900,KOTA JAKARTA SELATAN
4,Celana Cargo Pendek Pria Premium Strecth Short Cargo Pants,10RB+ Terjual,Rp99.600,KAB. PEKALONGAN
5,CELANA CHINO CINO PENDEK PRIA DEWASA,10RB+ Terjual,Rp36.900,KOTA BEKASI
6,Topone88 Celana Pendek Pria Chino,10RB+ Terjual,Rp66.000,KOTA JAKARTA BARAT
7,CELANA CHINO CINO PENDEK PRIA DEWASA,10RB+ Terjual,Rp38.800,KOTA JAKARTA SELATAN
8,Termurah celana chinos pendek pria,10RB+ Terjual,Rp23.750,KAB. JEPARA
9,FortKlass Chino Pants NAVY Celana Pendek Chino Pria Kasual,1RB Terjual,Rp59.999,KOTA JAKARTA BARAT
10,[Bisa COD] Celana Pendek Pria Cowok Dewasa Chino Rip Karet Pinggang Chinos Katun twil kombed,10RB+ Terjual,Rp34.900,KOTA BEKASI
11,[BIG SIZE] 27 -- 40 Celana pendek pria ORIGINAL cargo kimpol chino termurah yg teraris SIZE JUMBO 27--40,10RB+ Terjual,Rp62.500,KOTA JAKARTA SELATAN
12,A2 TERMURAH HARGA GROSIR CHINO DEWASA CHINOS PENDEK GROSIR MURAH BAGUS KUALITAS TERJAMIN DISTRO,"2,4RB Terjual",Rp19.656,KAB. KUDUS
13,Livehaf - Tib Chino Short Pants Black,"8,5RB Terjual",Rp99.900,KAB. TANGERANG
14,Celana Cinos Pendek Pria Dewasa Bahan Tebal Premium Saku Paspol Size 28-34 Clana Chinos Laki Laki Jumbo Warna Hijau Army Hitam Abu Cream Kualitas Bagus Chino Shortpants Cowok Ukuran Besar Longgar Model Sekarang Terbaru 2023 Kain Katun Pinggang Non Karet,40 Terjual,Rp48.900,KOTA JAKARTA BARAT
15,BIG SIZE] Celana Chino Pendek Pria mick pinggang karet rip katun twill krem coklat surfing santaI,10RB+ Terjual,Rp34.900,KOTA BEKASI
16,HEYLOOK Official - Celana Chino Pendek Pria Chino Short Pants Heylook Casual Chino Santai,"1,7RB Terjual",Rp97.000,KOTA TANGERANG
17,Aerostreet Chinos Pendek Emilio Krem Celana Pendek Chino EAAAA,"1,6RB Terjual",Rp124.900,KAB. KLATEN
18,Celana Anak Celana Pendek Anak laki-laki Celana Chino Anak umur 1-11 tahun,"1,7RB Terjual",Rp24.900,KAB. PEKALONGAN
19,CELANA PENDEK PRIA DEWASA 70 DAPAT 5 CELANA PENDEK CHINOS,10RB+ Terjual,Rp99.750,KAB. KUDUS
20,CELANA CHINO CINO PENDEK PRIA DEWASA,"9,2RB Terjual",Rp36.800,KOTA JAKARTA SELATAN
21,TERMURAH HARGA GROSIR CELANA PENDEK PRIA CHINO DEWASA CHINOS PENDEK GROSIR MURAH BAGUS KUALITAS TERJAMIN DISTRO CELANA KARGO,"1,4RB Terjual",Rp20.427,KAB. KUDUS
22,Celana Pendek Pria Dewasa Polos Distro Chinos Santai Bahan strech Nyaman Dipakai full accesories,10RB+ Terjual,Rp62.500,KOTA BEKASI
23,Celana Pendek Pria Cowok Dewasa Chino Rip Karet Pinggang Kolor Chinos Katun terbaru,10RB+ Terjual,Rp35.000,KAB. PEKALONGAN
24,Delibra Celana Chino Pendek,3RB Terjual,Rp95.000,KOTA BANDUNG
25,CELANA CHINO PENDEK PRIA PREMIUM QUALITY,10RB+ Terjual,Rp39.000,KOTA BEKASI
26,Celana pendek chinos 28-38. Celana pendek murah.,793 Terjual,Rp39.999,KOTA JAKARTA BARAT
27,Kiko Ina Short Chino Pants,574 Terjual,Rp86.100,KOTA TANGERANG
28,TERLARIS CELANA PENDEK CHINOS PRIA DEWASA 100 RIBU DAPAT 5,74 Terjual,Rp20.000,KAB. JEPARA
29,CELANA PENDEK CHINOS Kwalitas premium cocok buat harian,10RB+ Terjual,Rp35.000,KAB. PEMALANG
30,CentralHoodie Celana Pendek Pria Chino Slim Fit (COD),"4,8RB Terjual",Rp66.000,KOTA JAKARTA BARAT
31,CELANA PENDEK CHINO PRIA PREMIUM QUALITY TERMURAH,10RB+ Terjual,Rp59.450,KAB. PEKALONGAN
32,tokokita - Celana Pendek Pria Surfing Distro Premium / Celana Chinos Pendek Pria Dewasa Rip Karet Pinggang,64 Terjual,Rp25.000,KOTA JAKARTA BARAT
33,Celana pendek polos chinos pria dewasa Celana chino model distro cowo cowok remaja Celana Rib celana bahan nyaman laki-laki,588 Terjual,Rp27.000,KAB. CIREBON
34,THEHIKAM Official - GROSIR Celana Pendek Pria Rip Chino Polos Pinggang Karet Chinos Kolor Cowok Dewasa Premium,527 Terjual,Rp32.980,KAB. BANDUNG
35,Celana Chino Pendek Pria mick pinggang karet rip katun twill krem coklat surfing santaI,"2,5RB Terjual",Rp36.500,KOTA JAKARTA SELATAN
36,MAXFELL Celana Chino Pendek / Short Chino Pants,10RB+ Terjual,Rp59.900,KOTA JAKARTA SELATAN
37,BAPIN Celana Chino Pendek Premium,"7,6RB Terjual",Rp119.000,KOTA BANDUNG
38,CELANA CHINO CINO PENDEK PRIA DEWASA,10RB+ Terjual,Rp35.000,KOTA JAKARTA SELATAN
39,[BIG SIZE] Celana Chino Pendek Pria mick pinggang karet rip katun twill krem coklat surfing santaI,"4,1RB Terjual",Rp42.900,KOTA JAKARTA SELATAN
40,Celana Pendek Chino Pria Catton Stretch Slim Fit Premium,"2,3RB Terjual",Rp56.999,KOTA JAKARTA SELATAN
41,GVFI Barch Chino Celana Pendek Black,"1,6RB Terjual",Rp89.000,KOTA BANDUNG
42,CELANA CHINO PENDEK SLIMFIT,5RB Terjual,Rp43.500,KOTA JAKARTA SELATAN
43,Celana Pendek Pria Surfing Distro Premium Renang Pantai Santai Kolor RIPP,10RB+ Terjual,Rp34.900,KOTA BEKASI
44,Celana Chino Pendek,"1,4RB Terjual",Rp40.050,KAB. SRAGEN
45,CELANA CHINO CINO PENDEK PRIA DEWASA,379 Terjual,Rp35.000,KOTA JAKARTA SELATAN
46,Celana Chinos Pendek terlaris termurah 100ribu dapat 6 celana,"9,7RB Terjual",Rp33.250,KAB. JEPARA
47,Harga banting Celana Pendek Pria Surfing Distro Premium Renang Pantai Santai Kolor Rib,10RB+ Terjual,Rp32.900,KAB. PEKALONGAN
48,CELANA PENDEK/KOLOR,10RB+ Terjual,Rp9.900,KAB. BANDUNG
49,CELANA PENDEK CHINO PINGGANG RIP PRIA COWOK,"9,8RB Terjual",Rp51.000,KAB. PEKALONGAN
50,Celana Cino Pendek Celana Cino Pendek Pria Celana Cino Paket Ekonomis 100 dapat 5,10RB+ Terjual,Rp100.000,KAB. JEPARA
51,THEHIKAM Official - Celana Pendek Pria Chino Polos Surfing Distro Premium Renang Santai Pantai Kolor,"1,7RB Terjual",Rp32.700,KAB. BANDUNG
52,Celana pendek pria / wanita santai NK,10RB+ Terjual,Rp21.500,KOTA JAKARTA PUSAT
53,Celana Chinos Pendek Pria termurah,10RB+ Terjual,Rp18.900,KAB. JEPARA
54,Celana Pendek Pria Cowo Cowok PINGGANG Melar Ngaret Premium Chinos Chino Cino Bagus Tebal Nyaman Ori Original (Promo Ramadhan Sale),"1,9RB Terjual",Rp32.250,KOTA JAKARTA SELATAN
55,CELANA PENDEK PRIA / CELANA CHINO PENDEK / SHORTPANT TERLARIS,"5,4RB Terjual",Rp45.900,KOTA BEKASI
56,Celana Pendek chino (Premium Quality) / Celana Surfing/Pantai,10RB+ Terjual,Rp69.900,KOTA JAKARTA BARAT
57,Guteninc - Celana Boxer Pendek Burry Boxer,"3,8RB Terjual",Rp39.000,KOTA BANDUNG
58,FortKlass MANUEL ABU Celana Pendek Short Pants Pria,3RB Terjual,Rp59.999,KOTA JAKARTA BARAT
59,CELANA CHINO CINO PENDEK PRIA DEWASA,10RB+ Terjual,Rp33.900,KAB. PEKALONGAN
