,Title,Total,Price,Location
0,KAOS POLOS OVERSIZE PRIA & WANITA COTTON COMBED 24s BAJU BIG SIZE KOREAN STYLE TSHIRT OVERSIZED,10RB+ Terjual,Rp59.400,KOTA BANDUNG
1,FortKlass Kansam kaos polos oversized unisex cotton combed premium t-shirt,295 Terjual,Rp35.000,KOTA JAKARTA BARAT
2,FortKlass Kanrus kaos polos oversize cotton combed t-shirt cowok Mix,"1,3RB Terjual",Rp37.000,KOTA JAKARTA BARAT
3,KAOS POLOS OVERSIZE UNISEX COTTON COMBED 24S PREMIUM OVERSIZED TSHIRT,10RB+ Terjual,Rp63.440,KOTA BANDUNG
4,Aerostreet T Shirt Oversize Polos Cerah Kaos T-Shirt LBAAA,683 Terjual,Rp69.900,KAB. KLATEN
5,FortKlass Kaos Polos Oversize T-Shirt Cowok Premium,10RB+ Terjual,Rp50.000,KOTA JAKARTA BARAT
6,"KAOS POLOS OVERSIZE/KAOS POLOS BIG SIZE/KAOS POLOS JUMBO (2XL,3XL,4XL,5XL)",10RB+ Terjual,Rp34.900,KOTA BANDUNG
7,Mokokomo Kaos Polos Vision Baju Oversize Pria Baju Polos Pria,10RB+ Terjual,Rp41.900,KOTA JAKARTA BARAT
8,T-shirt Oversize | Kaos Polos | Basic | Black | Brainsgland,925 Terjual,Rp49.500,KOTA TANGERANG
9,[PROMO] KAOS POLOS LENGAN PENDEK COTTON COMBED 30S,10RB+ Terjual,Rp31.900,KOTA JAKARTA UTARA
10,MANLY KAOS POLOS OVERSIZE UNISEX PREMIUM,10RB+ Terjual,Rp49.500,KAB. SUKOHARJO
11,Common Goods Short Sleeve Oversize T-Shirts - Black (Hitam),10RB+ Terjual,Rp69.300,KOTA JAKARTA BARAT
12,SIPOLOS Kaos Polos Basic Cotton Combed 24s,10RB+ Terjual,Rp75.000,KOTA BANDUNG
13,ELLIPSESINC Kaos Oversize Pria & Wanita Polos,"6,6RB Terjual",Rp56.000,KOTA JAKARTA BARAT
14,KAOS OVERSIZE COMBED 24s TEBAL | UNISEX PRIA WANITA | KOREAN T-SHIRT VIRAL,10RB+ Terjual,Rp43.000,KOTA PEKALONGAN
15,KAOS POLOS OVERSIZE COTTON COMBED 24S OVERSIZED TSHIRT BIG SIZE UNISEX PRIA WANITA,"9,9RB Terjual",Rp57.000,KOTA JAKARTA BARAT
16,CLOSETWEAR KAOS POLOS OVERSIZE COTTON COMBED 24S PREMIUM UNISEX,213 Terjual,Rp87.500,KOTA JAKARTA BARAT
17,MATSUDA Kaos Polos Pocket T Shirt Cotton Chuo,"3,2RB Terjual",Rp55.000,KOTA JAKARTA UTARA
18,Infinide T-Shirt Kaos Polos Big Oversize Hitam Cotton Combed 24s Premium,"6,6RB Terjual",Rp59.000,KAB. TANGERANG
19,Kaos Polos H&M Regular Fit / Kaos Polos Hnm Pria Wanita / Baju Polos Pria Wanita,"1,2RB Terjual",Rp51.490,KAB. BANDUNG
20,Aerostreet T Shirt Oversize Polos Gelap Kaos T-Shirt LAAAA,"1,7RB Terjual",Rp69.900,KAB. KLATEN
21,T-shirt Oversize | Kaos Polos | Basic | White | Brainsgland,724 Terjual,Rp49.500,KOTA TANGERANG
22,Otsky Kaos Oversize Pocket Polos Cotton 24s,938 Terjual,Rp64.900,KOTA BANDAR LAMPUNG
23,Seka Basics - Kaos Polos Jet Black 30s,10RB+ Terjual,Rp52.500,KOTA BANDUNG
24,KAOS POLOS PREMIUM COTTON COMBED 30S,10RB+ Terjual,Rp35.900,KAB. SUKOHARJO
25,Eltergo Kaos Distro Polos Pria Dan Wanita Jumbo Warna Terbaru Dewasa Over Size Oblong Premium Termurah Kekinian,71 Terjual,Rp22.260,KOTA JAKARTA BARAT
26,(TEBAL) KAOS POLOS COTTON COMBED 24S REAKTIF WARNA SOLID UNISEX PRIA DAN WANITA DISTRO,10RB+ Terjual,Rp34.800,KAB. BANDUNG
27,KAOS FLOPPY POCKET OVERSIZED TEES / KAOS OVERSIZED / KAOS POCKET/KAOS POLOS,10RB+ Terjual,Rp64.000,KOTA BANDUNG
28,KAOS POLOS / KAOS OBLONG / KAOS DISTRO / KAOS PRIA DAN WANITA / KAOS MURAH / POLOS / HITAM / PUTIH / TERLARIS,10RB+ Terjual,Rp18.330,KOTA JAKARTA BARAT
29,Monellina V.PDK Kaos Oversize Wanita Lengan Pendek V-Neck Polos,10RB+ Terjual,Rp25.000,KOTA JAKARTA BARAT
30,KAOS POLOS OVERSIZE DARK GREY HEAVY COTTON COMBED 20S/24S UNISEX [POLOSAN SOC] (BISA COD),13 Terjual,Rp49.300,KOTA SURAKARTA (SOLO)
31,ZION Basic Kaos Polos Cotton Combed 24s - Toffee,"2,8RB Terjual",Rp38.000,KOTA JAKARTA BARAT
32,SHINE - KAOS POLOS OVERSIZE COTTON COMBED 24s PRIA WANITA UNISEX,172 Terjual,Rp48.800,KOTA DEPOK
33,ADLER LITE Oversized T-Shirt White,941 Terjual,Rp40.000,KOTA JAKARTA TIMUR
34,KAOS POLOS JUMBO BASIC XXL LD120 XXXL LYFE,"5,2RB Terjual",Rp30.000,KOTA JAKARTA PUSAT
35,Seka Basics - Kaos Polos Putih 30s,"9,5RB Terjual",Rp52.500,KOTA BANDUNG
36,KAOS POLOS OVERSIZE COTTON COMBED 24s PRIA DAN WANITA,"4,7RB Terjual",Rp59.800,KOTA BANDUNG
37,"YORAKU - Kaos Oversized 24s Polos / T-Shirt Polos Oversize L,XL,XXL | Atasan Kaos Unisex Premium",665 Terjual,Rp47.500,KOTA PEKALONGAN
38,KAOS POLOS PRIA KATUN 30S M.L.XL.XXL,10RB+ Terjual,Rp21.500,KOTA JAKARTA BARAT
39,Kaos Polos Oversize Pria | Kaos Polos Pria Oversize Pocket | Kaos Oversize Pria Polos Pocket | Kaos Oversize Polos 24s | Poloshopedia,86 Terjual,Rp53.900,KAB. BANDUNG
40,Pojok Busana T-Shirt Polos Cotton Blend Unisex - Kaos Oblong Basic Pria Wanita Lengan Pendek - Putih Hitam Navy Warna Warni,"6,8RB Terjual",Rp39.900,KOTA JAKARTA UTARA
41,(PROMO) Kaos stripe kaos distro kaos salur pria wanita kaos polos kaos belang cotton combed kaos garis dewasa kaos cowok terbaru 2022 | Paulsan,10RB+ Terjual,Rp37.900,KAB. BANDUNG
42,KAOS POLOS OVERSIZE HITAM HEAVY COTTON COMBED 20S/24S UNISEX [POLOSAN SOC] (BISA COD),63 Terjual,Rp53.650,KOTA SURAKARTA (SOLO)
43,Kaos Polos COOLSOFT COTTON BAMBOO 100% Ringspun Katun Bambu Reaktif 30,10RB+ Terjual,Rp45.900,KAB. BEKASI
44,Seka Basics - Kaos Polos Hijau Army ( Green Army ) 30s,"2,2RB Terjual",Rp52.500,KOTA BANDUNG
45,Pojok Busana T-Shirt Cotton Blend Unisex Pria Wanita - Kaos Katun Polos Unisex Basic Pria Wanita - Baju Oblong Lengan Pendek Putih Hitam Warna Warni - Tee Shirt Plain Unisex,507 Terjual,Rp39.900,KOTA JAKARTA UTARA
46,Infinide Kaos Polos Pendek Cotton Combed 30s Premium / Kaos Polos Bandung / Kaos Polos Tangerang / Kaos Polos Jakarta / Kaos Polos Bekasi/ Kaos Polos Bogor,10RB+ Terjual,Rp55.000,KAB. TANGERANG
47,FortKlass KAOS POLOS PRIA COTTON COMBED 30S REGULER FIT KAOS OBLONG REGULER UNISEX MIX,"4,5RB Terjual",Rp35.000,KOTA JAKARTA BARAT
48,Otsky Kaos Polos Lengan Pendek Tshirt Cotton Combed 24s - 5C,10RB+ Terjual,Rp59.900,KOTA BANDAR LAMPUNG
49,ADLER LITE Oversized T-Shirt Khaki,901 Terjual,Rp40.000,KOTA JAKARTA TIMUR
50,KAOS POLOS O-NECK LENGAN PENDEK COTTON COMBED 30S,10RB+ Terjual,Rp25.900,KOTA JAKARTA UTARA
51,(Lebih Tebal) Kaos Polos Hitam Pria Wanita Unisex Bahan Katun PE 24s Tebal Halus Lembut,"1,9RB Terjual",Rp23.999,KOTA SURAKARTA (SOLO)
52,SIPOLOS Kaos Polos Twotone Cotton 30s,10RB+ Terjual,Rp45.000,KOTA BANDUNG
53,ZION Kaos Polos 100% Cotton Combed 24s Premium - Dark Olive,"1,4RB Terjual",Rp38.000,KOTA JAKARTA BARAT
54,KAOS POLOS PREMIUM COTTON COMBED 24S REGULER FIT UNISEX T-SHIRT ONECK PRIA WANITA LENGAN PENDEK,"6,2RB Terjual",Rp46.000,KOTA JAKARTA BARAT
55,KAOS POLOS OVERSIZE UNISEX COTTON COMBED 24S PREMIUM OVERSIZED TSHIRT NEW COLOUR,10RB+ Terjual,Rp63.440,KOTA BANDUNG
56,ADLER Oversized Lite T-Shirt Olive,KOTA JAKARTA TIMUR,Rp47.000,Produk Serupa
57,KOZE - Premium Pocket Comfort Black T-shirt - Kaos Polos Hitam Dengan Kantong,"1,7RB Terjual",Rp39.000,KOTA JAKARTA TIMUR
58,Oversized T- Shirt Pria Wanita,10RB+ Terjual,Rp74.000,KOTA BANDUNG
59,Basic Oversize T-Shirt | Maple Brown | Unisex | Famous Monkey,33 Terjual,Rp78.000,KOTA JAKARTA UTARA
