,Title,Total,Price,Location
0,Holder Case Charger Storage Earphone Waterproof JOYSEUS - OT0003,10RB+ Terjual,Rp18.657,KOTA JAKARTA UTARA
1,Case pouch box for Headphone Headset Marshall Audio Technica jbl Sony,83 Terjual,Rp99.900,KOTA JAKARTA PUSAT
2,Orico PBD8 Headphone Storage Bag,182 Terjual,Rp28.000,KOTA JAKARTA UTARA
3,Baseus D02 Pro Foldable Headphone Bluetooth Wireless/Wired V5.0,10RB+ Terjual,Rp299.000,KOTA TANGERANG
4,Headset Case Hardcase Sony Headphone Pouch Hard Case bag for Sony JBL,210 Terjual,Rp189.000,KOTA JAKARTA TIMUR
5,Universal Hard Case Eva Tempat Headphone sesuai gambar 210 x 185 x 60 mm,"1,4RB Terjual",Rp29.900,KOTA TANGERANG SELATAN
6,MPOW Sarung Headphone EVA Universal Carrying Case - RV77 - ELNK,36 Terjual,Rp18.500,KOTA JAKARTA BARAT
7,Case tempat headphone universal headphone hardcase melindung headphone anda dari benturan 21 x 19 x,632 Terjual,Rp29.900,KOTA TANGERANG SELATAN
8,Premium Quality Audio Technica Headphone Case Carrying Box,63 Terjual,Rp50.000,KAB. TANGERANG
9,Marshall Case Casing Penyimpanan Headphone Anti Bentur Untuk Marshall Cover Bag Box,19 Terjual,Rp45.801,Luar Negeri
10,tas pelindung headphone headset eva case rainproof waterproof tempat penyimpanan kotak aksesoris,157 Terjual,Rp47.500,KOTA JAKARTA BARAT
11,Case Box Headphones Headphone Hard Shell Waterproof - Nbbox PH-HE1,171 Terjual,Rp44.300,KOTA TANGERANG
12,Hardcase Pouch Box Dompet Headphone Headset Marshall Major,56 Terjual,Rp97.000,KAB. TANGERANG
13,Earphone Protective Case for OPPO Enco Air Silicone Headphone Carrying Box,23 Terjual,Rp22.012,Luar Negeri
14,btsg Portable Hard Carrying Case Folding Storage Bag Box for AKG y50 JVC Headphone Accessories,46 Terjual,Rp80.416,Luar Negeri
15,Case Charging Box Headphone Wireless Bluetooth Bentuk Konsol Game Untuk AirPods 1 / 2 / 3,21 Terjual,Rp34.855,Luar Negeri
16,Hard case pouch Headphone earphone headset for Sony JBL Audio Technica,585 Terjual,Rp149.900,KOTA JAKARTA PUSAT
17,EVA Universal Carrying Storage Case for Headphones - B-15 - OMSKBKBK Black,346 Terjual,Rp28.905,KOTA TANGERANG SELATAN
18,Omooji - D014 Dompet Headset Travel Case / Tempat Headset / Earphone Case Mini / Kotak Headset,"4,6RB Terjual",Rp3.490,KAB. TANGERANG
19,Tas/Case Headphone | Bahan Case EVA Berkualitas Tahan Benturan 21 x 19 x 6 cm - Black,81 Terjual,Rp25.930,KAB. SLEMAN
20,KZ Earphone Case Storage Carrying Hard Bag Box Case for KZ ZSN PRO X KZ ZST X,"1,1RB Terjual",Rp16.500,KOTA JAKARTA BARAT
21,Hard Case untuk Headphone Headset Earphone,82 Terjual,Rp24.500,KOTA JAKARTA TIMUR
22,(All13) Tas Penyimpanan Headphone Portable Anti Knock,78 Terjual,Rp65.479,Luar Negeri
23,Tas kantong Box Case Headphone Headset Hard Shell Waterproof 111130,19 Terjual,Rp69.000,KOTA JAKARTA SELATAN
24,MOJITO Hard Storage Case Travel Box for Sennheiser HD598 HD600 HD650 Headphones,12 Terjual,Rp112.603,Luar Negeri
25,Hard Case Penyimpanan Headphone / Earphone,10 Terjual,Rp18.504,Luar Negeri
26,Portable Container Headphone Protective Storage Box Colorful Headphone Case Travel Earphone Data Cable Charger Storage Bag Box,23 Terjual,Rp79.287,Luar Negeri
27,TaffSTUDIO EVA Universal Carrying Storage Case for Headphones - B-15,60 Terjual,Rp33.500,KOTA JAKARTA PUSAT
28,Case EVA Kotak Penyimpanan Earphone Aksesoris Gadget Wadah Mini Headset Kabel Charger Hard Casing Organizer Headset Smartphone HP Headphone Universal Silicone Storage Box,19 Terjual,Rp24.900,KOTA JAKARTA BARAT
29,Premium Quality Earphone Case Audio Technica Storage Box,56 Terjual,Rp25.000,KAB. TANGERANG
30,Headphone Pouch Hard Case bag,12 Terjual,Rp30.000,KAB. TANGERANG
31,Earphone Case Box Storage Bag Cartoon big Zipper Hard Headphone Case Protective USB Cable Organizer Portable Earbud Accessories,136 Terjual,Rp41.392,Luar Negeri
32,NB Hard ANTI AIR Soft case Headphone Portable tempat headphone carry,17 Terjual,Rp60.000,KOTA BANDUNG
33,Kotak Earphone Knowledge Zenith Box Case EVA - B001,73 Terjual,Rp8.900,KOTA JAKARTA BARAT
34,{LUCKID}Cable Earphone Headphone Bag Carry Storage Box Earbud Hard Case Travel Portable,3 Terjual,Rp12.444,Luar Negeri
35,Universal Headphone Case for audio technica AKG dll,20 Terjual,Rp99.000,KOTA SURABAYA
36,btsg Portable Headphone Earphone Carrying Hard Case Protective Cover Storage Bag Box for HD419 439 HD598CS 599 202 HD4.50BT Headset Accessories,16 Terjual,Rp95.169,Luar Negeri
37,CHINK 1 Pair Replacement Silicone Ear Pads Cushion Cover For AirPods Max Headphone Headsets Protective Case Sleeve,74 Terjual,Rp31.531,Luar Negeri
38,(Newwavebar & 3c) Casing Hardcase Penyimpanan Headset Headphone,13 Terjual,Rp18.297,Luar Negeri
39,Kreatif Lakers NBA Lembut tpu Transparan Kompatibel Untuk Airpods1 2gen3 pro2 2022 Case Shockproof Airpods Wireless Bluetooth Headphone Shell Persegi Silikon Penutup Pelindung,124 Terjual,Rp37.377,Luar Negeri
40,dbE Headphone Hardcase Size L,492 Terjual,Rp109.000,KOTA BANDUNG
41,Hard Case Headphone JBL T450BT / T460 BT/ T500BT,88 Terjual,Rp129.500,KOTA BOGOR
42,Carrying Storage Box Case Tempat Headphone Earphone Headset Universal - Case for Headphones AA / Tempat earphone/ Tas aerphone/ Penyimpanan handsate / Box Headset Tahan Benturan Box Penyimpanan Headphone Tempat Headphone Storage Hard Case Pouch Resleting,11 Terjual,Rp69.000,KOTA SURABAYA
43,Cute Boy Prince Bluetooth Earphone Charging Box Cover Pelindung Untuk Airpods1 2 3 Pro 2 Pro2 Headphone Soft Cover Protector,18 Terjual,Rp24.829,Luar Negeri
44,Casing Headphone Bunga Lucu Kompatibel Untuk Airpods1 2 Pro Case Transparan Lembut TPU Cute Headphone Charging Box Dengan Gantungan Kunci,23 Terjual,Rp26.699,Luar Negeri
45,【Jakarta ready 】Baseus wm02 case Pelindung Kasus Pelindung Kartun Lucu Bluetooth Headset Case Soft Case,"1,8RB Terjual",Rp44.590,KOTA JAKARTA BARAT
46,KZ Bag Knowledge Zenith Headphone Case Carbon case storage earphone bag Kotak penyimpanan earphone Box,248 Terjual,Rp12.000,KOTA JAKARTA UTARA
47,Case Headphone Headset Earphone Tahan Guncangan,49 Terjual,Rp45.000,KOTA JAKARTA TIMUR
48,Waterproof bag headphone headset case penyimpanan serba guna gaming bluetooth tas tempat penyimpanan,32 Terjual,Rp45.800,KOTA JAKARTA BARAT
49,KZ Bag Knowledge Zenith Earphone Case Carbon,"8,2RB Terjual",Rp15.000,KAB. TANGERANG
50,Earphone Casing Box [Kotak],45 Terjual,Rp20.000,KOTA JAKARTA BARAT
51,Cartoon Mini Zipper Hard Headphone Holder Case Portable Earbuds Pouch box Earphone Storage Bag Protective USB Cable Organizer,Luar Negeri,Rp48.102,Produk Serupa
52,UNIVERSAL CARRYING STORAGE CASE HEADPHONE HEADSET HETSET GAME GAMING WADAH TEMPAT CASING BLUETOOTH BAG TRAVEL WIRELESS EARPHONE DOMPET BASS BAS WATERPROOF ANTI AIR EVA JBL KABEL MIC MICROPHONE MIKROFON BANDO STEREO SMARTPHONE HP PC ZENITH HANSFREE HIFI,13 Terjual,Rp32.900,KOTA JAKARTA TIMUR
53,Smiley Lucu Berkedip Transparan Lembut tpu casing Dengan lanyard Kompatibel Untuk airpods Pro1 /2 /3 pro2 2022 case Apple Bluetooth Wireless Headphone Charging box Penutup Pelindung,9 Terjual,Rp43.096,Luar Negeri
54,Earphone Case PU Leather Portable Waterproof Earthquake Resistant Earphone Storage Bag,79 Terjual,Rp5.000,KOTA BOGOR
55,Oxihom Tool Box Kotak Obat Kotak Penyimpanan Box Mainan Box Plastik Box Pancing,785 Terjual,Rp108.900,KOTA JAKARTA UTARA
56,"Deli Tool box / Kotak Perkakas Plastik 12"" Kuat 2 Tingkat DL4326xx",396 Terjual,Rp350.000,KAB. TANGERANG
57,"Deli Tool Box / Kotak Perkakas Ukuran Besar 20"" Material Baja DL432020",3RB Terjual,Rp234.000,KAB. TANGERANG
58,ISKU Tool Box Besar 17/19 Inch Bahan PP Toolbox Kotak Peralatan Perkakas/kotak perkakas,636 Terjual,Rp229.000,KOTA JAKARTA BARAT
59,stethoscope case sthetoscope box hitam,2 Terjual,Rp99.000,KOTA TANGERANG
