,Title,Total,Price,Location
0,M231 Kemeja Pria Basic Polos Panjang Hitam 1468D,1RB+ Terjual/ Bulan,Rp144.000,KAB. TANGERANG
1,KEMEJA FLANEL PRIA LENGAN PANJANG DISTRO FANEL MOTIP KOTAK TERBARU TERPOPULER,1RB+ Terjual/ Bulan,Rp65.000,KOTA BANDUNG
2,(BISA COD) KEMEJA FLANEL PREMIUM LENGAN PANJANG BRILL EIGHTY EIGHT TC002,1RB+ Terjual/ Bulan,Rp117.970,KOTA TANGERANG
3,M231 Jaket Over Shirt Pria Panjang Khaki 2269A,438 Terjual/ Bulan,Rp199.000,KAB. TANGERANG
4,Kemeja Flanel Pria Lengan Panjang Motif Kotak Kotak Kualitas Premium Flanel Terbaru 2021 Premium,1RB+ Terjual/ Bulan,Rp65.750,KAB. BREBES
5,Kemeja Flanel Impor Pria Kualitas Premium Lengan Panjang Unisex Hem Flannel Baju Flanel Pria Wanita Motif Kotak Kotak,1RB+ Terjual/ Bulan,Rp48.000,KAB. PEMALANG
6,Kemeja Flanel Import Pria Wanita Premium Lengan Panjang Unisex Kualitas Distro Hem flannel,1RB+ Terjual/ Bulan,Rp49.999,KAB. PEKALONGAN
7,Kemeja Flanel pria wanita unisex flannel import Lengan Panjang,1RB+ Terjual/ Bulan,Rp64.675,KAB. PEMALANG
8,Kemeja Flanel Impor Pria Distro Flannel Lengan Panjang Pria Kemeja Kotak Kotak Pria Lengan Panjang,1RB+ Terjual/ Bulan,Rp48.618,KAB. PEMALANG
9,Kemeja Flanel Pria Lengan Panjang Motif Kotak Kotak Kwalitas Premium Flanel Terbaru 2022 pria lengan panjang distro kasual santai casual katun kerja kantor putih merah marun hitam premium pria cowok laki laki wanita cewek perempuan terlaris murah viral,1RB+ Terjual/ Bulan,Rp54.000,KOTA PEKALONGAN
10,Kemeja Flanel Impor Pria Kualitas Premium Lengan Panjang Motif Kotak Kotak Unisex Hem Flannel Baju Flanel Pria Wanita,1RB+ Terjual/ Bulan,Rp54.600,KAB. PEMALANG
11,Kemeja Flanel Pria Lengan Panjang Motif Kotak Kotak Kualitas Premium Flanel Terbaru 2021 Premium,1RB+ Terjual/ Bulan,Rp54.400,KAB. PEKALONGAN
12,(NEW - 16Motif) KEMEJA FLANEL LENGAN PANJANG UNISEX PREMIUM l FLANNEL HEM KOTAK KATUN ARUNA FOURMINE REGGO T-SHIRT Predz oxcon BRILL EIGHTY EIGHT tartan outfit nine COD JUMBO virada.id 3second pique heymale polos terlaris ori OFFICIAL Mall STORE,1RB+ Terjual/ Bulan,Rp116.400,KOTA TANGERANG
13,KEMEJA KIMBERLY OVERSIZE FLANEL SHIRT,1RB+ Terjual/ Bulan,Rp51.900,KAB. PEKALONGAN
14,"Kemeja Flanel Impor Pria Distro Flannel Lengan Panjang Pria,Kemeja Kotak Kotak Pria Lengan Panjang",1RB+ Terjual/ Bulan,Rp54.400,KAB. PEKALONGAN
15,KEMEJA TAMARA BATWING FLANEL OUTER || KEMEJA KOTAK BEST SELLER,1RB+ Terjual/ Bulan,Rp47.199,KAB. PEKALONGAN
16,flanel wanita panjang kemeja flannel best seller,1RB+ Terjual/ Bulan,Rp49.999,KAB. PEMALANG
17,Kemeja Flanel Pria Lengan Panjang Motif Kotak Kotak Kwalitas Premium Flanel Terbaru 2022,1RB+ Terjual/ Bulan,Rp69.300,KAB. PEKALONGAN
18,MSMO MEN Flanel Shirt LS / Kemeja Flanel Pria / Kemeja Pria,1RB+ Terjual/ Bulan,Rp299.000,KOTA JAKARTA BARAT
19,KEMEJA FLANEL PRIA IMPOR PREMIUM LENGAN PANJANG DISTRO FANEL MOTIP KOTAK TERBARU TERPOPULER FLANNEL,1RB+ Terjual/ Bulan,Rp52.459,KAB. PEMALANG
20,ZWECKOUT LABEL - Kemeja Pria Flanel Premium Lengan Panjang Kotak Hitam,1RB+ Terjual/ Bulan,Rp89.900,KAB. BANDUNG
21,FLANEL PRIA LENGAN PANJANG KEMEJA FLANNEL WANITA CROP KOTAK KOTAK OVERSIZE KEBESARAN 2023,1RB+ Terjual/ Bulan,Rp49.999,KAB. PEMALANG
22,JUMBO-COD KEMEJA FLANEL LENGAN PANJANG BRILL EIGHTY EIGHT PREMIUM l JUMBO l OVERSIZE l BIGSIZE l XXL - XXXL l FLANNEL PLANEL OVERSIZE HAYMEE HAYMEESTORE mikaylaku miniso spartan jack brown predz sixtyone 888 PRIA WANITA,1RB+ Terjual/ Bulan,Rp142.500,KOTA TANGERANG
23,Kemeja Flanel Pria Wanita Lengan Panjang Original Branded Pakaian Pria Lengan Panjang Motif Kotak Kotak Exclusive 2023 Terlaris,1RB+ Terjual/ Bulan,Rp61.750,KAB. PEMALANG
24,Kemeja Flanel Pria Impor Wanita Kualitas Premium Lengan Panjang Unisex Distro Fanel Motif Motip Kotak Kotak Flannel Terbaru Exclusif Planel Berkwalitas Terpopuler,1RB+ Terjual/ Bulan,Rp50.000,KAB. PEMALANG
25,Kemeja Flanel Pria Impor Kualitas Premium Lengan Panjang Motif Kotak Kotak Unisex Hem Flannel Baju Kemeja Flanel Wanita Pria,1RB+ Terjual/ Bulan,Rp50.434,KAB. PEMALANG
26,Kemeja Flanel Pria Lengan Panjang Distro Flanel Motif Kotak Terbaru Terpopuler,1RB+ Terjual/ Bulan,Rp52.716,KAB. PEKALONGAN
27,Kemeja Flanel Import Pria Wanita Premium Lengan Panjang Unisex Kualitas Distro Hem flannel,1RB+ Terjual/ Bulan,Rp50.159,KAB. PEMALANG
28,BROTHER FLANEL Kemeja Flanel Pria Premium Lengan Panjang Ukuran M L XL,1RB+ Terjual/ Bulan,Rp84.000,KOTA BANDUNG
29,(Bisa COD) Kemeja Flanel Lengan Panjang Pria Wanita Motif Garis Kameja Flannel Kerja Kantor Formal Kasual Resmi Outer Basic By Blurrystore,1RB+ Terjual/ Bulan,Rp70.000,KOTA BANDUNG
30,FLANNEL HOODIE ORIGINAL [PREMIUM QUALIY] M L XL #HRZ,1RB+ Terjual/ Bulan,Rp93.600,KOTA BANDUNG
31,0Kemeja Flanel Impor Pria Kualitas Premium Lengan Panjang Unisex Hem Flannel Baju Flanel Pria Wanita Motif Kotak Kotak,1RB+ Terjual/ Bulan,Rp64.505,KAB. PEKALONGAN
32,DGM Fashion Kemeja Flanel Pria Premium Kemeja Flanel Pria Kemeja Kasual Flanel Pria Premium,1RB+ Terjual/ Bulan,Rp337.500,KOTA TANGERANG SELATAN
33,"Kemeja Flanel Impor Pria Distro Flannel Lengan Panjang Pria,Kemeja Kotak Kotak Pria Lengan Panjang",1RB+ Terjual/ Bulan,Rp48.000,KAB. PEKALONGAN
34,Kemeja Flanel Pria Lengan Panjang Motif Kotak Kotak Kualitas Premium Flanel Terbaru 2022 Premium,1RB+ Terjual/ Bulan,Rp49.800,KAB. PEMALANG
35,Flanel Wanita Panjang Atasan Flanel Remaja Kemeja Kotak Wanita,1RB+ Terjual/ Bulan,Rp49.500,KAB. PEMALANG
36,"Kemeja Flanel Impor Pria Distro Flannel Lengan Panjang Pria,Kemeja Kotak Kotak Pria Lengan Panjang",939 Terjual/ Bulan,Rp55.900,KAB. PEKALONGAN
37,KEMEJA PRIA PANJANG KEMEJA WANITA PANJANG DISTRO KEMEJA PREMIUM KEMEJA FLANEL/FLANNEL KOTAK KOTAK,929 Terjual/ Bulan,Rp55.250,KAB. PEMALANG
38,Heyfreak L-shirt Flanel Bio,902 Terjual/ Bulan,Rp199.000,KOTA SERANG
39,Kemeja Flanel Pria Lengan Panjang Motif Kotak Kotak Kualitas Premium Flanel Terbaru 2023 Premium,841 Terjual/ Bulan,Rp56.250,KAB. PEMALANG
40,KEMEJA FLANEL KOTAK KOTAK KASUAL WANITA LENGAN PANJANG / ATASAN CEWEK OUTFIT FLANEL,833 Terjual/ Bulan,Rp49.300,KAB. PEMALANG
41,flanel pria jumbo panjang XXL XXXL XXXXL - kemeja flanel big size lengan panjang premium - flanel jumbo lengan panjang import motif kotak kotak distro terbaru 2022 2xl 3xl 4xl,800 Terjual/ Bulan,Rp79.950,KOTA BANDUNG
42,Kemeja Flanel Pria Lengan Panjang Motif Kotak Kotak Kualitas Premium Flanel Terbaru 2021 Premium,788 Terjual/ Bulan,Rp54.400,KAB. PEKALONGAN
43,NEW! Flanel panjang surfing tebal dan tidak berbulu / flanel kotak-kotak #mph62,778 Terjual/ Bulan,Rp70.400,KOTA BANDUNG
44,kemeja flanel kotak wanita flannel distro,760 Terjual/ Bulan,Rp59.250,KAB. PEMALANG
45,Kemeja Flanel Pria Kualitas Premium Lengan Panjang Unisex Kemaja Flanel Kotak Kotak Pria Dan Wanita Kemeja Casual,741 Terjual/ Bulan,Rp48.720,KAB. PEMALANG
46,Kemeja Flanel Pria Import distro Lengan Panjang Premium Kemeja Flanel Kotak Kotak Pria Wanita Hem Flannel Baju Flanel Pria Wanita,738 Terjual/ Bulan,Rp54.450,KAB. PEMALANG
47,Kemeja Flanel Pria Import distro Lengan Panjang Premium Kemeja Flanel Kotak Kotak Pria Wanita Hem Flannel Baju Flanel Pria Wanita,737 Terjual/ Bulan,Rp48.000,KAB. PEMALANG
48,KEMEJA FLANEL LENGAN PENDEK PREMIUM | KEMEJA FLANEL PENDEK DEWASA | FLANEL LENGAN PENDEK | KEMEJA FLANEL PRIA,722 Terjual/ Bulan,Rp45.000,KAB. PEKALONGAN
49,SAMSAN Flanel Shirt | Kemeja Flanel by MARU,714 Terjual/ Bulan,Rp135.000,KAB. TANGERANG
50,REMORAGA STORE/ KEMEJA PRIA/ KEMEJA FLANEL PRIA/ FLANEL PRIA/ PANEL/ FLANEL/ FLANEL PRIA TERLARIS/ KEMEJA KOTAK/ KEMEJA DISTRO/ KEMEJA COWOK KEKINIAN/ KEMEJA TERLARIS/ KEMEJA TERBARU 2022,713 Terjual/ Bulan,Rp107.800,KOTA TANGERANG SELATAN
51,FLANEL PRIA JUMBO 5XL 6XL 7XL / XXXXXL XXXXXXL XXXXXXXL BIG SIZE,702 Terjual/ Bulan,Rp81.250,KOTA BANDUNG
52,atasan wanita kemeja flanel wanita flannel kemeja kotak kotak wanita,674 Terjual/ Bulan,Rp51.150,KAB. PEMALANG
53,0Kemeja Flanel Impor Pria Kualitas Premium Lengan Panjang Unisex Hem Flannel Baju Flanel Pria Wanita Motif Kotak Kotak,661 Terjual/ Bulan,Rp69.300,KAB. PEKALONGAN
54,KEMEJA FLANEL LENGAN PANJANG ORIGINAL BRANDED KEMEJA PRIA MOTIF KOTAK KOTAK FLANNEL SUPER PREMIUM 2023,648 Terjual/ Bulan,Rp61.750,KAB. PEMALANG
55,BRUNO OUTFIT KEMEJA FLANNEL LENGAN PANJANG hem kameja flanel shirt slim casual kasual pria wanita unisex jack brown san marino premium distro kotak kotak cewe cowo terlaris termurah import BRILL EIGHTY EIGHT virada.id vilora.id pique heymale clotheselite,249 Terjual/ Bulan,Rp105.840,KOTA TANGERANG SELATAN
56,Kemeja Flanel Pria dan Wanita Lengan Panjang kotak kotak Premium Unisex Flannel Hem Terlaris Uniqlo Brill Eighty Eight,1RB+ Terjual/ Bulan,Rp124.020,KOTA TANGERANG SELATAN
57,FICHINO Kemeja Flannel Cestano Maroon,14 Terjual/ Bulan,Rp120.000,KOTA BANDUNG
58,House of Smith Flanel Shirt - Kjanel GF9-5,37 Terjual/ Bulan,Rp122.000,KAB. BANDUNG
59,Kemeja flanel brill eighty eight lengan panjang premium MJ02,150 Terjual/ Bulan,Rp117.000,KOTA TANGERANG
