,Title,Total,Price,Location
0,Headphone Headband Cover Pelindung Kepala Penutup Headpad Headset,160 Terjual,Rp75.000,KOTA JAKARTA TIMUR
1,Headband Steelseries Arctis 3 5 7 9 9x Pro Gaming Headset Headphone,280 Terjual,Rp55.000,KOTA JAKARTA TIMUR
2,Cover Penutup Earpad Earcup Headset Sarung Pelindung Bantalan Busa Headphone Universal,64 Terjual,Rp32.500,KOTA JAKARTA BARAT
3,Earcup Earpad Ear Cushion Cushion ATH-ANC500BT WS660BT Busa Foam Bantalan,89 Terjual,Rp115.000,KOTA JAKARTA TIMUR
4,Headband Cover Headphone Besar Penutup Headband Headphone Bantalan Pelindung Headset Tahan Guncangan Tebal Universal,8 Terjual,Rp59.000,KOTA TANGERANG
5,Headband Cover Pelindung Headphone Headset head band phone set,626 Terjual,Rp55.000,KOTA JAKARTA TIMUR
6,Headband Cover Pelindung Headset ATH MSR7 M50X M40X M30 M20X MSR7NC ATH-DSR7BT ATH-SR9 ATH-DSR9BT ATH-M70x ATH-M50x ATH-M40x M30X M20X ATH-M50 ATH-M40 ATH-WS550IS ATH-WS770IS ATH-WS1100is,48 Terjual,Rp35.000,KOTA TANGERANG SELATAN
7,Headband headpad ATH-M20X M30X M40X M50X M70X MSR7 WS550IS MDR 1R / 1A,102 Terjual,Rp60.000,KOTA JAKARTA TIMUR
8,Dou 1pc Bantalan Headband Bumper Pengganti Untuk Headphone W800Bt W808Bt K800 K830 K815P K841P G1 G20,49 Terjual,Rp20.195,Luar Negeri
9,Cover Earpads headset headphone Premium Quality Bisa di cuci Ulang - Sarung ear pads 2 Size,93 Terjual,Rp37.000,KOTA JAKARTA BARAT
10,Dou Bumper Bantalan Headband Headphone Pengganti Untuk Qc2 Qc3 Qc15 Qc25 Qc35 Ii,55 Terjual,Rp30.021,Luar Negeri
11,btsg Headphones Headband Cushion Pads Bumper Cover Zipper Replacement for QC15 QC2 QC35 QC25 Headset,50 Terjual,Rp32.008,Luar Negeri
12,Bantalan Pelindung Headband Universal Bahan Wol Untuk Headphone Beats Pro Audio-Technica Msr7 M50X Sony,23 Terjual,Rp37.797,Luar Negeri
13,Headband Headphone Pengganti Untuk Jbl Tune600BTNC T660NC T510BT,46 Terjual,Rp24.638,Luar Negeri
14,Disposable Headphone Cover Sepasang Pelindung Busa Headset Earcup Pad,496 Terjual,Rp3.500,KOTA JAKARTA TIMUR
15,Busa Foam AKG Y50 Y55 Y50BT Earpad Ear Pad Earcup Ear Cup Cushion Bantalan Headband Head Band Bando Headpad Headset Replacement Pengganti,126 Terjual,Rp78.500,KOTA BEKASI
16,Cover/Sleeve/Pelindung Handuk untuk Headband Headphone Wool Rajutan,13 Terjual,Rp76.000,KOTA JAKARTA BARAT
17,Btsg Bantalan Headband Lembut Elastis Cover Proteksi Headset Headphone,45 Terjual,Rp56.647,Luar Negeri
18,Quu Headband Cushion Cover Headphones Protector for Technica MSR7 M50X M40X M30 MSR7,58 Terjual,Rp31.391,Luar Negeri
19,2pcs Sarung Cover Pelindung Headphone Anti Debu Dapat Dicuci Earcup Headphone Headset Earpad Ear Cushion Pad Pads,370 Terjual,Rp39.000,KOTA TANGERANG
20,Dou Bantalan Headband Pengganti Bahan Lembut Elastis Untuk Headphone Qc35 Qc25 Mdr Solo,54 Terjual,Rp61.855,Luar Negeri
21,Btsg Bantalan Headband Headphone Dengan Resleting Untuk Razer Kraken Pro 7.1 V2,52 Terjual,Rp41.491,Luar Negeri
22,Bantalan Headband Bumper Cover Headphone Pengganti Untuk Qc2 Qc3 Qc15 Qc25 Qc35 Ii,43 Terjual,Rp28.976,Luar Negeri
23,Headphone Cover Universal Sepasang,"1,6RB Terjual",Rp5.500,KOTA JAKARTA TIMUR
24,Bantalan Headband Pengganti Untuk Headphone Technica Ath M40X Ath-M40 Msr7 M20X M30X T50Rp Ath M50X M50,34 Terjual,Rp34.827,Luar Negeri
25,"Headband Cover Pelindung Headphone Headset head band phone set Headpad - Hitam, Kecil",9 Terjual,Rp59.000,KOTA JAKARTA TIMUR
26,Hai Bumper Cushion Cover Headband Pengganti Untuk Steelseries Arctis 1,25 Terjual,Rp44.084,Luar Negeri
27,Headphone Ear Foam Pad Ear Cushion Cover Sponge 65mm 70mm 75mm 80mm,"1,8RB Terjual",Rp10.000,KAB. TANGERANG
28,Btsg Cover Pelindung Earcup Headphone Anti Debu Bisa Dicuci Ukuran 6-9 - 11cm,355 Terjual,Rp20.601,Luar Negeri
29,INSLemon Segar Teh Botol BASEUSWM012Earphone Case04+proSilikon Drop-TahanE83Bluetooth Pelindung Case,1 Terjual,Rp40.228,KOTA JAKARTA BARAT
30,btsg Headphones Headband Cushion Pads Bumper Cover Button Replacement for Beyerdynamic DT770 PRO DT880 PRO DT990 PRO Headphone,33 Terjual,Rp41.065,Luar Negeri
31,Universal PU Leather Earshield Cushions Sponge Headphone Cup Pads Cover Headset Earcaps Portable Dustproof kitchentool01,539 Terjual,Rp35.768,Luar Negeri
32,Timetosport.id Mini Hairband Sport / Headband Sport / Ikat Kepala / Bando 3010,10RB+ Terjual,Rp4.999,KOTA JAKARTA BARAT
33,UGREEN Hard Cover Case Kecil untuk Earphone dengan Kantung Mesh dan Resleting,"1,4RB Terjual",Rp42.579,Luar Negeri
34,Durable Cloth Headband Protective Cushion For Arctis 3 5 Headset,116 Terjual,Rp38.895,Luar Negeri
35,RR Earpad Ear Pad Earphone Soft Foam Cushion Headband Cover Head Band Replacement for Sennheiser HD202 HD212 HD437 HD447 HD457 HD477 HD497 Headphones,31 Terjual,Rp28.333,Luar Negeri
36,Btsg Cover Pelindung Headband Headphone Untuk Technica Msr7 M50X M40X M30 Msr7,195 Terjual,Rp31.765,Luar Negeri
37,Dou Bantalan Headband Headphone Pengganti Dengan Resleting Untuk Qc15 Qc2 Qc35 Qc25,13 Terjual,Rp29.110,Luar Negeri
38,Hai Bantalan Headband Pengganti Untuk Headphone Hyperx Cloud Ii / Cloud Ii / Cloud Revolver S / Alpha,8 Terjual,Rp32.250,Luar Negeri
39,"10 x 50mm Foam Pads Ear Pad Sponge Earpad Headphone Cover For Headset 2""",48 Terjual,Rp16.434,Luar Negeri
40,Headband Pengganti untuk Audio Technica m30 M40 M50 m50x,57 Terjual,Rp36.687,Luar Negeri
41,Mini Hairband Sports Running Headband / Bando Olahraga Anti-slip,"6,3RB Terjual",Rp9.500,KOTA JAKARTA BARAT
42,DOU Replacement Silicone Sleeve Headset Accessory Headband Case Skin Cushion Protective Cover for -AirPods Max,143 Terjual,Rp44.037,Luar Negeri
43,✿ Earpad Ear Pad Earphone Soft Foam Cushion Headband Cover Head Band Replacement for Sennheiser HD202 HD212 HD437 HD447 HD457 HD477 HD497 Headphones,28 Terjual,Rp28.333,Luar Negeri
44,Dou Soft Case Silikon Model Headband Bisa Dicuci Untuk Earphone Tws Airpod Max,14 Terjual,Rp52.433,Luar Negeri
45,Logitech H111 Headset Stereo Dengan Headband Adjustable dan Single Jack 3.5mm,303 Terjual,Rp119.000,KOTA JAKARTA UTARA
46,Logitech H110 Headset Stereo dengan Headband Adjustable dan Dual Plug,9 Terjual,Rp103.000,KOTA SURABAYA
47,Logitech H111 Headset Stereo dengan Headband Adjustable dan Single Jack 3.5mm,10RB+ Terjual,Rp88.000,KOTA JAKARTA PUSAT
48,Logitech H110 Headset Stereo dengan Headband Adjustable dan Dual Plug,"8,9RB Terjual",Rp103.000,KOTA JAKARTA PUSAT
49,Jual bandana ikat kepala pria/ headband / hairband/ bando pria dan wanita/ pelindung rambut,"4,2RB Terjual",Rp18.333,KOTA BANDUNG
50,Utake Stretchable Washable Earcup Protector Headphone Dustproof Cover for Most On-Ear Headphones within 6-9/9-11cm Earpads,36 Terjual,Rp24.686,Luar Negeri
51,Bang Soft Ear pads Memory Foam Earpads Untuk WH-CH720N Bantal Telinga Headphone Elastis Penutup Kepala Headband Cover Slee,Rp72.994,Rp147.849,Luar Negeri
52,2 Pcs Busa Cover Soft Foam Earbud Earpad Headphone Headset 50mm-60mm Sepasang Busa Headphone Berdiameter 50mm / 60mm,KOTA SERANG,Rp8.000 - Rp10.000,Produk Serupa
53,DK Multifunctional Headwear Solid Black,"6,6RB Terjual",Rp27.000,KAB. BANDUNG
54,Aur Headband Pelindung Bahan Kain Tahan Lama Mudah Dipasang Untuk Headset Gaming Arctis 3 5,142 Terjual,Rp37.562,Luar Negeri
55,Headband Cover Headphone Besar Bantalan Pelindung Headset Tahan Guncangan Tebal Universal,38 Terjual,Rp59.000,KOTA TANGERANG
56,Headband Cover Headphone Besar Penutup Headband Headphone Bantalan Pelindung Headset Tahan Guncangan Tebal Universal,Rp49.000,Rp70.000,KOTA BANDUNG
57,1 Pasang Headphone Cover Anti Debu Cover Pelindung Sarung Earpad Earcup Untuk Gaming Headphone Hitam,11 Terjual,Rp39.000,KOTA TANGERANG
58,Headband Cover Pelindung Headphone Headset head band phone set,Rp49.000,Rp70.000,KOTA BANDUNG
59,WINDBLOWN BALON BANDO MR. P HEADBAND BLACK FOR BRIDAL SHOWER BRIDE TO BE NAUGHTY PARTY,138 Terjual,Rp55.000,KOTA JAKARTA BARAT
