,Title,Total,Price,Location
0,LED Color Light Cute Cat Ear Headphone with Mic B39M Foldable Wireless Headphones Bluetooth Earphone HiFi Stereo Headset Bluetooth Headset Gaming No Delay Henset Bloetooth,"9,9RB Terjual",Rp109.900,KOTA JAKARTA TIMUR
1,Razer Kaira X PS5 Wired Headset - White,Rp959.000,Rp1.059.000,KAB. TANGERANG
2,Fantech CHIEF II HG20 RGB Gaming Headset,"4,1RB Terjual",Rp185.000,KOTA JAKARTA BARAT
3,dbE GM190 7.1 Virtual Surround Gaming Headphone,4RB Terjual,Rp205.000,KOTA BANDUNG
4,Baseus D02 Pro Foldable Headphone Bluetooth Wireless/Wired V5.0,10RB+ Terjual,Rp296.000,KOTA TANGERANG
5,Rexus Headset Gaming Thundervox HX9 Surround 7.1,"5,3RB Terjual",Rp249.000,KOTA JAKARTA UTARA
6,QKZ AK6 AK6x AK6 Pro Max Earphone Quality Knowledge Zenith Gaming Sport Mic Bass not CK5,10RB+ Terjual,Rp78.999,KOTA JAKARTA UTARA
7,KZ EDX Pro with Mic Noise Cancelling Earphone Heavy Bass Sensation Sport Headset,10RB+ Terjual,Rp89.000,KAB. TANGERANG
8,JBL C150SI In-Ear Earphone cable with Mic - Garansi Resmi,10RB+ Terjual,Rp99.000,KOTA JAKARTA UTARA
9,Rokeet Earphone Headset Gaming Superbass Stereo+HD Hi-Fi Mic Jack 3.5mm,"3,8RB Terjual",Rp44.500,KOTA JAKARTA UTARA
10,Fantech FLASH HQ53 Headset Gaming Mobile TERLARIS,10RB+ Terjual,Rp109.000,KOTA JAKARTA BARAT
11,Rexus Headset Gaming Vonix F80 Free Splitter,"5,2RB Terjual",Rp225.000,KOTA JAKARTA UTARA
12,Acome Wired Earphone Headset AluminumAlloy Garansi Resmi 1 thn AW08,10RB+ Terjual,Rp26.900,KOTA JAKARTA UTARA
13,（HOT) ECLE Gaming Earphone PUBG Wired Headset In Ear Noice Reduction Double Microphone 6D Hi-Fi Sound Deep Bass,10RB+ Terjual,Rp59.900,KAB. BEKASI
14,Rexus Headset Gaming Vonix F27 / F-27 Free Splitter,"2,6RB Terjual",Rp129.000,KOTA JAKARTA UTARA
15,Rexus Earphone Gaming ME-6 / ME6 with Dual Microphone Free Splitter,"3,1RB Terjual",Rp139.000,KOTA JAKARTA UTARA
16,Rexus Earphone Gaming EZ4 with Mic,901 Terjual,Rp95.000,KOTA JAKARTA UTARA
17,Rexus Headset Gaming Vonix F30 FREE Splitter,10RB+ Terjual,Rp189.000,KOTA JAKARTA UTARA
18,Headset Gaming Komic HG-K602-RGB Breathing PC/Mobile Gratis Spliter Jack Kualitas Suara Yang Murni Dan Bagus,"2,6RB Terjual",Rp99.000,KOTA JAKARTA PUSAT
19,Xiberia Nubwo N2D Gaming Headset,191 Terjual,Rp109.000,KOTA JAKARTA BARAT
20,⚡IN JKT Headset Gaming PUBG Bass Noise Cancelling dengan Dual Mic Mobile Earphone Hifi Handsfree,10RB+ Terjual,Rp35.800,KOTA JAKARTA UTARA
21,Rokeet Headset Gaming Sport Music Surround Stereo Bass dengan Mic Earphone Headphone Gaming,"5,9RB Terjual",Rp35.100,KOTA JAKARTA UTARA
22,Armaggeddon Headset Mobile Gaming Earphone WASP 5 Dual Mic ULTRA BASS,10RB+ Terjual,Rp149.000,KOTA JAKARTA UTARA
23,Thinkplus Lenovo TH10 Headphone Bluetooth Wireless Headset Earphone 5.0,10RB+ Terjual,Rp209.000,KOTA TANGERANG
24,Earphone PLEXTONE G20 Mark IV In-Ear Gaming Stereo Bass,8RB Terjual,Rp149.000,KOTA JAKARTA TIMUR
25,GROTIC G3000 Headset Earphone Gaming PUBG Dual Microphone Musik Panggilan Telepon,"1,2RB Terjual",Rp64.000,KAB. TANGERANG
26,Fantech ECHO MH82 Headset Gaming Mobile,121 Terjual,Rp579.000,KOTA JAKARTA UTARA
27,Headset Gaming Headphone Gaming Noise Cancelling JETEX GA1- Garansi 2 Tahun,232 Terjual,Rp119.900,KOTA JAKARTA PUSAT
28,Rexus Headset Gaming Vonix F30 dengan LED RGB dan free splitter,"3,7RB Terjual",Rp162.000,KOTA JAKARTA PUSAT
29,Rexus Headset Gaming Bluetooth Thundervox Stream HX-28 / HX28,"1,1RB Terjual",Rp429.000,KOTA JAKARTA UTARA
30,⚡Headset Gaming N5 PUBG Bass Noise Cancelling with Mic Mobile Earphone Gaming Murah Hifi Handsfree,"3,3RB Terjual",Rp79.800,KOTA JAKARTA UTARA
31,QKZ AK6 Dengan Mic Earphone Sport Dynamic + Subwoofer Bass AK6 X Ak6 Ares alt KZ EDX Pro TRN MT1 Pro CCA CRA,10RB+ Terjual,Rp49.000,KOTA JAKARTA BARAT
32,Rexus Headset Gaming Thundervox Stream HX25,"3,5RB Terjual",Rp309.000,KOTA JAKARTA UTARA
33,Rokeet Headset Earphone Gaming Mega Bass Wired Jack 3.5mm MIC for Android iPhone Universal Original,"5,8RB Terjual",Rp44.900,KOTA JAKARTA UTARA
34,Headset Gaming Mic Earphone Gaming JETEX HX8 - Garansi 2 Tahun,"1,4RB Terjual",Rp79.900,KOTA JAKARTA PUSAT
35,⚡YZ Headset Gaming Sport Music 9D Surround Stereo Bass Hifi dengan Mic Earphone Headphone Gaming,10RB+ Terjual,Rp45.900,KOTA JAKARTA UTARA
36,Earphone In-Ear Gaming Headset Handsfree Superbass Bass Stereo + Mic Microphone,10RB+ Terjual,Rp29.999,KOTA JAKARTA UTARA
37,Earphone Headset Gaming with Mic JETEX HX10 - Garansi 2 Tahun,96 Terjual,Rp112.500,KOTA JAKARTA PUSAT
38,KIVEE Headset gaming macaron earphone musik original in ear Mikrofon Noise Cancellation Kabel Stereo 3.5mm,10RB+ Terjual,Rp45.503,KOTA JAKARTA UTARA
39,JOYSEUS Gaming headset earphone Bass Support TF headphone with mic JH01,793 Terjual,Rp65.000,KOTA JAKARTA BARAT
40,AUXOM Headset Gaming Wired Earphones with Microphone LED Light Stereo Bass Gaming Headphone Gamer for Phone Computer Laptop Earphones,10RB+ Terjual,Rp89.000,KOTA JAKARTA PUSAT
41,Baseus H17 Headset Handsfree Encok Jack 3.5mm Wired Earphone MIC,"8,5RB Terjual",Rp89.000,KOTA TANGERANG
42,Rexus Headset Gaming Wireless Daxa Saturn ST1,20 Terjual,Rp679.000,KOTA JAKARTA UTARA
43,JBL Quantum 50 Headset gaming wired in-ear - Garansi Resmi IMS,134 Terjual,Rp299.000,KOTA JAKARTA UTARA
44,Plextone G25 Gaming Earphone Noise Canceling Stereo alt G20,"9,5RB Terjual",Rp125.000,KOTA JAKARTA TIMUR
45,JBL T110 In Earphones with microphone - Garansi Resmi,10RB+ Terjual,Rp99.000,KOTA JAKARTA UTARA
46,Kivee headset earphone gaming musik in ear Original Xiaomi oppo bass Klasik putih hitam universal,10RB+ Terjual,Rp15.105,KOTA JAKARTA UTARA
47,Rexus Earphone Gaming EP4 Dual Driver With Mic,214 Terjual,Rp105.000,KOTA JAKARTA UTARA
48,HEADPHONE BLUETOOTH P47 Headset Bando Gaming Lipat Wireless Audio Stereo Super Bass 5.0 EDR Travel,10RB+ Terjual,Rp27.000,KOTA JAKARTA SELATAN
49,Thinkplus Lenovo XT81 Bluetooth Earphone Gaming Headphone Headset TWS,226 Terjual,Rp139.000,KOTA TANGERANG
50,Goone Headset Gaming & Music Earphone Lightning In ear Kompatibel untuk ios 7 8 x xs max xr 11 11pro 12,146 Terjual,Rp59.900,KAB. TANGERANG
51,Razer Hammerhead Pro V2 - In Ear Headphones with Microphone,"6,8RB Terjual",Rp479.000,KOTA JAKARTA BARAT
52,realme Buds 2 Neo,"5,3RB Terjual",Rp79.000,KOTA JAKARTA UTARA
53,Kivee Headset earphone gaming macaron Original In ear universal Xiaomi oppo 3.5mm,10RB+ Terjual,Rp35.000,KOTA JAKARTA UTARA
54,OLIKE HEADSET HANDSFREE 3.5MM WIRED IN EARPHONE NOISE REDUCTION DE-G2,10RB+ Terjual,Rp15.000,KAB. TANGERANG
55,Headset Gaming Sades A6 7.1 Surround Sound,151 Terjual,Rp400.000,KOTA JAKARTA PUSAT
56,LOG ON HEADSET GAMING DUAL MICROPHONE LO-RX9 SHOOTER HANDSFREE/EARPHONE,253 Terjual,Rp90.000,KOTA JAKARTA PUSAT
57,Rexus Headset Gaming Vonix F88 With RGB Headband,115 Terjual,Rp195.000,KOTA JAKARTA UTARA
58,Mediatech Gaming Earphone Dual Driver + Mic MGE - 01,316 Terjual,Rp109.000,KOTA JAKARTA UTARA
59,Nakamichi OW1300ANC Active Noise Cancelling Wireless Headphone ANC HD,44 Terjual,Rp469.000,KOTA JAKARTA BARAT
