,Title,Total,Price,Location
0,Baseus D02 Pro Foldable Headphone Bluetooth Wireless/Wired V5.0,10RB+ Terjual,Rp299.000,KOTA TANGERANG
1,LED Color Light Cute Cat Ear Headphone with Mic B39M Foldable Wireless Headphones Bluetooth Earphone HiFi Stereo Headset Bluetooth Headset Gaming No Delay Henset Bloetooth,"9,9RB Terjual",Rp109.900,KOTA JAKARTA TIMUR
2,Nakamichi OW1300ANC Active Noise Cancelling Wireless Headphone ANC HD,44 Terjual,Rp469.000,KOTA JAKARTA BARAT
3,Headset Sony WH-XB910N Wireless Headphone Noise Cancelling Battery up to 30h With Microphone For Android & IOS - Blue,34 Terjual,Rp2.799.000,KOTA JAKARTA PUSAT
4,Nakamichi OW1100ANC Active Noise Cancelling Wireless Headphone - Pink,44 Terjual,Rp269.000,KOTA JAKARTA BARAT
5,Thinkplus Lenovo TH10 Headphone Bluetooth Wireless Headset Earphone 5.0,10RB+ Terjual,Rp209.000,KOTA TANGERANG
6,MINISO Headphone Bluetooth Gaming Headset Wireless with Light Bass Stereo Headset Mic Cahaya Warna-Warni Dapat Dilipat On-ear Headphone Earphone Bluetooth Handsfree,"1,6RB Terjual",Rp149.000,KOTA JAKARTA UTARA
7,Nokia Wireless Bluetooth 5.0 Headphone / Headset with Mic E1200 - Black,2RB Terjual,Rp368.900,KOTA JAKARTA BARAT
8,Thinkplus Lenovo TH10 Headphone Bluetooth Wireless Headset Earphone 5.0,270 Terjual,Rp599.000,KOTA JAKARTA UTARA
9,JBL Tune 510BT Wireless On-Ear Headphones with Purebass Sound,2RB Terjual,Rp649.350,KOTA JAKARTA UTARA
10,NIVALIS17 HEADPHONE BLUETOOTH P47 Y08 GAMING MUSIC STUDIO PURE BASS HEADSET BANDO LIPAT HANDPHONE KOMPUTER WIRELESS SUPPORT HEADSET GAMING GAME,757 Terjual,Rp36.250,KOTA JAKARTA UTARA
11,Nokia Wireless Headphone Bluetooth 5.0 with Mic E1200 PLUS ANC - Beige,63 Terjual,Rp549.000,KOTA JAKARTA BARAT
12,Baseus Original D02 PRO Headphone Wireless Bluetooth 5.0 Stereo Head Phone Support Wired AUX 3.5mm,752 Terjual,Rp299.000,KAB. TANGERANG
13,Headphone Bluetooth Model Telinga Kucing LED Wireless Stereo Bass P47M,10RB+ Terjual,Rp42.000,KAB. TANGERANG
14,HEADPHONE BLUETOOTH P47 Headset Bando Gaming Lipat Wireless Audio Stereo Super Bass 5.0 EDR Travel,10RB+ Terjual,Rp27.000,KOTA JAKARTA SELATAN
15,Lenovo TH10 Headphone Bluetooth Wireless Headset Earphone 5.0 Stereo Bluetooth Headphone Headset Gaming,"2,9RB Terjual",Rp179.000,KOTA JAKARTA BARAT
16,Monster Storm XKH01 Headphone Bluetooth Headset Earphone,234 Terjual,Rp269.000,KOTA TANGERANG
17,Headphone HF Bluetooth Bando Cat Ear JST-28 BK58M LED Headset True Wireless Earphone Handsfree Kuping Kucing,"5,1RB Terjual",Rp67.000,KAB. TANGERANG
18,BONANZA High Quality Headphone Bluetooth Headset Wireless Stereo Bass P9,"1,8RB Terjual",Rp134.900,KAB. TANGERANG
19,Sony WH CH520 Wireless Headphones / WH-CH520 / WHCH520 / Sony WH-CH520,242 Terjual,Rp829.000,KOTA JAKARTA SELATAN
20,Lenovo TH10 Headphone Bluetooth Wireless Headset Earphone 5.0,"3,7RB Terjual",Rp209.000,KOTA JAKARTA BARAT
21,Lenovo TH10 Headphone Bluetooth Wireless Headset Earphone V5.0 - Hitam,"1,9RB Terjual",Rp189.000,KOTA JAKARTA PUSAT
22,Baseus Bowie H1 Headphone ANC Headset Bluetooth Wireless Earphone,710 Terjual,Rp669.000,KOTA TANGERANG
23,Lenovo TH10 Headphone Bluetooth 5.0 Wireless Headset Earphone Dual Mode Stereo Bass,727 Terjual,Rp189.000,KOTA JAKARTA BARAT
24,Headphone Wireless Cat Ear LED XY 205 / Cat Ear Noise Cancelling Headphone Bluetooth 5.0,"4,2RB Terjual",Rp50.000,KOTA JAKARTA BARAT
25,MINISO Headset Bluetooth Headphone Wireless Henset Bloetooth Earphone Bass Stereo Surround Bluetooth Earbuds Head Set Gaming Handsfree Suaranya Jernih Bassnya Mantab CD-Tekstur Model TM-053,954 Terjual,Rp179.900,KOTA JAKARTA UTARA
26,Headset Kucing LED TWS Bluetooth 5.0 Headphone Extra Bass,10RB+ Terjual,Rp79.000,KOTA JAKARTA PUSAT
27,ECLE Headphone Bluetooth Headset Bluetooth In-Ear Deep Bass Stereo + Nirkabel Hifi Stereo Bass Microphone Gaming Wireless Headphone,"1,7RB Terjual",Rp89.900,KAB. BEKASI
28,Headphone Bluetooth P47 Wireless Portable Bluetooth Headset Bass Handfree Earphone,10RB+ Terjual,Rp31.000,KOTA JAKARTA UTARA
29,HEADPHONE BLUETOOTH P47 Pro Pure Bass / Headset Bluetooth Gaming pugb for gamers Y08,10RB+ Terjual,Rp29.750,KAB. TANGERANG
30,Thinkplus Lenovo SH1 Sport Bluetooth Earphone Wirelesss Headset/Handsfree 5.0,10RB+ Terjual,Rp99.000,KOTA TANGERANG
31,Baseus H17 Headset Handsfree Encok Jack 3.5mm Wired Earphone MIC,"8,5RB Terjual",Rp89.000,KOTA TANGERANG
32,REALME P47 BLACK Headphone Wireless Portable Bluetooth Headset Bass,"1,6RB Terjual",Rp45.000,KOTA TANGERANG
33,Lenovo TH10 Headphone Bluetooth Wireless Headset Earphone V5.0 - Putih,960 Terjual,Rp186.120,KOTA JAKARTA PUSAT
34,MIINII Headphone Bluetooth STN-01 Wireless Bluetooth Headphone 5.0,"2,9RB Terjual",Rp187.720,KOTA JAKARTA BARAT
35,Thinkplus Lenovo GM2 Pro Bluetooth Earphone Gaming Headphone Headset TWS,248 Terjual,Rp149.000,KOTA TANGERANG
36,ECLE Wireless Bluetooth Headphone Foldable Headset Bluetooth with Noise Cancelling Gaming Lag-Free,"5,1RB Terjual",Rp99.900,KAB. BEKASI
37,Headset Bluetooth Headphone Wireless SonicGear AirPhone 6 with Mic | Up to 10 Hours PlayTime,"1,4RB Terjual",Rp199.000,KOTA JAKARTA UTARA
38,(HOT) ECLE Y08 Headphone Wireless Bluetooth Earphone Hi-Fi Sound Stereo Deep Bass All Color Variation Macaroon With Mic Microphone Bass Earphone Headset Bluetooth,8RB Terjual,Rp99.999,KAB. BEKASI
39,MINIBEST Headset Bluetooth inpods 12 TWS Macaron Earphone True Wireless Stereo HIFI Sentuh Earbud i12 MB-555,10RB+ Terjual,Rp39.900,KOTA JAKARTA BARAT
40,Headphone wirelles Bluetooth P47 / headset bluetooth Megabass,6RB Terjual,Rp50.000,KOTA JAKARTA BARAT
41,P9 Bluetooth Headphone Bluetooth 5.1 IPX4 Waterproof Wireless Headphones HiFi Stereo Headset Support TF Card With Microphone For PC Laptop Computer Gaming Sports Headphone,55 Terjual,Rp75.999,KOTA JAKARTA UTARA
42,Xiaomi Official Redmi Buds Essential Bluetooth® 5.2 IPX4 Suara Superior Baterai Hingga 18 jam Koneksi Mudah,"9,6RB Terjual",Rp199.000,KOTA JAKARTA UTARA
43,ECLE Y08 Headphone Gaming Wireless Headset Bluetooth Noise Reduction HiFi Stereo,"5,4RB Terjual",Rp99.900,KAB. BEKASI
44,P47 HEADPHONE MIC BLUETOOTH WIRELESS EARPHONE LIPAT BASS GAYA KEKINIAN,620 Terjual,Rp29.900,KAB. TANGERANG
45,Headphone Gaming Bluetooth + Free Kabel Jack 3.5mm - Headset Wireless Macaron Extra Bass,"7,3RB Terjual",Rp69.500,KOTA JAKARTA PUSAT
46,Nakamichi NHP-X2 Headphone Headset Wireless Bluetooth HD HIFI FM Mic,152 Terjual,Rp179.000,KOTA JAKARTA BARAT
47,bluetooth android p9 Over Ear Headphone high copy 9D clone,1RB Terjual,Rp110.000,KOTA JAKARTA PUSAT
48,B39/P47 LED Bluetooth Cat Headphone Bluetooth 5.0 Headset Noise Cancelling Wireless Headphones With Mic HiFi Stereo Earphones For Kid Gift PC Laptop Computer Gaming Accessories,71 Terjual,Rp65.999,KOTA JAKARTA UTARA
49,COD B39 Headphone Bluetooth Headset Musik Gaming dengan Lampu LED dan Mic Suara HIFI Bass Mantap,"1,3RB Terjual",Rp82.000,KAB. TANGERANG
50,LENOVO THINKPLUS TH10 HEADSET BLUETOOTH 5.0 HEADPHONE MIC NEW 100% ORIGINAL SEGEL,25 Terjual,Rp179.000,KOTA DEPOK
51,Headphone Bluetooth JETE 08 Pro Noise Cancelling Bluetooth 5.3 - Garansi 2 Tahun,118 Terjual,Rp259.900,KOTA JAKARTA PUSAT
52,AUXOM Headphone Wireless Cat Ear LED CT-86 / Cat Ear Noise Cancelling Headphone Bluetooth 5.0,"2,8RB Terjual",Rp69.000,KOTA JAKARTA PUSAT
53,Headphone Bluetooth P47 5.0+EDR Music Headset Wireless Bando Gaming Stereo Real Super Bass With Mic,"3,8RB Terjual",Rp27.000,KOTA JAKARTA SELATAN
54,KISONLI Headset Gaming Headphone Bluetooth A6 With Colorful Light & Mega Bass,53 Terjual,Rp132.050,KAB. TANGERANG
55,KiiP Wireless TH30 Headphone Bluetooth Wireless Headset Earphone,2RB Terjual,Rp219.000,KOTA TANGERANG
56,Headset Sony WH-1000XM4 Wireless HeadphonePremium Noise Cancelling Battery up to 30h With Microphone - Blue,100 Terjual,Rp3.899.000,KOTA JAKARTA PUSAT
57,Philips TAPH802 Black Wireless Bluetooth Headphones / TAPH 802,50 Terjual,Rp999.000,KOTA JAKARTA PUSAT
58,Smart Glasses Wireless Bluetooth 5.0 Sunglasses Outdoor Smart Sport Hands-Free Calling Calling Music Anti-Blue Eyeglasses,273 Terjual,Rp219.000,KOTA JAKARTA UTARA
59,Fingertime Headphone Bluetooth 5.0 Wireless Headset Earphones Hi-Fi Stereo BT06C,"1,6RB Terjual",Rp209.000,KOTA TANGERANG
