,Title,Total,Price,Location
0,JOYCON / JOY CON / JOYPAD WIRELESS CONTROLLER 3rd PARTY FOR NINTENDO SWITCH / V1 / V2 / OLED (1:1),101 Terjual,Rp499.000,KOTA JAKARTA UTARA
1,"I-ND PRO JOYCON CONTROLLER FOR SWITCH V1,V2,OLED",17 Terjual,Rp399.000,KOTA JAKARTA UTARA
2,Ipega PG-SW002 Mini Wireless Joystick Controller,4 Terjual,Rp305.000,KOTA JAKARTA PUSAT
3,X3 Wireless Controller/Bluetooth Gamepad/Game Console Operator Mendukung Mesin Game Android/iOS,Rp85.000,Rp185.000,KOTA JAKARTA UTARA
4,DOBE Nintendo Switch Joycon Wheel Grip Handle Single Joy Con Grip,20 Terjual,Rp49.000,KOTA TANGERANG
5,Stick Stik I-ND Joypad Joy Con Wireless Controller for Nintendo Switch,35 Terjual,Rp465.000,KOTA JAKARTA BARAT
6,Handlegrip Joy Con Joycon Joypad Wireless Controller Nintendo Switch,25 Terjual,Rp395.000,KOTA JAKARTA BARAT
7,JoyCon Joy Con Joy-Con Nintendo Switch,332 Terjual,Rp1.020.000,KOTA JAKARTA PUSAT
8,Controller Grip Joy-Con Handle Kit 2 Pack Nintendo Switch DOBE,339 Terjual,Rp34.500,KOTA BEKASI
9,DOBE JOYCON JOY PAD CONTROLLER JOY CON NINTENDO SWITCH V1 V2 OLED NFC TNS-0163,118 Terjual,Rp310.000,KAB. TANGERANG
10,WIN Left & Right Charging Grip V-Shaped Wireless Game Handle for NS Switch Joy-con,19 Terjual,Rp126.045,Luar Negeri
11,Joy Con Analog Joystick Thumb Stick Replacement Nintendo Switch,33 Terjual,Rp45.000,KOTA JAKARTA PUSAT
12,Analog Joy Con Joycon Joystick Controller Nintendo Switch,56 Terjual,Rp48.000,KOTA BEKASI
13,Nintendo Switch IINE Joycon Stick Stik Joy Con Anti Drift L241,13 Terjual,Rp75.000,KOTA JAKARTA BARAT
14,Skull & Co. Nintendo Switch D-Pad Button Cap ThumbStick Set Joy-Con,10 Terjual,Rp99.000,KOTA JAKARTA SELATAN
15,I-ND Nintendo Switch Joycon IND Joy con Gamepad Wireless Controller,5 Terjual,Rp549.000,KOTA SURABAYA
16,Metal Buckle Lock Joy Con Nintendo Switch Controller Logam Joycon Controller,95 Terjual,Rp19.500,KOTA BEKASI
17,Tombol Analog Stick Thumb Grip Silicon Silicone Cap Joycon Joy-Con Joy Con,"1,4RB Terjual",Rp15.000,KOTA JAKARTA PUSAT
18,Tali Strap Joy Con Remote Wii Nintendo PS Vita PSP Slim Fat 1000 2000 3000 Hand,229 Terjual,Rp9.900,KOTA BEKASI
19,Nintendo Switch Oled Dobe Charging Grip Joy Con JoyPad iTNS-880,7 Terjual,Rp90.000,KOTA JAKARTA BARAT
20,KJH Biohazard Gun Pistol For Nintendo Switch V1 V2 Oled Joy Con,8 Terjual,Rp90.000,KOTA JAKARTA BARAT
21,Silikon Analog Thumb Stick Super Mario Caps Joy-Con Nintendo Switch,"2,4RB Terjual",Rp7.000,KOTA BEKASI
22,Obeng Set Nintendo Switch Isi 3 Y Joy Con Joycon DS NDS Lite GBA SP,92 Terjual,Rp16.500,KOTA BEKASI
23,Analog Joy Con Original FLEXIBLE BIRU Nintendo Switch V1 V2 OLED Lite Tombol Joycon,200 Terjual,Rp34.000,KOTA BEKASI
24,SL SR Joy Con Nintendo Switch Kabel Tombol Flexible Flexy Trigger Controller V1 V2 OLED,163 Terjual,Rp17.900,KOTA BEKASI
25,IINE Charging Charger HandGrip Dock Joy-Con Joycon Nintendo Switch,35 Terjual,Rp120.000,KOTA BEKASI
26,Obeng Tri Wings Obeng Plus Reparasi Joy Con Controller Nintendo Switch (Presisi) (Kuat),14 Terjual,Rp20.000,KOTA JAKARTA PUSAT
27,Nintendo Switch IPEGA Charging Dock Stand 4 Slot Joy con PG 9186,14 Terjual,Rp115.000,KOTA JAKARTA BARAT
28,Hand Strap Wrist Bands Controller Handle Brace Nintendo Switch Joy-Con,56 Terjual,Rp65.000,KOTA BEKASI
29,Joycon Nintendo Switch HORI Joy Con Split Pad Pro,13 Terjual,Rp590.000,KAB. TANGERANG
30,Charger Charging Dock Nintendo Switch Joy-Con DOBE,167 Terjual,Rp90.000,KOTA BEKASI
31,2 Pcs Lanyard Wrist Gantungan Joy-Con JoyCon Joy Con Hand Strap Nintendo Switch OLED,105 Terjual,Rp45.000,KOTA BEKASI
32,DOBE CHARGING GRIP FOR NINTENDO SWITCH JOY CON,9 Terjual,Rp210.000,KOTA JAKARTA BARAT
33,8pcs Thumb Grip Analog Joy Con Nintendo Switch Dan Lite Silicone Silikon Joycon Thumbgrip,24 Terjual,Rp30.000,KOTA BEKASI
34,Analog Caps Thumb Grip Animal Crossing Joy Con Nintendo Switch Silicon,20 Terjual,Rp25.000,KOTA JAKARTA BARAT
35,Silicon Joycon Rubber Soft Case Joy Con Silikon Nintendo Switch,232 Terjual,Rp29.000,KAB. TANGERANG
36,Handgrip Joy Con T13 / Joy Pad / Joy Con For Nintendo Switch V2/OLED,21 Terjual,Rp285.000,KOTA JAKARTA UTARA
37,Nintendo Switch Joy Con JoyPad Wireless Controller 3RD Party (L) (R),1 Terjual,Rp429.000,KOTA JAKARTA BARAT
38,Tombol Analog Joy-Con Joycon Joy Con Replacement Parts Nintendo Switch,207 Terjual,Rp25.000,KOTA BEKASI
39,Cover Pelindung Joy Con Nintendo Switch Bahan Karet Silikon Anti Slip Untuk Joy Con Nx Joycon,117 Terjual,Rp25.006,Luar Negeri
40,Portable 6000mAh Rechargeable Power Bank Joy-con Grip Nintendo Switch,34 Terjual,Rp135.000,KOTA BEKASI
41,Thumb Grip Analog Joy Con Zelda Nintendo Switch Joycon V1 V2 OLED Lite Silicone Silikon,651 Terjual,Rp7.900,KOTA BEKASI
42,Baut Joy Con Y Screw Joycon Tri wing Nintendo Switch Controller PS5,177 Terjual,Rp2.550,KAB. TANGERANG
43,Joycon Dobe JoyPad Nintendo Switch Controller Joy Con NS Console Joy Pad Left Right Joy-Con NFC Joy-Pad,6 Terjual,Rp306.500,KAB. TANGERANG
44,T13 Joycon Joy Con Joypad 3RD Party + Handgrip Nintendo Switch,30 Terjual,Rp299.000,KOTA JAKARTA BARAT
45,T-22 Handgrip for N-SL joy-Con Nintendo Switch,13 Terjual,Rp325.000,KOTA JAKARTA BARAT
46,Vivi 1 Pasang Skin Grip Thumb Stick Analog Bahan Silikon Untuk Controller Joy-Con Nintendo Switch,45 Terjual,Rp13.443,Luar Negeri
47,6 in 1 Multi Charging Dock Joy-Con JoyCon Joy Con Game Card Docking Nintendo Switch OLED,8 Terjual,Rp140.000,KOTA BEKASI
48,DOBE Gamepad Programmable Controller Joy Con For Nintendo Switch OLED,27 Terjual,Rp365.000,KOTA JAKARTA BARAT
49,Gulikit NS28 Analog JoyCon Joy Con Joy-Con Joystick Replacement Parts Nintendo Switch Lite OLED,38 Terjual,Rp135.000,KOTA BEKASI
50,Silikon Analog Thumb Grip Super Mario Caps Joy-Con Nintendo Switch,493 Terjual,Rp7.000,KOTA BEKASI
51,Dobe Game Gun Pistol Shotgun Nintendo Switch JoyCon Joy Con,13 Terjual,Rp85.000,KOTA JAKARTA BARAT
52,DOBE 18 In 1 Sportswears Game Accessories for Nintendo Switch OLED V1 V2 Joy-Con TNS-2125,KOTA JAKARTA BARAT,Rp499.000,Produk Serupa
53,Joy Con Silicon Case Nintendo Switch Silikon Rubber Softcase Joycon,14 Terjual,Rp12.000,KAB. TANGERANG
54,Stiker Tombol D-Pad Move Direction Cross Abxy X Untuk Joy-Con Nintendo Switch,134 Terjual,Rp53.989,Luar Negeri
55,Service Joycon Servis Nintendo Switch SL SR LED Joy Con Drift Dan Lain2,7 Terjual,Rp150.000,KAB. BOYOLALI
56,Strap Joy Con Nintendo Switch Joycon Controller V1 V2 OLED Hand Strap,15 Terjual,Rp39.500,KOTA BEKASI
57,Kondom Silikon Silicone Cover Case Joy Con JoyCon Nintendo Switch Hitam,113 Terjual,Rp30.000,KOTA BEKASI
58,Joycon / Joy Con Controller Nintendo Switch Original,51 Terjual,Rp998.000,KOTA JAKARTA PUSAT
59,6 in 1 Multi Charging Dock Joy-Con JoyCon Joy Con Card Docking Nintendo Switch OLED,26 Terjual,Rp140.000,KOTA BEKASI
