,Title,Total,Price,Location
0,MATSUDA Kaos Polo Shirt Pria Kerah Aioi,1RB+ Terjual/ Bulan,Rp79.000,KOTA JAKARTA UTARA
1,MATSUDA Kaos Polo Shirt Pria Kerah Kushima,1RB+ Terjual/ Bulan,Rp79.000,KOTA JAKARTA UTARA
2,KEMEJA PRIA BOYI TOP MAN LENGAN PENDEK KASUAL FORMAL KERJA PUTIH HITAM NAVY GREY WARNA WHITE,1RB+ Terjual/ Bulan,Rp29.900,KAB. PEKALONGAN
3,M231 Kemeja Pria Basic Polos Oxford Pendek Hitam 1457H,1RB+ Terjual/ Bulan,Rp124.000,KAB. TANGERANG
4,MATSUDA Kaos Polo Shirt Pria Kerah Gose,1RB+ Terjual/ Bulan,Rp89.000,KOTA JAKARTA UTARA
5,PROMO KEMEJA PRIA DISTRO LENGAN PENDEK KASUAL SLIMFIT,1RB+ Terjual/ Bulan,Rp36.480,KAB. PEKALONGAN
6,HEM Kemeja Polos Pria Kemeja Kasual Kemeja Pria Kemeja Pendek Kemeja Baju Kemeja Jumbo XXL XXXL,1RB+ Terjual/ Bulan,Rp25.000,KOTA JAKARTA SELATAN
7,KEMEJA PRIA POLOS LENGAN PENDEK BEST SELLER KEMEJA PENDEK PRIA POLOS KEMEJA,1RB+ Terjual/ Bulan,Rp75.000,KAB. BANDUNG
8,Kemeja Pendek Pria kemeja Polos Kemeja Slimfit Kemeja Kasual Besic Kemeja Putih,1RB+ Terjual/ Bulan,Rp79.550,KAB. KUNINGAN
9,PROMO kemeja pria lengan pendek polos formal casual kerja santai,1RB+ Terjual/ Bulan,Rp29.900,KAB. PEKALONGAN
10,KEMEJA HAWAI POLOS UNISEX KATUN RAYON KEMEJA LENGAN PENDEK,1RB+ Terjual/ Bulan,Rp48.900,KOTA YOGYAKARTA
11,BASIC COLOUR SHIRT Kemeja polos Lengan Pendek Kasual Pria kemeja krah piyama pria polos original kemeja korea kemeja pantai hawai,1RB+ Terjual/ Bulan,Rp31.900,KAB. PEMALANG
12,BROGUY Kemeja Pria Lengan Pendek Kerah Sanghai Casual Polos Slimfit Size M - XXL,1RB+ Terjual/ Bulan,Rp79.500,KAB. KUNINGAN
13,BASIC COLOUR SHIRT - Kemeja Polos Casual Lengan Pendek Kasual Pria,1RB+ Terjual/ Bulan,Rp38.000,KOTA JAKARTA SELATAN
14,Kemeja Pendek Polos Slimfit Kasual Besic Hitam,1RB+ Terjual/ Bulan,Rp79.550,KAB. KUNINGAN
15,KEMEJA POLOS PENDEK PRIA PREMIUM DISTRO ATASAN LENGAN PENDEK CASUAL BAJU POLOS,1RB+ Terjual/ Bulan,Rp44.000,KAB. PEKALONGAN
16,Kemeja polos pria /kemeja lengan pendek /kemeja polosan top men/baju kemeja pria oxford kemeja terbaru kerah v model paling terbaru 2021,1RB+ Terjual/ Bulan,Rp37.000,KAB. PEKALONGAN
17,Cool Shirt | Kemeja Pria Polos Lengan Pendek Warna Coksu Size M L XL,1RB+ Terjual/ Bulan,Rp85.000,KAB. PEKALONGAN
18,Kemeja Polos Pria Lengan Pendek Distro Premium Size M Sampai XXXL,1RB+ Terjual/ Bulan,Rp45.000,KAB. PEMALANG
19,Kemeja Flanel Kotak Catur Abu Pria Lengan Pendek Kemeja Flannel Cowok Lengan pendek,1RB+ Terjual/ Bulan,Rp55.000,KAB. PEMALANG
20,kemeja lengan pendek kemeja polos kemeja slimfit,1RB+ Terjual/ Bulan,Rp34.999,KAB. JOMBANG
21,Bos Baju kemeja pria polos lengan pendek /Kemeja laki-laki / Kemeja dewasa pria lengan pendek ecer & grosir,1RB+ Terjual/ Bulan,Rp35.000,KAB. PEMALANG
22,PROMO CUCI GUDANG Kemeja Polos Lengan Pendek Dan Panjang Kemeja Distro Pria,1RB+ Terjual/ Bulan,Rp36.575,KAB. PEKALONGAN
23,RV Kemeja Pria Lengan Pendek Slim Fit Polos Premium Size M L XL,1RB+ Terjual/ Bulan,Rp45.000,KAB. PEKALONGAN
24,kemeja Pria motif - kemeja Pria lengan pendek - kemeja cowok full print - kemeja distro pria,1RB+ Terjual/ Bulan,Rp60.000,KOTA BANDUNG
25,Kemeja Flanel Lengan Pendek Kotak Kotak Premium High Quality Unisex,1RB+ Terjual/ Bulan,Rp44.500,KAB. PEMALANG
26,Kemeja Pendek kemeja Polos Kemeja Slimfit Kemeja Kasual Besic Kemeja Coral,1RB+ Terjual/ Bulan,Rp79.550,KAB. KUNINGAN
27,MRZN-KEMEJA POLOS PRIA PENDEK [ALL COLOURS],1RB+ Terjual/ Bulan,Rp96.500,KOTA TANGERANG SELATAN
28,Kemeja Pendek kemeja Polos Kemeja Slimfit Kemeja Kasual Besic Kemeja Hijau,1RB+ Terjual/ Bulan,Rp79.550,KAB. KUNINGAN
29,Dony Man | Kemeja PRIA Lengan Pendek | Kemeja Casual | WARNA HITAM NAVY PUTIH MARUN BIRU DONGKER,1RB+ Terjual/ Bulan,Rp80.000,KOTA JAKARTA BARAT
30,PROMO kemeja pria lengan pendek polos formal casual kerja santai,1RB+ Terjual/ Bulan,Rp29.900,KOTA JAKARTA SELATAN
31,kemeja lengan pendek pria full motif terbaru - kemeja printing pria lengan pendek keren - kemeja lengan pendek pria korea - kemeja surfing lengan pendek distro premium,1RB+ Terjual/ Bulan,Rp59.950,KOTA BANDUNG
32,CUTOFF Brave Kemeja Koko Pique Pria Pendek New Colors,1RB+ Terjual/ Bulan,Rp179.000,KOTA SURABAYA
33,Kemeja Polos Lengan Pendek / Kemeja Pria Lengan Pendek Casual,1RB+ Terjual/ Bulan,Rp39.900,KAB. PEMALANG
34,NUMAKENA - Kemeja Pria Lengan Pendek Motif Polos,1RB+ Terjual/ Bulan,Rp85.150,KAB. BANDUNG
35,Kemeja Putih Pria Lengan Pendek Polos Premium Distro Kasual Kerja Warna White M L XL Formal Kemeja Putih,1RB+ Terjual/ Bulan,Rp34.800,KAB. PEKALONGAN
36,Kemeja Pria Polos Lengan Pendek Warna Hitam Size M L XL,1RB+ Terjual/ Bulan,Rp85.000,KAB. PEKALONGAN
37,PROMO kemeja pria lengan pendek polos formal casual kerja santai,1RB+ Terjual/ Bulan,Rp33.000,KAB. PEKALONGAN
38,Kemeja polos Hitam kualitas distro Kemeja polos pendek kemeja Pria kemeja atasan pria polos lengan pendek,1RB+ Terjual/ Bulan,Rp33.500,KOTA PEKALONGAN
39,Kemeja Polos lengan pendek | kemeja polos,1RB+ Terjual/ Bulan,Rp33.999,KOTA PEKALONGAN
40,M231 Kemeja Pria Shanghai Polos Pendek Hitam 1972C,1RB+ Terjual/ Bulan,Rp499.000,KAB. TANGERANG
41,GADH Kemeja Polos Lengan Pendek Pria Bahan Katun Rami Halus Hem Polos Cowok Banyak Pilihan Warna Shirt Man Basic Reguler Fit,1RB+ Terjual/ Bulan,Rp69.000,KOTA PEKALONGAN
42,Kemeja Polos Lengan Pendek / Kemeja Pria Lengan Pendek Casual,1RB+ Terjual/ Bulan,Rp35.000,KAB. PEKALONGAN
43,PROMO KEMEJA PRIA LENGAN PENDEK MOTIF TERBARU,1RB+ Terjual/ Bulan,Rp35.000,KAB. PEMALANG
44,PROMO kemeja pria lengan pendek polos formal casual kerja Santai,1RB+ Terjual/ Bulan,Rp30.000,KAB. PEMALANG
45,Motz Kemeja Lengan Pendek Reguler,1RB+ Terjual/ Bulan,Rp105.000,KOTA BANDUNG
46,Kemeja Sakha Pria Lengan Pendek BROGUY,1RB+ Terjual/ Bulan,Rp79.000,KAB. KUNINGAN
47,Kemeja Lengan Pendek Pria Polos Terbaru,1RB+ Terjual/ Bulan,Rp57.000,KOTA SURABAYA
48,Kemeja Pria Lengan Pendek formal,1RB+ Terjual/ Bulan,Rp32.000,KAB. PEKALONGAN
49,BAJU MOTIF DAUN KEMEJA PENDEK KEMEJA MOTIF KEMEJA PRIA PAKAIAN PRIA ATASAN PRIA KEMEJA PENDEK KEMEJA MOTIF KEMEJA LENGAN PENDEK KEMEJA PRIA LENGAN PENDEK BAJU KEMEJA PRIA LENGAN PENDEK MOTIF KEMEJA TERHITS KEMEJA PRIA TERLARIS BAJU PRIA KEMEJA MOTIF,1RB+ Terjual/ Bulan,Rp35.450,KAB. PEMALANG
50,Kemeja Pria Lengan Pendek Original Cotton Pique Best Quality,1RB+ Terjual/ Bulan,Rp147.300,KAB. BANDUNG BARAT
51,PROMO kemeja pria lengan pendek polos formal casual kerja santai baju jumbo xxl xxxl 2xl 3xl,1RB+ Terjual/ Bulan,Rp29.900,KAB. PEKALONGAN
52,KEMEJA LENGAN PENDEK KEMEJA POLOS KEMEJA FORMAL KEMEJA PRIA KEMEJA POLOS PENDEK KEMEJA KASUAL KEMEJA PRIA KEMEJA POLOS PENDEK,1RB+ Terjual/ Bulan,Rp40.450,KAB. PEMALANG
53,KEMEJA PENDEK CREAM POLOS OXSFORD SLIMFIT - M L XL,1RB+ Terjual/ Bulan,Rp50.000,KAB. PEKALONGAN
54,Kemeja Polos Pria Lengan Pendek Kemeja laki laki Lengan Pendek Hem Pria Lengan Pendek Polos Baju Hem Cowok Polos Lengan Pendek Slimfit,1RB+ Terjual/ Bulan,Rp135.875,KOTA SURABAYA
55,KEMEJA POLOS PRIA LENGAN PENDEK WARNA HIJAU MINT,1RB+ Terjual/ Bulan,Rp80.000,KOTA JAKARTA PUSAT
56,Ribsgold Shirt Man Amarine,1RB+ Terjual/ Bulan,Rp79.900,KAB. TANGERANG
57,Hammerstout - Brent - Shirt,1 Terjual/ Bulan,Rp251.100,KOTA BANDUNG
58,Kemeja Polos Lengan Pendek / Kemeja Pria Lengan Pendek Casual,834 Terjual/ Bulan,Rp35.000,KAB. PEKALONGAN
59,Kemeja Amarilo Series,1RB+ Terjual/ Bulan,Rp49.000,KAB. PEKALONGAN
