,Title,Total,Price,Location
0,AMINO 2 Port USB Fast Charger 2.1A Micro USB Quick Charger Adapter MH-22,10RB+ Terjual,Rp24.900,KOTA JAKARTA BARAT
1,GROTIC Charger PD 20W 2.4A Fast Charging Adaptor QC3.0 Type-C Lightning Adapter untuk Iphone 12 X Xs 8 Oppo Xiaomi Phone,10RB+ Terjual,Rp89.000,KAB. TANGERANG
2,UNEED QuickPlug Wall Charger Quick Charge 3.0 Max 18watt – UCH411,10RB+ Terjual,Rp64.500,KOTA JAKARTA PUSAT
3,KIVEE Kepala Charger fast charging 36W 22.5W 20W 18W Charger Adaptor Type C original Universal EU Plug Quick 4.0 Wall Charger Mini Dual Usb,10RB+ Terjual,Rp72.000,KOTA JAKARTA UTARA
4,Baseus Kepala Charger Super Si Quick Charger Type C PD 20W,10RB+ Terjual,Rp159.000,KOTA TANGERANG
5,Robot Adapter Charger RT K4 Batok Charger Garansi Original Resmi ( Per 1pcs ),10RB+ Terjual,Rp10.500,KOTA JAKARTA BARAT
6,ROBOT RT-K4 Adaptor Kepala Travel Charger 5V/1A USB Port Charging Android - Garansi Resmi 1 Tahun,"5,1RB Terjual",Rp12.000,KOTA JAKARTA BARAT
7,ROBOT RT-K6 Travel Charger Adaptor Batok Charger Dual Output 2.4A Original - Garansi Resmi 1 Tahun,"7,2RB Terjual",Rp26.900,KOTA JAKARTA BARAT
8,KIVEE Kepala Charger adapter fast charging 12W 18W 22.5w 5.0A original for xiaomi oppo,"5,4RB Terjual",Rp52.250,KOTA JAKARTA UTARA
9,ROBOT RT-K8 Adaptor Kepala Batok Travel Cherger 10W 2A Singel Output - Garansi Resmi 1 Tahun,"3,7RB Terjual",Rp23.900,KOTA JAKARTA BARAT
10,【Stok Produk di Indonesia】Ugreen Kepala Charger USB 5V 2.1A Fast Charging Untuk iPhone X 8 7 iPad Samsung S9 Xiaomi Mi 8,8RB Terjual,Rp67.896,KOTA JAKARTA UTARA
11,ROBOT RT-K4 1A ORIGINAL / Batok charger ROBOT RT K4,10RB+ Terjual,Rp10.000,KOTA JAKARTA UTARA
12,Adaptor Charger Single USB Port 2A LED Travel Batok Kepala Casan OPPO Xiaomi Redmi Vivo Murah Cas,10RB+ Terjual,Rp3.800,KOTA JAKARTA SELATAN
13,ROBOT Adaptor Charger RT-K8 Batok Charger 10W 2A Small & Portable Garansi Original Resmi (Per 1Pcs),4RB Terjual,Rp20.000,KOTA JAKARTA BARAT
14,GROTIC Charger Adaptor 3A QC3.0 4USB Port Fast Charging Adapter Kepala Charger BK-376,"6,8RB Terjual",Rp55.000,KAB. TANGERANG
15,ACOME Special Bundling Charger AC03 2.4A AiC Fast Charging Free Cable Micro / Type-C / Lightning Seri AS Original - Garansi 1 Tahun,"1,3RB Terjual",Rp57.900,KOTA JAKARTA UTARA
16,Ugreen Kepala Charger USB Fast Charging Untuk Samsung Xiaomi Redmi VIVO OPPO LG ASUS,"2,7RB Terjual",Rp152.190,Luar Negeri
17,【Stok Produk di Indonesia】(With Free 1M Android Type C Kable) UGREEN Kepala Charger Hp USB 3.0 QC 18W QC3.0 Fast Charging 1M Untuk Xiaomi,"3,4RB Terjual",Rp125.000,KOTA JAKARTA UTARA
18,KIVEE Charger iphone fast charging 20w kepala charger type c for iphone Samsung OPPO xiaomi Quick 4.0 Garansi 1 tahun,"5,9RB Terjual",Rp55.000,KOTA JAKARTA UTARA
19,Kepala Adaptor Charger Robot 10w 2a Usb Adapter,"1,6RB Terjual",Rp75.000,KOTA JAKARTA BARAT
20,Ugreen Adaptor USB Kepala Charger 2.1A Iphone 7 8 X XS Adapter Cas TC Samsung Oppo Vivo 50459,1RB Terjual,Rp64.500,KOTA JAKARTA BARAT
21,KIVEE 6 Warna Charger Adaptor fast charging 22.5w Quick 4.0 kepala charger original Wall Charger for OPPO XIAOMI SAMSUNG,"1,3RB Terjual",Rp52.250,KOTA JAKARTA UTARA
22,Wall Charger Anker PowerPort Nano 20W - A2633,10RB+ Terjual,Rp130.000,KOTA JAKARTA UTARA
23,Charger Original 3 USB Port Charger QC3.0 Adaptor Power Oval 2.1A Casan 3 USB port black AH059 - XOBOX,130 Terjual,Rp17.945,KAB. TANGERANG
24,Batok Charger Robot 1A RT K4 Toples isi 35pcs,"7,1RB Terjual",Rp9.999,KOTA BANDUNG
25,BESTOOL PD 20W Adaptor Kepala Charger USB Type C Fast Charging untuk iPhone 11 12,"6,4RB Terjual",Rp50.500,KAB. TANGERANG
26,OLIKE KEPALA CHARGER USB ADAPTER FAST CHARGING 10W CQ3-B,"5,1RB Terjual",Rp21.000,KAB. TANGERANG
27,【Stok Produk di Indonesia】UGREEN Original 18W Adapter Charger Model Isi Daya Cepat Warna Hitam untuk Handphone,"8,5RB Terjual",Rp89.000,KOTA JAKARTA UTARA
28,Kepala Batok Adapter Charger Robot RTK6 2 USB Port 2.4 A harga per pcs,154 Terjual,Rp22.500,KOTA TANGERANG
29,Robot Adaptor Charger RT-K10 Batok kepala Charger Single USB Port 5V/1A Garansi Original Resmi ( Per 1Pcs ),"3,1RB Terjual",Rp13.500,KOTA JAKARTA BARAT
30,Robot Adaptor Charger RT-F1 Batok Charger Single Port Quick Charger 18W Qualcomm QC3.0 3A Output - Garansi Original Resmi 1 Tahun,"1,5RB Terjual",Rp49.000,KOTA JAKARTA BARAT
31,【Stok Produk di Indonesia】XIAOMI HUAWEI Ugreen Kepala Charger USB Tipe C 20W PD Fast Charging Untuk iPhone 14 13 pro Max 13 / 12 / 11 / XS / XS Max / XR / X / 8 / 7 plus / 8 / 7.0,"6,4RB Terjual",Rp139.000,KOTA JAKARTA UTARA
32,KIVEE Kepala Charger fast charging PD 30W Type C & USB Dual port output PD 3.0+QC 4.0 Wall Charger 5.0A for ios oppo xiaomi Samsung,Rp59.000 - Rp65.000,"Diskon Rp2,5RB",KOTA JAKARTA UTARA
33,Kepala Charger Robot RT K6 2 Dual USB Output Original 2A Fast Charging,"2,9RB Terjual",Rp22.900,KAB. TANGERANG
34,Ugreen Kepala Charger 20W 30W GaN PD USB Tipe C PD3.0 QC3.0 Quick Charging Untuk iPhone 14 13 12 11,"2,4RB Terjual",Rp378.605,Luar Negeri
35,INFINIX XCU32 Chager Charging Adaptor 2A With Cable Mirco 1M Safety Charging - Garansi 1 Tahun,"1,2RB Terjual",Rp15.900,KOTA JAKARTA BARAT
36,ACOME Bundling Hemat Charger GaN 30W Dual Port Fast Charging (ACG30 Pro) + Kabel Data Micro USB iPhone Type-C (AD-C Series) Original - Garansi Resmi 1 Tahun,790 Terjual,Rp124.900,KOTA JAKARTA UTARA
37,OLIKE KEPALA CHARGER USB PORT ADAPTER CHARGER PLUG EU 5V 1A C101,"3,2RB Terjual",Rp14.000,KAB. TANGERANG
38,BESTOOL 36W Fast Kepala Charger Quick Charge PD 20W+QC3.0 +2.4A Dual USB Charger-Garansi Resmi 1 Tahun,627 Terjual,Rp69.990,KAB. TANGERANG
39,NUZ - LUNA KEPALA CHARGER 1 PORT ADAPTER FAST CHARGING 2.4A,"2,8RB Terjual",Rp20.000,KOTA JAKARTA UTARA
40,KEPALA CHARGER 0.4 AMPER R_PM,256 Terjual,Rp19.500,KOTA JAKARTA PUSAT
41,"Batok Charger Robot RT-K6 2,4A Dual Outputs Non Pack",17 Terjual,Rp24.000,KOTA BANDUNG
42,UGREEN Kepala Adaptor Charger 20W PD Fast Charging USB MFI Type C untuk iPhone 11 12 13 Pro Max 10191 60450,"1,2RB Terjual",Rp97.500,KOTA JAKARTA BARAT
43,Kepala Charger LENYES LCH019 12W 2.4A 2 USB Adaptor Original,61 Terjual,Rp31.900,KOTA TANGERANG
44,Kepala Charger ROBOT RT-K6 2.4A Dual Output Original - Garansi 1 Tahun,55 Terjual,Rp20.900,KOTA JAKARTA UTARA
45,KIVEE charger oppo samsung xiaomi kepala charger fast charging 18w Quick 3.0 original Wall Charger 3.1A 1 tahun garansi,4RB Terjual,Rp39.000,KOTA JAKARTA UTARA
46,Adaptor Batok Charger Oppo 80W SUPER VOOC DART Fast Charging,918 Terjual,Rp30.500,KOTA JAKARTA UTARA
47,Charger Aukey PA-R1 20W Minima Nano USB-C PD - 500883,"9,1RB Terjual",Rp325.000,KOTA JAKARTA BARAT
48,ADAPTOR USB to IP - Adapter - Batok - Kepala - kepala Charger - Kepala Casan - Charger - kepala casan charger - Adaptor,10RB+ Terjual,Rp76.000,KOTA JAKARTA BARAT
49,Robot Adaptor Charger RT-F3 Batok Charger Dual USB Fast Charging 18W Quick Charger Qualcomm QC3.0 Garansi Original Resmi,KOTA JAKARTA BARAT,Rp62.000,Produk Serupa
50,ADAPTOR ROBOT RT-K7 1 USB KEPALA CHARGER FUREPROOF CASAN + MICRO CABLE white_cell,29 Terjual,Rp30.000,KOTA JAKARTA UTARA
51,ROBOT Dual Port USB-A Charger Quick Charging Adaptor RT-F3 QC 3.0 18W 3A Original - Garansi 1 Tahun,765 Terjual,Rp67.900,KOTA JAKARTA UTARA
52,Marjay Adaptor Daya Charger USB 120W Fast Charging QC3.0 6A Tipe C Kabel Untuk Andiord,12 Terjual,Rp58.462,Luar Negeri
53,STARTGO Kepala Charger Fast Charging 20w Quick Charge 3.0 Garansi Resmi PU20W Start Go,2 Terjual,Rp45.000,KOTA BANDUNG
54,Kepala Chager Original Robot RT-K4 5V/1A Travel Adapter Android dan Iphone,"3,7RB Terjual",Rp12.000,KAB. TANGERANG
55,UGREEN 20W PD Kepala Charger Super Fast USB Charger Quick Charge 4.0 3.0 Type C Charger Travel Untuk MFi iPhone14 13 pro Max 13/12/11/XS/XS Max/XR/X/8 /8 plus/7 plus Charger PD Telepon,10RB+ Terjual,Rp378.605,Luar Negeri
56,YLV Kepala Charger Adaptor Samsung Xiaomi Oppo Vivo 36W 30W 22.5W Fast Charging QC4.0 Universal Usb Port EU Plug Quick Charger,"4,2RB Terjual",Rp75.000,KOTA JAKARTA UTARA
57,Kepala Charger Baseus Mini Dual USB Charger EU Plug,"7,5RB Terjual",Rp69.000,KOTA TANGERANG
58,Charger Travel Adaptor Colokan USB 1 Port JOYSEUS T5 QC3.0 Quick Charging - CL0018 CL0017,10RB+ Terjual,Rp32.500,KOTA JAKARTA UTARA
59,ROBOT Charger RT-L1 Single Port Quick Charging Original Micro USB Type C Lightning - Garansi 1 Tahun,"1,4RB Terjual",Rp78.900,KOTA JAKARTA UTARA
