,Title,Total,Price,Location
0,Deli Office Chair / Kursi Kantor / Kursi Kerja Jaring dengan Senderan Kepala Sangat Nyaman E4925 E4926,"5,1RB Terjual",Rp559.000,KAB. TANGERANG
1,Fantech Kursi Kerja Kantor OCA258 Premium Office Chair,"1,6RB Terjual",Rp1.079.000,KOTA JAKARTA BARAT
2,MUYI Gaya Nordik Kursi Kantor Hidrolik Kursi Kerja Kursi Kantor Jaring Kursi Belajar Kursi Gaming Kursi Gamer,9 Terjual,Rp295.715,KAB. TANGERANG
3,Kursi Kantor Kursi Kerja Jaring/Mesh,"3,4RB Terjual",Rp479.000,KAB. TANGERANG
4,Sakula Kursi Kantor Mengangkat Kursi Kantor Kursi Mesh Dekompresi Nyaman Kursi Putar Ergonomis (A301/H2/818),52 Terjual,Rp699.000,KAB. TANGERANG
5,Kursi Kantor Jaring Kursi Kerja Kursi Gaming,"7,4RB Terjual",Rp479.000,KAB. TANGERANG
6,KUCA Kursi Kantor / Kursi Gaming/ Kursi Kerja / Kursi Belajar / Kursi Minimalis / Kursi Santai / Kursi Putar / Gaming Chair/ Kursi Hidrolik [ Garansi lima tahun ],966 Terjual,Rp489.000,KOTA JAKARTA TIMUR
7,IH Kursi Kantor Kursi Permainan Kursi Komputer Kursi Putar Kursi Direktur Kursi Manager,19 Terjual,Rp499.000,KAB. TANGERANG
8,"Kursi kantor,kursi kerja, kursi kantor jaring,kursi belajar,kursi gaming,kursi kerja",10RB+ Terjual,Rp590.000,KOTA TANGERANG
9,Keep Going Max- Kursi Kantor / Kursi Kantor Direktur Direksi / Kursi Kerja / Kursi Pijat / Kursi Gaming / Kursi Manager / Kursi Santai [ Garansi lima tahun ],"1,2RB Terjual",Rp799.000,KOTA TANGERANG
10,Kursi Kantor Hidrolik Kursi Gaming Jaring Hidrolik Sandaran Kepala Kursi Kerja,"7,2RB Terjual",Rp338.000,KOTA JAKARTA BARAT
11,Kursi Kerja Kantor Jaring Putar Hidrolis kaki chrome besi,"8,1RB Terjual",Rp260.700,KOTA JAKARTA BARAT
12,Homedoki Kursi Lipat / Bangku Lipat / Bangku Lipat Portable / Kursi Makan Lipat / Kursi Makan Kayu / Bangku Kayu / Kursi Kayu Minimalis,"2,2RB Terjual",Rp175.000,KOTA TANGERANG
13,Kursi Susun Kantor Pesta Kursi Kantor Model Futura kursi kondangan,"8,1RB Terjual",Rp151.000,KOTA JAKARTA UTARA
14,Deli Office Chair / Kursi Kantor / Kursi Kerja Jaring Desain Ergonomis Nyaman Empuk Sandaran Bisa Diatur E4931,695 Terjual,Rp488.000,KAB. TANGERANG
15,KUCA Kursi Kantor / Kursi Gaming/ Kursi Kerja / Kursi Belajar / Kursi Minimalis / Kursi Santai / Kursi Putar [ Garansi lima tahun ],323 Terjual,Rp499.000,KOTA JAKARTA TIMUR
16,Deli Office Chair / Kursi Kantor / Kursi Kerja Jaring Dengan Bantalan Tangan E4930,796 Terjual,Rp682.000,KAB. TANGERANG
17,KUCA Kursi Malas Folding Kursi Santai Lipat Kursi Lipat [ Garansi lima tahun ],392 Terjual,Rp429.000,KOTA JAKARTA TIMUR
18,OKE kursi bar Mengangkat kursi kursi cafe,60 Terjual,Rp195.000,KOTA TANGERANG
19,Kursi Lipat / Lazy Sofa Bed / Tatami / Kuris Lesehan / Sofa Lipat ukuran kecil,"3,7RB Terjual",Rp187.000,KOTA TANGERANG
20,RA Kursi Ergonomi /Kursi Kantor Mesh /Kursi Komputer /Kursi Gaming / Kursi Kerja /Kursi Belajar,30 Terjual,Rp499.000,KAB. TANGERANG
21,Deli Office Chair / Kursi Kantor / Kursi Kerja Jaring dengan Senderan Kepala dan Tangan Nyaman Ketinggian Bisa Diatur E4925 E4926,472 Terjual,Rp559.000,KAB. TANGERANG
22,Weyon Sakura Kursi Kantor Mengangkat Kursi Kantor Kursi Mesh Dekompresi Nyaman Kursi Putar Ergonomis(A301),25 Terjual,Rp226.000,KAB. TANGERANG
23,Kursi Cafe Kursi Makan Kursi Kerja Kursi Hadap,806 Terjual,Rp189.000,KAB. TANGERANG
24,IH Kursi Lipat Portable Kursi Kantor Lipat Kursi Belajar Minimalis Kursi Makan,1 Terjual,Rp160.000,KAB. TANGERANG
25,Kursi Kantor / Kursi Staff / Kursi Kerja / Kursi hidrolik / kursi belajar / kursi murah,"2,6RB Terjual",Rp590.000,KOTA TANGERANG
26,SPEEDS Kursi Lipat Kusi Bulat Camping Moon Folding Chair Mancing Alam Piknik Outdoor 031-14,"5,7RB Terjual",Rp85.500,KAB. TANGERANG
27,COD Yang gaming chair kursi kantor office chair kursi gaming kursi belajar minimalis kursi ergonomis kursi bangku game kursi komputer kursi eksekutif kursi belajar kursi santai dengan penyangga pinggang sandaran tangan dan sandaran kepala yang dapat dises,"1,5RB Terjual",Rp619.000,KOTA TANGERANG
28,Fantech ARM REST 1D Sandaran Tangan Kursi Kerja Kantor OCA258 OCB258,65 Terjual,Rp199.000,KOTA JAKARTA BARAT
29,Kursi Kantor Kursi Kerja Kursi Hidrolik Kursi Staff Kursi Jaring Putar Kursi Termurah Kursi Belajar Kursi Gaming,547 Terjual,Rp336.500,KOTA JAKARTA BARAT
30,KURSI SENDER / KURSI MAKAN/ BANGKU PLASTIK SENDER ANYAMAN ROTAN MURAH TERBARU KURSI PLASTIK ANYAM KURSI ROTAN SANDAR,"6,3RB Terjual",Rp63.900,KOTA JAKARTA UTARA
31,Kursi Kantor Kursi Kerja Kursi Belajar Kursi Direktur,2RB Terjual,Rp599.000,KAB. TANGERANG
32,Deli Office Chair / Kursi Kantor / Kursi Kerja Jaring Dengan Bantalan Tangan E4930,162 Terjual,Rp647.900,KAB. TANGERANG
33,Kursi Kantor Kerja Headrest Sandaran Kepala Jaring Kaki Besi Chrome,277 Terjual,Rp318.000,KOTA JAKARTA BARAT
34,OKE Kursi Lipat Kursi Santai Kursi Minimalis Kursi Anak Kursi Kantor kursi lipat portable Kursi Makan,118 Terjual,Rp160.000,KOTA TANGERANG
35,"Kursi Kantor, Kursi Kerja, Kursi Belajar, Kursi Baru",838 Terjual,Rp319.000,KOTA TANGERANG
36,OKE Kursi Santai/Kursi Kantor/Kursi Cafe/Kursi Belajar/Bangku Makan/Kursi Taman /Kursi Bar/Gaya minimalis Nordik,"1,2RB Terjual",Rp255.000,KOTA TANGERANG
37,Kursi susun yoyada model futura langsung pabrik (baca deskripsi sebelum order),"9,2RB Terjual",Rp150.999,KOTA JAKARTA BARAT
38,Homedoki Kursi Lipat / Bangku Lipat / Kursi Lipat Outdoor / Kursi Cafe / Kursi Belajar / Kursi Kerja / Kursi Kantor,Rp175.000,Rp400.000,KOTA TANGERANG
39,HTD SPORT Kursi Kantor Kerja Office Chair CH-B Steel Black/B-200,497 Terjual,Rp300.000,KOTA TANGERANG
40,Kursi Kantor / Kursi Roda / Kursi Karyawan / Kursi Jaring / Kursi Kerja,182 Terjual,Rp330.000,KAB. BEKASI
41,Pira Work - Artu TC Kursi Kerja / Kursi Kantor,742 Terjual,Rp349.000,KAB. GRESIK
42,SPEEDS Kursi Lipat Camping Kursi Lipat Outdoor Kursi Gunung Kursi Sauna Bangku Portable 031-14,"3,6RB Terjual",Rp95.000,KOTA SURABAYA
43,Kursi Susun Kantor Pesta Model Kursi Kantor Baru Termurah,"5,5RB Terjual",Rp250.000,KOTA JAKARTA BARAT
44,Weyon Sakura Kursi Kantor Mengangkat Kursi Kantor Kursi Mesh Dekompresi Nyaman Kursi Putar Ergonomis(A301),107 Terjual,Rp298.000,KAB. TANGERANG
45,Keep Going Max Kursi Kantor Minimalis Korean Style / Kursi Kerja / Kursi Belajar / Kursi Minimalis / Kursi Santai / Kursi Direktur / Kursi Putar / Kursi Komputer /,198 Terjual,Rp539.000,KOTA TANGERANG
46,Goto Omo Bean Bag Triangle Sofa Duduk Kursi Lantai Empuk Waterproof,"6,8RB Terjual",Rp169.900,KOTA TANGERANG
47,Kursi Cafe Makan Mee Do Bar Bangku Minimalis Belajar Kerja Millenial,10RB+ Terjual,Rp245.000,KOTA BEKASI
48,Deli Office Chair / Kursi Kantor / Kursi Kerja Jaring Desain Ergonomis Sangat Nyaman E4931,50 Terjual,Rp487.900,KAB. TANGERANG
49,Yang Baru kursi kantor office chair kursi belajar minimalis gaming chair kursi santai Kursi kantor sederhana kursi gaming kursi kerja jaring kursi kantor jaring kursi belajar kursi permainan kursi komputer kursi laptop,580 Terjual,Rp859.000,KOTA TANGERANG
50,Sakula Kursi Kerja Putar Murah Kantor Hidrolis Kursi Jaring Hitam Kaki Baja Kursi Terlaris-A301,400 Terjual,Rp308.000,KAB. TANGERANG
51,OCADO Kursi Lipat tersedia untuk Makan Kampu Belajar Ruang Tamu Kantor / 2 model：PU Leather Dan Plastik,"1,8RB Terjual",Rp165.000,KOTA TANGERANG
52,SPEEDS Kursi Lipat Camping Kursi Lipat Outdoor Kursi Gunung Kursi Sauna Bangku Portable 031-12,10RB+ Terjual,Rp95.000,KOTA SURABAYA
53,Deli Office Chair / Kursi Kantor / Kursi Kerja Jaring Ergonomis Ketinggian Bisa Diatur Dengan Bantalan Tangan E4930,199 Terjual,Rp647.900,KAB. TANGERANG
54,KUCA Kursi Malas Tempat Tidur Lipat Kursi Santai Lipat Folding Bed [ Garansi lima tahun ],"3,2RB Terjual",Rp633.900,KOTA JAKARTA TIMUR
55,HTD SPORT Kursi Kerja kursi Kantor Minimalis Comfort Office Chair B CH-B Steel,"2,7RB Terjual",Rp270.000,KOTA TANGERANG
56,SAPPORO FULHAM - Kursi Kantor | Kursi Jaring | Kursi kerja | Kursi Karyawan | Office Chair,507 Terjual,Rp299.900,KOTA JAKARTA BARAT
57,KURSI KANTOR STAFF CHAIR KURSI KERJA KURSI JARING - MODEL CH-B01 ( BLACK ) POLYAMIDE,"1,9RB Terjual",Rp228.500,KOTA TANGERANG
58,Pira Work - Kylo EC Kursi Kerja / Kursi Kantor / Kursi Eksekutif,"1,2RB Terjual",Rp1.188.000,KAB. GRESIK
59,Kursi Kantor Direktur Direksi Furnibest,"5,8RB Terjual",Rp899.000,KAB. TANGERANG
