,Title,Total,Price,Location
0,Ace - Odi Meja Lipat Laptop Dengan Mouse Pad - Hitam,"2,2RB Terjual",Rp179.100,KOTA TANGERANG SELATAN
1,Ace - Odi Meja Lipat Laptop Dengan Mouse Pad - Cokelat,475 Terjual,Rp179.100,KOTA JAKARTA UTARA
2,Meja Lipat Meja Belajar Anak Meja Laptop Lipat Portable,"1,3RB Terjual",Rp58.800,KOTA JAKARTA UTARA
3,MEJA LAPTOP PORTABLE BERRODA MODEL 1812,742 Terjual,Rp140.000,KOTA JAKARTA UTARA
4,Avery – FT001 - Meja Laptop Lipat / Meja Portable Serbaguna / Meja Kerja / Meja Belajar,114 Terjual,Rp67.000,KOTA SURABAYA
5,HUGO Meja Lipat Portable / Meja Laptop / Meja Belajar Anak,10RB+ Terjual,Rp59.000,KOTA TANGERANG
6,MEJA LIPAT/MEJA LAPTOP/MEJA LIPAT ANAK/MEJA LIPAT LAPTOP,"3,2RB Terjual",Rp58.000,KOTA JAKARTA BARAT
7,Ace - Odi Meja Lipat Laptop - Abu-Abu,267 Terjual,Rp84.500,KOTA JAKARTA UTARA
8,Living Mart - SKRIV Meja Lipat Serbaguna / Meja Laptop / Meja Belajar - 44015,10RB+ Terjual,Rp79.000,KOTA JAKARTA UTARA
9,ORICO PFB-A23 Laptop Stand,"2,3RB Terjual",Rp36.000,KOTA JAKARTA UTARA
10,[GK] PROMO BESAR BIG 60X40 Meja Laptop Portable Lipat Lipet Kayu Belajar Komputer Anak iPad Polos 2 Slot,"9,4RB Terjual",Rp47.500,KOTA JAKARTA BARAT
11,Meja Laptop Lipat Portable Aluminium With Mousepad Murah,327 Terjual,Rp130.000,KOTA JAKARTA BARAT
12,"MEJA LIPAT BELAJAR LAPTOP SERBAGUNA PORTABLE/MEJA BELAJAR KARAKTER MURAH / MEJA FURNITURE RUMAH, 60×40×28CM","7,5RB Terjual",Rp60.000,KOTA TANGERANG
13,[GK] STAND MEJA LAPTOP Adjustable Height Standing Desk Roda Portable Tinggi Lipat Serbaguna Belajar,"3,7RB Terjual",Rp106.500,KOTA JAKARTA BARAT
14,Rumaku Meja Laptop Lipat Foldable Desk Zoomer / Meja Belajar Serbaguna,550 Terjual,Rp115.000,KOTA TANGERANG
15,Vusign Folding Table / Meja Belajar Laptop Lipat Warna-Warni Dengan Laci Penyimpanan VS862,1RB Terjual,Rp77.000,KAB. TANGERANG
16,Meja Portable Laptop Meja Serbaguna,10RB+ Terjual,Rp107.000,KOTA JAKARTA UTARA
17,Coretech Fold Meja Laptop Lipat Aluminium With Cooler Big Fan Mousepad,"5,9RB Terjual",Rp179.900,KOTA TANGERANG
18,meja laptop lipat meja lipat laptop meja belajar anak serbaguna,"3,7RB Terjual",Rp34.500,KOTA JAKARTA UTARA
19,IH Stand Monitor Rak Monitor Desktop Dudukan Komputer Kayu Rak Buku Kayu,152 Terjual,Rp69.900,KAB. TANGERANG
20,Meja Laptop Murah Adjustable Multifungsi Ber-roda Portable MIKUMI,"1,2RB Terjual",Rp155.000,KOTA TANGERANG SELATAN
21,Meja laptop/meja lipat portable anak /meja belajar hu,"8,5RB Terjual",Rp47.500,KOTA SURABAYA
22,Meja Lipat Laptop Beroda Meja Kerja Portable Meja Laptop Roda Serbaguna SJZ01,"1,5RB Terjual",Rp107.800,KOTA JAKARTA UTARA
23,Goto Coretech Elenco Meja Belajar Makan Lipat Anak Laptop Portable,3RB Terjual,Rp88.900,KOTA TANGERANG
24,[GS] STAND MEJA LAPTOP Adjustable Height Standing Desk Roda Portable Tinggi Lipat Serbaguna Belajar,1RB Terjual,Rp106.500,KOTA SEMARANG
25,Meja Belajar Lipat Meja Belajar Anak Motif Karakter Gambar Ukuran 50 x 30 x 28 cm,381 Terjual,Rp34.500,KOTA JAKARTA UTARA
26,Dejavu Meja Laptop Stand Laptop Portable Meja Sofa Samping Tempat Tidur Meja Roda Laptop HML201,7RB Terjual,Rp169.900,KOTA TANGERANG
27,Informa - Informa Oxy Meja Lipat - Hitam,634 Terjual,Rp199.000,KOTA BEKASI
28,Stand Tatakan Laptop Bahan Kayu Ukuran 25 30cm,391 Terjual,Rp35.000,KAB. BANDUNG
29,Goto Coretech Metalix Meja Laptop Lipat Portable Belajar Serbaguna,890 Terjual,Rp169.000,KOTA TANGERANG
30,"MEJA LIPAT / MEJA LIPAT BELAJAR LAPTOP SERBAGUNA PORTABLE/MEJA BELAJAR KARAKTER MURAH / MEJA FURNITURE RUMAH, 60×40×28CM","2,3RB Terjual",Rp110.000,KOTA TANGERANG
31,Stand Leptop Dudukan Meja Laptop Kayu Jatibelanda,"1,3RB Terjual",Rp60.000,KAB. TRENGGALEK
32,meja lesehan meja laptop meja komputer murah meja pendek minimalis,"1,2RB Terjual",Rp139.900,KOTA BANDUNG
33,CRAZY SALE !! MEJA LAPTOP PORTABLE MEJA LIPAT ANAK MEJA BELAJAR Termurah Kualitas Terbaik,10RB+ Terjual,Rp52.888,KOTA BANDUNG
34,MIISOO Meja Lipat/ Lipet dan Meja Laptop untuk Anak belajar online e learning,2RB Terjual,Rp69.000,KAB. TANGERANG
35,MIISOO Meja Lipat / Meja Laptop / Meja Lipat Anak / Meja Lipat Laptop / Meja Belajar / Meja Lipet,"5,9RB Terjual",Rp64.900,KOTA JAKARTA UTARA
36,Cipta Jaya - Meja Stand Dudukan Meja Aksesoris Laptop Leptop Tatakan Monitor Folding PC Komputer Jualan Kayu Portable Aksesoris Desktop Led Minimalis Murah Korean Style Serbaguna ukuran 50x20x10 cm warna Putih Hitam Natural Kayu Multifungsi Pc lg Estetik,"5,4RB Terjual",Rp69.000,KOTA BOGOR
37,Stand Holder Laptop Folding Braket P1 Pro Dudukan Lipat Anti Slip Alas Brakets Pendingin Ipad Tablet,"9,1RB Terjual",Rp14.500,KOTA JAKARTA SELATAN
38,Meja Laptop Meja Lipat Serbaguna Meja Belajar Portable,477 Terjual,Rp65.562,KOTA SEMARANG
39,Meja komputer lesehan-meja laptop,242 Terjual,Rp139.900,KOTA JAKARTA SELATAN
40,Informa - Informa Oxy Meja Laptop Lipat - Pink,140 Terjual,Rp159.000,KOTA SURABAYA
41,Stand Meja Laptop Lipat Foldable Notebook Portable Desk Table,415 Terjual,Rp68.400,KOTA BANDUNG
42,Taffware Portable Laptop Stand Adjustable Angle - Black,140 Terjual,Rp49.878,KOTA TANGERANG SELATAN
43,Meja belajar / Meja laptop lesehan storage KR001 Simpel minimalis kekinian,"1,1RB Terjual",Rp118.900,KAB. BOGOR
44,Meja Lipat Laptop Tulis Portable Plastik Meja Anak Serbaguna Warna Meja Murah Plastik Meja Plastik Lipat Kingdom,528 Terjual,Rp25.640,KOTA JAKARTA BARAT
45,Meja Laptop / Meja Lipat / Meja Belajar / Meja Lipat Laptop / Meja Belajar Anak,10RB+ Terjual,Rp58.000,KOTA JAKARTA BARAT
46,Goojodoq Stand Holder Lipat Adjustable Anti Slip Untuk Laptop/Notebook,"5,4RB Terjual",Rp39.000,KOTA JAKARTA UTARA
47,COD BAYAR DITEMPAT Meja Laptop & Belajar Lipat Portable,"4,9RB Terjual",Rp58.000,KOTA JAKARTA BARAT
48,FSB1/P1 Universal Laptop Stand Holder Laptop,10RB+ Terjual,Rp18.060,KOTA SURABAYA
49,Meja Laptop Lipat Multifungsi - Kaki Meja dapat di Atur 70-90cm - Newnest ND02,"1,1RB Terjual",Rp155.400,KOTA TANGERANG
50,MEJA LAPTOP BESAR 80x40 60x40/MEJA LIPAT LAPTOP/MEJA PORTABLE SERBAGUNA /MEJA KERJA/MEJA BELAJAR,224 Terjual,Rp126.600,KOTA SURABAYA
51,Stand Penyangga Laptop Stand Holder Lipat Adjustable Anti Slip Untuk Laptop/Notebook,10RB+ Terjual,Rp12.990,KOTA JAKARTA PUSAT
52,Meja Laptop table portable aluminium + cooler Fan - meja Lipat kerja TERMURAH,"2,5RB Terjual",Rp132.000,KOTA JAKARTA UTARA
53,Megam Meja Stand Laptop Meja Belajar Meja Kerja Portable Roda Stainless Steel Meja laptop roda HML201,557 Terjual,Rp169.900,KOTA TANGERANG
54,GROSIR TERMURAH MEJA LIPAT/MEJA LAPTOP POLOS ATAU KARAKTER,114 Terjual,Rp60.000,KOTA JAKARTA TIMUR
55,Meja Belajar / Kerja / Laptop Industrial Knockdown | MK01 - Pengrajin.com,"1,1RB Terjual",Rp530.000,KOTA BANDUNG
56,HTD Meja Laptop Minimalis Adjustable Office Table Model 1812,983 Terjual,Rp106.500,KOTA TANGERANG
57,Meja Monitor/Laptop/Serbaguna - Monitor Stand - Rapi Seketika - Premium - Tecgear Riser,68 Terjual,Rp199.999,KOTA JAKARTA SELATAN
58,Meja Kerja Dan Belajar Taves Edition Minimalis | Mk16 - Pengrajin.com,717 Terjual,Rp486.000,KOTA BANDUNG
59,Meja Laptop Portabel With COOLER FAN Meja Laptop Lipat Meja Laptop Kipas Laptop,85 Terjual,Rp159.000,KOTA JAKARTA TIMUR
