,Title,Total,Price,Location
0,Speaker ROBOT RS200 Laptop/PC/ Gaming Soundbar Super Bass Portable RGB Lighting - Garansi 1 Tahun,10RB+ Terjual,Rp114.900,KOTA JAKARTA UTARA
1,Logitech Z121 2.0 Stereo Speaker USB Compact,10RB+ Terjual,Rp185.000,KOTA JAKARTA PUSAT
2,KISONLI Speaker Mini Komputer / Laptop S-888 Super Bass Effect With Volume Control,614 Terjual,Rp51.982,KAB. TANGERANG
3,KISONLI Speaker Gaming Laptop / Komputer S555 Strong Bass And Compatibility,"2,4RB Terjual",Rp55.670,KAB. TANGERANG
4,ROBOT Speaker USB RS180 Multimedia Portable / Speaker Music Mini for Gaming Computer Laptop etc Original - Garansi Resmi 1 Tahun,"3,4RB Terjual",Rp57.900,KOTA JAKARTA UTARA
5,Speaker Salon Multimedia Model 101Z For Komputer Laptop Notebook Pc Hp Mini Aktif Kabel USB Stereo,10RB+ Terjual,Rp18.900,KOTA JAKARTA SELATAN
6,READY STOCK ADVANCE Speaker Multimedia Komputer Laptop Speaker Super Bass 2.0 Channel CLS-101 Backlit Speaker Garansi Resmi 1 Tahun,6RB Terjual,Rp43.000,KOTA JAKARTA UTARA
7,GAMEN Speaker GS1 Laptop/PC/Gaming Soundbar Super Bass Portable RGB Lighting - Garansi Resmi 1 Tahun,591 Terjual,Rp69.900,KOTA JAKARTA BARAT
8,KISONLI Speaker Gaming Laptop/Komputer KS-08 Dual Bass With Volume Control,"1,2RB Terjual",Rp59.000,KAB. TANGERANG
9,Speaker GAMEN GS1 Laptop/PC/Gaming Soundbar Super Bass Portable RGB Lighting - Garansi 1 Tahun,"4,6RB Terjual",Rp88.888,KOTA JAKARTA UTARA
10,[TERLARIS] SPEAKER KOMPUTER PC / LAPTOP / NOTEBOOK / SPEAKER USB MINI MULTIMEDIA TERMURAH,10RB+ Terjual,Rp25.700,KOTA JAKARTA BARAT
11,ROBOT RS200 E-Sports Gaming Speaker 3.5mm AUX with 2 Channel Stereo and RGB Flow Lighting Effect,"2,1RB Terjual",Rp104.000,KOTA JAKARTA BARAT
12,Multimedia Speaker Advance CLS-101 Super Bass 2.0 Channel speaker,"5,2RB Terjual",Rp45.000,KOTA JAKARTA UTARA
13,Speaker Gaming Stereo RGB NYK SPN-08 Falcon,624 Terjual,Rp110.000,KOTA JAKARTA PUSAT
14,KISONLI Mini Speaker Komputer/Laptop V-410 Strong Bass With Switch Volume Control,745 Terjual,Rp39.000,KAB. TANGERANG
15,Robot RS180 USB Multimedia Dekstop Speaker Stereo RGB Color Speaker Music Mini for Gaming Computer Laptop - Garansi Resmi 1 Tahun,358 Terjual,Rp59.900,KOTA JAKARTA BARAT
16,GAMEN Multimedia Speaker Gaming / Sound Audio / Sound Bar GS8 RGB Rhythm Light For Hanphone / Computer / PC / Laptop / Super Bass Original - Garansi 1 Tahun,724 Terjual,Rp160.888,KOTA JAKARTA UTARA
17,GAMEN GS5 Speaker Laptop/PC/Gaming Soundbar Super Bass RGB Lighting - Garansi Resmi 1 Tahun,89 Terjual,Rp95.000,KOTA JAKARTA BARAT
18,Advance CLS101 Speaker Komputer Speaker Laptop Speaker Multimedia Super Bass 2.0 Channel,"4,2RB Terjual",Rp41.900,KOTA JAKARTA UTARA
19,Speaker Gaming Stereo Sounbar Gaming RGB NYK X60 Quantum,781 Terjual,Rp245.000,KOTA JAKARTA PUSAT
20,Speaker Laptop Komputer PC Notebook USB Multimedia Super Bass G101,"1,3RB Terjual",Rp34.900,KOTA TANGERANG
21,Advance M180BT - Multimedia Speaker with Subwoofer System With FM Radio | Garansi Resmi Advance,986 Terjual,Rp308.000,KOTA JAKARTA UTARA
22,Advance CLS-101 Multimedia Speaker 2.0CH Speaker Laptop / Speaker Komputer PC Super Bass CLS101 / CLS 101 - Hitam,54 Terjual,Rp41.900,KOTA JAKARTA BARAT
23,GAMEN Speaker Gaming GS6 RGB Rhythm Light For Computer / PC / Laptop Super Bass Garansi Original Resmi,62 Terjual,Rp126.000,KOTA JAKARTA BARAT
24,Speaker Bluetooth Komputer/Laptop AC-9002BT KISONLI Stereo Super Bass Support Wireless Connection,326 Terjual,Rp149.466,KAB. TANGERANG
25,Robot RS200 E-Sports Gaming Speaker 3.5mm AUX With 2 Channel Stereo,2RB Terjual,Rp200.000,KOTA JAKARTA BARAT
26,KISONLI Gaming Speaker Soundbar Laptop / Komputer i520 Design Long Strip With Volume Control,404 Terjual,Rp82.538,KAB. TANGERANG
27,SPEAKER LAPTOP/KOMPUTER G105 // G101,943 Terjual,Rp26.000,KOTA TANGERANG
28,KISONLI Speaker Gaming Laptop / Komputer Bluetooth U-2900BT Subwoofer LED Light With Rotatable Button,"1,4RB Terjual",Rp113.050,KAB. TANGERANG
29,KISONLI Mini Speaker komputer/laptop V-400 Dual Bass With Volume Control,726 Terjual,Rp36.618,KAB. TANGERANG
30,KISONLI Speaker Komputer/Laptop L-1030 LED RGB Light With Switch Volume Control - Pink,338 Terjual,Rp64.916,KAB. TANGERANG
31,"Advance Duo 026 - Speaker Komputer,Notebook,Laptop | Garansi Resmi Advance 1 Tahun","2,3RB Terjual",Rp57.000,KOTA JAKARTA UTARA
32,KISONLI Speaker Gaming Laptop / Komputer K500 Strong Bass With Volume Control - PUTIH,66 Terjual,Rp98.000,KAB. TANGERANG
33,ROBOT Speaker USB RS180 Multimedia Portable / Speaker Music Mini for Gaming Computer Laptop etc Original - Garansi Resmi 1 Tahun,"1,4RB Terjual",Rp59.900,KOTA JAKARTA UTARA
34,Logitech Z121 2.0 Stereo Speaker USB Compact,87 Terjual,Rp185.000,KOTA JAKARTA UTARA
35,HC Speaker Salon Mini 2.0 Multimedia Model 101Z 2 Sisi For Komputer Laptop Notebook Pc Hp Aktif Kabel USB Stereo,227 Terjual,Rp18.999,KAB. TANGERANG
36,Mini Speaker Multimedia Model AP101 Be-5777 101Z Kabel USB Komputer Laptop Notebook Smartphone Aktif,"1,9RB Terjual",Rp18.900,KOTA JAKARTA SELATAN
37,ACOME Super Bass Speaker Bluetooth 5.2 10W High Power 3 Playback Modes Garansi Resmi 1 Thn A16,10RB+ Terjual,Rp139.900,KOTA JAKARTA UTARA
38,Lenovo TS38 Dual Speaker Desktop dengan Lampu RGB Suara Bass Stereo HiFi untuk Laptop TV PC Notebook Game Surround Mini Speaker,61 Terjual,Rp209.000,KOTA JAKARTA BARAT
39,EZEEY Multimedia Speaker Stereo 2.0 3.5mm - S5 [Hitam],70 Terjual,Rp66.599,KOTA JAKARTA BARAT
40,DuaWarna Speaker Komputer Laptop Twin PC Multimedia Speaker Gaming Mini USB Speaker Portable Speaker Twin DE041,686 Terjual,Rp19.989,KOTA TANGERANG
41,Multimedia 5.0 Speaker Bluetooth Soundbar RGB LED Light Computer TV Phone TF 360° Stereo Surround Wireless Bluetooth Speaker Sound Bar GS8 RGB Rhythm Light,128 Terjual,Rp138.000,KOTA JAKARTA UTARA
42,GAMEN GS1 MultiMedia Speaker Laptop/PC/Gaming Soundbar Super Bass Portable RGB Garansi Original,502 Terjual,Rp75.900,KOTA JAKARTA BARAT
43,COD SPEAKER KOMPUTER FLECO F 550-SPEAKER FLECO/SPEAKER MULTIMEDIA/SPEAKER HP-LAPTOP-SPEAKER USB MURAH/SPEAKER HANDPHONE/SPEAKER USB/SPEAKER MP3/SPEAKER LAPTOP,113 Terjual,Rp82.500,KOTA JAKARTA TIMUR
44,KISONLI - Speaker 2.0 Laptop / Komputer / Multimedia - K800,416 Terjual,Rp73.703,KAB. TANGERANG
45,SMS Speaker Salon Mini 2.0 Multimedia Model 101Z 2 Sisi For Komputer Laptop Notebook Pc Hp Aktif Kabel USB Stereo,82 Terjual,Rp18.997,KAB. TANGERANG
46,ROBOT RS200 SPEAKER 2 CHANNEL STEREO 3.5MM AUX WITH RGB LED LIGHT SPEAKER PC GAMING BASS,167 Terjual,Rp93.000,KOTA JAKARTA BARAT
47,Speaker Laptop Handphone Komputer PC Notebook USB Super Bass G105,134 Terjual,Rp34.900,KOTA TANGERANG
48,EDIFIER R19BT Mini 2.0 laptop speakers USB connection USB and AUX modes fashion laptop speakers,122 Terjual,Rp414.200,KOTA JAKARTA BARAT
49,Speaker Gaming 2.0 Stereo RGB NYK Nemesis SP-N06 Selena,137 Terjual,Rp124.000,KOTA JAKARTA PUSAT
50,KISONLI Gaming Speaker Laptop / Komputer KS07 Dual Bass With Volume Control,49 Terjual,Rp89.000,KAB. TANGERANG
51,ROBOT Speaker RS180 E- Multimedia Portable Speaker Music Mini for Gaming Computer Laptop etc Garansi Original Resmi,362 Terjual,Rp54.000,KOTA JAKARTA BARAT
52,GAMEN Multimedia Speaker Gaming GS10 2.1CH Subwoofer with RGB Lights For Handphone / Computer / PC / Laptop / Super Bass Original - Garansi 1 Tahun,KOTA JAKARTA UTARA,Rp148.888,Produk Serupa
53,SPEAKER AKTIF ROBOT RS200 GAMING 3.5mm AUX 2 CHANNEL PC KOMPUTER AUDIO,729 Terjual,Rp99.900,KOTA JAKARTA BARAT
54,GAMEN Speaker Multimedia Gaming GS10 2.1CH Subwoofer with RGB Lights For Handphone / Computer / PC / Laptop / Super Bass Garansi Original Resmi,27 Terjual,Rp128.000,KOTA JAKARTA BARAT
55,speaker laptop komputer pc bass mini kable usb 2.0 RGB surround Hotmai HT-331(k2039)/speaker bass komputer pc surround 2.0 RGB/,778 Terjual,Rp48.900,KOTA JAKARTA PUSAT
56,KISONLI Gaming Speaker Komputer/Laptop L-1030 LED RGB Light With Switch Volume Control - Putih,474 Terjual,Rp55.014,KAB. TANGERANG
57,Advance Speaker Komputer/Laptop DUO-090 Black | Garansi resmi advance 1 tahun,547 Terjual,Rp92.000,KOTA JAKARTA UTARA
58,EDIFIER R19BT 2.0 PC Speaker System with Bluetooth5.3 AUX Wooden Box,35 Terjual,Rp414.200,KOTA JAKARTA BARAT
59,EDIFIER G1500 Desktop Bluetooth game speaker Professional EQ sound Effect,23 Terjual,Rp543.800,KOTA JAKARTA BARAT
