,Title,Total,Price,Location
0,Baseus Encok WM01 True Wireless Bluetooth Earphone Mini Earbuds TWS,10RB+ Terjual,Rp289.000,KOTA TANGERANG
1,Nokia E3110 True Wireless Earbuds Bluetooth Earphone TWS HD - Black,"2,7RB Terjual",Rp184.900,KOTA JAKARTA BARAT
2,Headset/TWS EP-T31 Wireless Charging Earbud With AAC Decodec & IPX 5,"3,5RB Terjual",Rp188.900,KOTA JAKARTA BARAT
3,Nokia E3100 Plus True Wireless Earbuds Bluetooth Earphone TWS White,245 Terjual,Rp198.900,KOTA JAKARTA BARAT
4,Baseus Bowie E3 True Wireless Bluetooth Earphone Earbuds,10RB+ Terjual,Rp299.000,KOTA TANGERANG
5,Nokia Essential True Wireless Earphones TWS E3101 - White,729 Terjual,Rp249.000,KOTA JAKARTA BARAT
6,Nokia E3100 Plus True Wireless Earbuds Bluetooth Earphone TWS HD,"6,8RB Terjual",Rp198.900,KOTA JAKARTA BARAT
7,Xiaomi Official Redmi Buds Essential Bluetooth® 5.2 IPX4 Suara Superior Baterai Hingga 18 jam Koneksi Mudah,"9,6RB Terjual",Rp199.000,KOTA JAKARTA UTARA
8,True Wireless Earbuds Anker Soundcore A20i - A3948,206 Terjual,Rp199.000,KOTA JAKARTA UTARA
9,MINIBEST Headset Bluetooth inpods 12 TWS Macaron Earphone True Wireless Stereo HIFI Sentuh Earbud i12 MB-555,10RB+ Terjual,Rp39.900,KOTA JAKARTA BARAT
10,(New Launch) True Wireless Earbuds Anker Soundcore R50i - A3949,"4,1RB Terjual",Rp199.000,KOTA JAKARTA UTARA
11,Lenovo thinkplus LP40 True Wireless Bluetooth Earphone Mini Earbuds TWS Noise Reduction Headset,10RB+ Terjual,Rp141.550,KAB. TANGERANG
12,[NEW PRODUCT] TWS Earphone Anker Soundcore R50i - A3949,"3,8RB Terjual",Rp199.000,KOTA JAKARTA UTARA
13,SoundPEATS TrueFree 2 True Wireless Earbuds - Black,10RB+ Terjual,Rp359.000,KOTA JAKARTA PUSAT
14,Robot TWS Wireless Earphone Airbuds T30 PLUS Original BT 5.3 True Wireless Headset Bluetooth Earbuds - Garansi 1 Tahun,10RB+ Terjual,Rp279.900,KOTA JAKARTA UTARA
15,Jabra Elite 2 True Wireless Earbuds,"4,7RB Terjual",Rp759.000,KOTA JAKARTA PUSAT
16,Nokia E3110 True Wireless Earbuds Bluetooth Earphone TWS HD,"6,9RB Terjual",Rp185.000,KOTA JAKARTA BARAT
17,True Wireless Earbuds Anker Soundcore Life P2i - A3991,2RB Terjual,Rp299.000,KOTA JAKARTA UTARA
18,BASEUS Encok True Wireless Earphones WM01 - NGWM01,10RB+ Terjual,Rp175.000,KOTA JAKARTA UTARA
19,MINIBEST TWS MB-Pods Pro M5 [2nd Generation with H2 CHIP] IPX4 Wireless Earphone Bluetooth 5.3 Active Noise Cancellation,"3,2RB Terjual",Rp175.000,KOTA JAKARTA BARAT
20,Nokia E3110 True Wireless Earbuds Bluetooth Earphone TWS HD - White,"1,2RB Terjual",Rp184.900,KOTA JAKARTA BARAT
21,[NEW PRODUCT] TWS Earbuds Anker Soundcore A20i - A3948,385 Terjual,Rp199.000,KOTA JAKARTA UTARA
22,Thinkplus Lenovo TH10 Headphone Bluetooth Wireless Headset Earphone 5.0,10RB+ Terjual,Rp209.000,KOTA TANGERANG
23,Minibest Headset Bluetooth Inpods I12 & I13 PRO Earphone Bluetooth Wireless Android MB-555,10RB+ Terjual,Rp55.900,KOTA JAKARTA BARAT
24,ROBOT Flybuds T10 TWS Earbuds Semi In Ear True Wireless Earphone Headset Bluetooth 5.3 Waterproof IPX4 - Garansi Resmi 1 Tahun,"2,3RB Terjual",Rp135.000,KOTA JAKARTA BARAT
25,ROBOT Earphone Wireless / Mini Earbuds / Earbud / True Wireless Stereo / TWS Bluetooth 5.1 T50 Waterproof IPX4 Semi-In-Ear Original - Garansi Resmi 1 Tahun,"6,4RB Terjual",Rp279.900,KOTA JAKARTA UTARA
26,JBL TUNE 115 True Wireless,"3,9RB Terjual",Rp760.000,KOTA JAKARTA UTARA
27,MINIBEST Macaron I13 Pro Bluetooth Earphone Wireless Headphones MB-555,10RB+ Terjual,Rp55.900,KOTA JAKARTA BARAT
28,SoundPEATS Air3 APTX Adaptive True Wireless Earbuds - Hitam,"3,6RB Terjual",Rp519.000,KOTA JAKARTA PUSAT
29,SoundPEATS Free2 Classic True Wireless Earbuds - Black,"3,8RB Terjual",Rp259.000,KOTA JAKARTA PUSAT
30,VIVAN TWS Wireless Earphone Airbuds Infinity GT2 Original BT 5.3 Playtime 40 Jam Headset Bluetooth Earbuds Semi In Ear - Garansi 1 Tahun,416 Terjual,Rp216.900,KOTA JAKARTA UTARA
31,Nakamichi TW018ENC True Wireless Earbuds Bluetooth Earphone TWS HD,"2,6RB Terjual",Rp279.000,KOTA JAKARTA BARAT
32,Philips TAUE 101 Earphone With Mic,"5,5RB Terjual",Rp99.000,KOTA JAKARTA PUSAT
33,Baseus H17 Headset Handsfree Encok Jack 3.5mm Wired Earphone MIC,"8,5RB Terjual",Rp89.000,KOTA TANGERANG
34,SoundPEATS T3 Active Noise Cancelling True Wireless Earbuds,"1,6RB Terjual",Rp419.000,KOTA JAKARTA PUSAT
35,OLIKE TRUE WIRELESS BLUETOOTH EARPHONE GAMING EARBUDS TWS HEADSET T1H,"6,3RB Terjual",Rp109.000,KAB. TANGERANG
36,GROTIC Headset Bluetooth inpods 12 TWS Macaron Earphone True Wireless Stereo HIFI Sentuh Earbud i12,10RB+ Terjual,Rp78.000,KAB. TANGERANG
37,TWS Earbuds Anker Soundcore Life Dot 3i - A3982,"1,9RB Terjual",Rp550.000,KOTA JAKARTA UTARA
38,JBL C150SI In-Ear Earphone cable with Mic - Garansi Resmi,10RB+ Terjual,Rp99.000,KOTA JAKARTA UTARA
39,Eartips handsfree karet earphone universal original aman soft nyaman Silikon Headset IEM NBET,"6,6RB Terjual",Rp9.900,KOTA JAKARTA PUSAT
40,realme Techlife Buds T100 with up to 28 Hours Playback & AI ENC for Calls Bluetooth Headse,294 Terjual,Rp269.000,KAB. TANGERANG
41,EDIFIER X3S TWS Wireless Bluetooth 5.2 Earphone Qualcomm aptX cVc ENC -1 Tahun Garansi,"2,6RB Terjual",Rp399.000,KOTA JAKARTA PUSAT
42,Thinkplus Lenovo LP2 True Wireless Bluetooth Earphone TWS Noise Reduction,"9,2RB Terjual",Rp179.000,KOTA TANGERANG
43,HONOR Earbuds X3 Lite | Headset TWS Bluetooth True Wireless Earphone Dual-mic Noise Cancellation Waterproof IPX4,405 Terjual,Rp269.000,KOTA JAKARTA UTARA
44,Thinkplus Lenovo SH1 Sport Bluetooth Earphone Wirelesss Headset/Handsfree 5.0,10RB+ Terjual,Rp99.000,KOTA TANGERANG
45,BASEUS Encok Earphone Bluetooth True Wireless Earphones WM01 - NGWM01,3RB Terjual,Rp175.000,KOTA JAKARTA BARAT
46,KZ Z1 Pro TWS Bluetooth 5.2 IPX6 - GARANSI RESMI,123 Terjual,Rp379.000,KOTA JAKARTA BARAT
47,CADE TWS Bluetooth Earphone Headset Airbuds True Wireless Stereo Original Garansi Resmi ET01,"3,5RB Terjual",Rp119.000,KAB. TANGERANG
48,Baseus - TWS - Bowie E3 Earbuds,231 Terjual,Rp277.000,KOTA SURABAYA
49,JBL T110 In Earphones with microphone - Garansi Resmi,10RB+ Terjual,Rp99.000,KOTA JAKARTA UTARA
50,Robot Airbuds Flybuds T10 Wireless Bluetooth Earphone TWS Earphone New Model,1RB Terjual,Rp140.000,KOTA JAKARTA SELATAN
51,Robot Wireless Earphone Bluetooth 5.3 Airbuds TWS T20S Black Original - Garansi 1 Tahun,10RB+ Terjual,Rp279.900,KOTA JAKARTA UTARA
52,Nokia E3511 ANC True Wireless Earphones TWS Low Latency HD - Black,KOTA JAKARTA BARAT,Rp458.900,Produk Serupa
53,Jabra Elite 4 Active True Wireless Earbuds,838 Terjual,Rp1.590.000,KOTA JAKARTA PUSAT
54,VIVAN Infinity GT2 TWS Wireless Earphone Airbuds Original BT 5.3 Playtime 40 Jam Headset Bluetooth Earbuds Semi In Ear - Garansi Resmi 1 Tahun,93 Terjual,Rp235.900,KOTA JAKARTA BARAT
55,Sony WF-C500 Truly Wireless Handsfree - Black Original TWS Earphone Headset Bluetooth Wireless Earbuds,"1,1RB Terjual",Rp999.000,KOTA JAKARTA PUSAT
56,Thinkplus Lenovo LP40 True Wireless Bluetooth Earphone Mini Earbuds TWS,10RB+ Terjual,Rp169.000,KOTA TANGERANG
57,Nokia E3100 Plus True Wireless Earbuds Bluetooth Earphone TWS Purple,"1,4RB Terjual",Rp198.900,KOTA JAKARTA BARAT
58,Baseus Bowie WM05 True Wireless Bluetooth Earphone Earbuds TWS ANC ENC,352 Terjual,Rp499.000,KOTA TANGERANG
59,Lenovo thinkplus XT80 True Wireless Bluetooth Earphone Sport TWS Noise Reduction Headset HiFi Stereo,10RB+ Terjual,Rp179.000,KAB. TANGERANG
