,Title,Total,Price,Location
0,NINTENDO SWITCH CHARGING DOCK/DOCKING+AC ADAPTOR/ADAPTER+HDMI CABLE - DOCKING ONLY,Terjual 70+,Rp479.000,Jakarta Utara
1,Nintendo Switch DOBE Charging Dock Joy-Con Controller,Terjual 100+,Rp99.000,Jakarta Barat
2,DOBE MULTI CHARGING DOCK JOY CON / JOYCON NINTENDO SWITCH,Terjual 80+,Rp139.000,Jakarta Utara
3,Nintendo Switch Pro Controller Original Pabrik,Terjual 250+,Rp349.000,Jakarta Barat
4,JOYCON / JOY CON / JOY PAD WIRED CONTROLLER,Terjual 22,Rp265.000,Jakarta Utara
5,NINTENDO SWITCH DOBE Charging Dock Joy-Con & Pro Controller,Terjual 750+,Rp125.000,Jakarta Utara
6,Nintendo Switch Dobe Joycon Joy Con Stik Stick + Charging Dock Tns1191,Terjual 50+,Rp304.000,Jakarta Utara
7,Nintendo Switch Dobe Joycon Joy Con Stik Stick + Charging Dock Tns1191,Terjual 50+,Rp304.000,Jakarta Utara
8,Dock + Kabel HDMI + Adaptor Charger Nintendo Switch Original,Terjual 100+,Rp60.000,Madiun
9,Nintendo Switch Charging Dock Joycon,Terjual 40+,Rp145.000,Jakarta Pusat
10,Dobe Nintendo Switch Charging Dock TNS-855,Terjual 8,Rp70.000,Jakarta Utara
11,Dobe Nintendo Switch Charging Dock TNS-855,Terjual 8,Rp70.000,Jakarta Utara
12,Nintendo Switch Lite NSL Charging Dock (For Switch Lite Only),Terjual 30+,Rp89.000,Jakarta Utara
13,Desktop charger dock 6in1 ipega pg-9187 for nitendo switch joycon,Terjual 40+,Rp139.500,Jakarta Utara
14,Dobe Charging Charger Dock Dok Joycon Joy con Nintendo Switch,Terjual 100+,Rp99.000,Surabaya
15,Hagibis Switch Dock for Nintendo Switch 65W GaN fast charger 4K HDMI,Terjual 1,Rp720.000,Jakarta Barat
16,AC ADAPTOR / ADAPTER CHARGER NINTENDO SWITCH (SUPPORT DOCKING),Terjual 70+,Rp199.000,Jakarta Utara
17,nintendo switch travel storage eva case,Terjual 80+,Rp599.000,Jakarta Utara
18,FRONT COVER PLATE FOR CHARGING DOCK / DOCKING NINTENDO SWITCH OLED - SPLATON OLED,Terjual 14,Rp98.000,Jakarta Utara
19,Nintendo Switch Dobe Charging Dock Joycon + Pro Controller TNS-879,Terjual 30+,Rp119.000,Jakarta Utara
20,PROMO !! Gulikit Nintendo Switch Joycon Charging Dock Original 4 Ports,Terjual 23,Rp154.000,Jakarta Barat
21,Dudukan Wall Mount Charging Dock Nintendo Switch Stand Holder 3d print,Terjual 30+,Rp90.000,Surakarta
22,Nintendo Switch Charger Dock Joycon Joy-Con Pro Controller,Terjual 100+,Rp150.000,Jakarta Pusat
23,IPEGA PG9186 PG-9186 Charging Charger for Nintendo switch Joycon DOCK,Terjual 40+,Rp82.490,Jakarta Barat
24,IPEGA PG9186 PG-9186 Charging Charger for Nintendo switch Joycon DOCK,Terjual 40+,Rp82.490,Jakarta Barat
25,IPEGA PG9186 PG-9186 Charging Charger for Nintendo switch Joycon DOCK,Terjual 40+,Rp82.490,Jakarta Barat
26,Nintendo Switch Dobe Charging Dock with Game Card Slot TNS-0122,Terjual 70+,Rp109.000,Jakarta Utara
27,Nintendo Switch / Switch Lite Adjustable Charging Charging Stand Dock,Terjual 50+,Rp129.000,Jakarta Utara
28,DOBE Nintendo Switch Lite Charging Dock Portable,Terjual 18,Rp75.000,Jakarta Selatan
29,Dobe Original Nintendo Switch Charging Dock TNS-855,Terjual 21,Rp44.900,Tangerang
30,Charger Dock Joy-Con Nintendo Switch Docking Console Ipega PG-9186C,Terjual 7,Rp80.000,Jakarta Barat
31,nintendo switch lite,Terjual 80+,Rp3.300.000,Jakarta Selatan
32,Charging Dock Nintendo Switch Stand Holder Charge IPEGA PG-9186,Terjual 7,Rp125.000,Kab. Tangerang
33,DOBE CHARGING DOCK JOYCON / JOY CON FOR NINTENDO SWITCH OLED / V1 / V2 - MERAH HITAM,Terjual 90+,Rp139.000,Jakarta Utara
34,Nintendo Switch Joycon Dobe Charging Dock - TNS-875,Terjual 100+,Rp84.999,Jakarta Utara
35,CHARGING DOCK NINTENDO SWITCH / OLED DOBE,Terjual 14,Rp145.000,Jakarta Barat
36,Dobe Dual Charging Dock TNS 853 for Nintendo Switch,Terjual 30+,Rp185.000,Jakarta Utara
37,Nyko AC Power Cord for Nintendo Switch (Support Dock Charge Dock Mode),Terjual 12,Rp375.000,Jakarta Utara
38,CHARGING DOCK JOY-CON NINTENDO SWITCH & PRO CONTROLLER,Terjual 12,Rp89.000,Jakarta Pusat
39,Docking Set Original Nintendo Switch OLED White Dock Charger HDMI,Terjual 11,Rp680.000,Makassar
40,Docking Set Original Nintendo Switch OLED White Dock Charger HDMI,Terjual 11,Rp680.000,Makassar
41,Dobe Multi Function Charging Dock Stand TNS-895 for Nintendo Switch,Terjual 1,Rp215.000,Jakarta Pusat
42,Dobe Charging Dock with Game Card Slot Nintendo Switch Black & White,Terjual 14,Rp175.000,Jakarta Utara
43,Dobe Charging Dock with Game Card Slot Nintendo Switch Black & White,Terjual 14,Rp175.000,Jakarta Utara
44,Nyko Charge Block Pro for Nintendo Switch (Dock Charging Mono Blok),Terjual 30+,Rp360.400,Jakarta Utara
45,Nyko Charge Block Pro for Nintendo Switch (Dock Charging Mono Blok),Terjual 30+,Rp360.400,Jakarta Utara
46,Dobe Nintendo Switch Charging Dock Joy-Con + Pro Controller / Console,Terjual 100+,Rp150.000,Jakarta Utara
47,DOBE Nintendo Switch Joy-Con Charging Dock / Quad Joy Con Charging,Terjual 40+,Rp109.000,Jakarta Utara
48,DOBE GAME PACK Nintendo Switch TNS-18115 / Charging Dock Folding Stand,Terjual 80+,Rp175.000,Jakarta Selatan
49,Nintendo Switch DOBE Charging Dock Joy-Con Controller,Terjual 100+,Rp99.000,Jakarta Barat
50,Nintendo Switch DOBE Charging Dock Joy-Con Controller,Terjual 100+,Rp99.000,Jakarta Barat
51,Nintendo Switch DOBE Charging Dock Joy-Con Controller,Terjual 100+,Rp99.000,Jakarta Barat
52,IPega PG-9186 Charger Dock 4 slot Nintendo Switch Joycon Joy con,Terjual 12,Rp129.000,Jakarta Utara
53,NINTENDO SWITCH CHARGING DOCK PORTABLE STAND VIDEO CONVERTER,Terjual 4,Rp319.000,Bandung
54,Dobe 6 in 1 Charging Dock with Game Card Slot Nintendo Switch TNS-0122,Terjual 13,Rp125.000,Jakarta Utara
55,Dobe 6 in 1 Charging Dock with Game Card Slot Nintendo Switch TNS-0122,Terjual 13,Rp125.000,Jakarta Utara
56,Charger Charging Dock Nintendo Switch Joy-Con DOBE,Terjual 250+,Rp89.990,Jakarta Barat
57,Nintendo Switch / Nintendo Switch Lite IPEGA 2 in 1 Charging Dock,Terjual 13,Rp150.000,Jakarta Utara
58,Dobe Joycon Charging Dock for Nintendo Switch,Terjual 30+,Rp199.900,Surabaya
59,Dobe Joycon Charging Dock for Nintendo Switch,Terjual 30+,Rp199.900,Surabaya
60,iPlay Nintendo Switch Lite Charging Dock Stand Charger ORI – Gray,Terjual 5,Rp89.000,Surabaya
61,Nintendo Switch AC Adapter Fast Charger 45 Watt Adaptor Support Dock,Terjual 3,Rp225.000,Jakarta Utara
62,Nintendo Switch Charging Dock Video Converter Portable Stand,Terjual 3,Rp319.000,Bandung
63,6 in 1 Multi Charging Dock Joy-Con JoyCon Docking Nintendo Switch OLED,Terjual 4,Rp140.000,Rp300.000
64,Horizontal Stand Dudukan for Nintendo Switch Charging Dock Holder - n0,Terjual 3,Rp99.000,Surakarta
65,Horizontal Stand Dudukan for Nintendo Switch Charging Dock Holder - n0,Terjual 3,Rp99.000,Surakarta
66,Horizontal Stand Dudukan for Nintendo Switch Charging Dock Holder - n0,Terjual 3,Rp99.000,Surakarta
67,Horizontal Stand Dudukan for Nintendo Switch Charging Dock Holder - n0,Terjual 3,Rp99.000,Surakarta
68,Dobe Nintendo Switch Joy-con Charging Dock Station with LED Indicator,Terjual 20,Rp130.000,Jakarta Utara
69,NINTENDO SWITCH DOBE Charging Dock Joy-Con,Terjual 40+,Rp86.000,Bandung
70,NINTENDO SWITCH DOBE Charging Dock Joy-Con,Terjual 40+,Rp86.000,Bandung
71,Nintendo Switch Multi Functional Charging Stand Dock Box Storage,Terjual 6,Rp75.000,Bekasi
72,Nintendo Switch Multi Functional Charging Stand Dock Box Storage,Terjual 6,Rp75.000,Bekasi
73,Charge charging Stand Station Dock Type-C Nintendo Switch Lite Hitam,Terjual 3,Rp100.000,Bekasi
74,Charge charging Stand Station Dock Type-C Nintendo Switch Lite Hitam,Terjual 3,Rp100.000,Bekasi
75,Charge charging Stand Station Dock Type-C Nintendo Switch Lite Hitam,Terjual 3,Rp100.000,Bekasi
76,Charge charging Stand Station Dock Type-C Nintendo Switch Lite Hitam,Terjual 3,Rp100.000,Bekasi
77,Charge charging Stand Station Dock Type-C Nintendo Switch Lite Hitam,Terjual 3,Rp100.000,Bekasi
78,Nintendo Switch Case Eva Ultra Slim Hardshell Carry Case,Terjual 40+,Rp250.000,Jakarta Utara
79,nintendo switch fornite edition,Terjual 14,Rp5.250.000,Jakarta Selatan
