,Title,Total,Price,Location
0,Monster USB connection 7.1 gaming Rgb headphones Computer Headset,Terjual 750+,Rp4.980.000,Jakarta Barat
1,Monster N1S Wired USB 7.1 Gaming Headset / Headphone,Terjual 100+,Rp1.660.000,Jakarta Barat
2,Xiberia Nubwo V20 Gaming Headset,Terjual 250+,Rp999.000,Jakarta Barat
3,Logitech G435 Headset Gaming Bluetooth Wireless Ultra-light,Terjual 1 rb+,Rp1.069.000,Dilayani Tokopedia
4,ONIKUMA X11 Cat Ears Gaming Headset,Terjual 30+,Rp669.000,Tangerang
5,Razer Kraken X - Multi Platform Black Gaming Headset,Terjual 4 rb+,Rp1.065.000,Dilayani Tokopedia
6,"Logitech Pro Gaming Headset Surround Sound, Noise Cancelling E-Sports",Terjual 1 rb+,Rp1.699.000,Dilayani Tokopedia
7,"Logitech Pro Gaming Headset Surround Sound, Noise Cancelling E-Sports",Terjual 1 rb+,Rp1.699.000,Dilayani Tokopedia
8,Mediatech Gaming Headset / Headphone Zeus MSH 016 - Merah,Terjual 5 rb+,Rp299.000,Jakarta Utara
9,Digital Alliance Headset Gaming Delta Art Plus Skarlet,Terjual 100+,Rp269.000,Jakarta Pusat
10,Cooler Master MasterPulse MH751 [MH-751] - Headset Gaming,Terjual 250+,Rp654.500,Jakarta Utara
11,Razer BlackShark V2 X 7.1 Surround Sound Gaming Headset Black Shark,Terjual 250+,Rp1.299.000,Jakarta Barat
12,Fantech ALTO 7.1 HG26 RGB Headset Gaming Multiplatform,Terjual 40+,Rp649.000,Jakarta Pusat
13,Razer Barracuda X - Wireless Multi-platform Gaming Headset (2022),Terjual 250+,Rp1.699.000,Dilayani Tokopedia
14,Headset Gaming Komic HG-K602-RGB Breathing PC/Mobile Free Spliter Jack,Terjual 500+,Rp399.000,Jakarta Pusat
15,Monster N3 Wired USB 7.1 Gaming Headset / Headphone RGB,Terjual 60+,Rp1.918.000,Jakarta Barat
16,Razer Hammerhead True Wireless X TWS Bluetooth Headset Gaming Earbuds,Terjual 250+,Rp1.199.000,Jakarta Barat
17,HEADSET GAMING SOYTO SY830MV STEREO BASS WITH LED LIGHT FOR PC LAPTOP - W-160,Terjual 8,Rp79.900,Jakarta Barat
18,"LOGITECH G435 LightSpeed Wireless Gaming Headset G 435 - White, Headset Only",Terjual 250+,Rp999.000,Jakarta Barat
19,HEADSET GAMING ONIKUMA K5 PRO SUPER BASS,Terjual 60+,Rp660.000,Tangerang
20,HEADSET GAMING ONIKUMA K5 PRO SUPER BASS,Terjual 60+,Rp660.000,Tangerang
21,Kingston HyperX Cloud II Pro Gaming Headset 7.1 Surround Sound Cloud 2,Terjual 1 rb+,Rp1.280.000,Jakarta Barat
22,Earphone Gaming | Headset Gaming JETE-X HX10 Mic Adjustable - Original,Terjual 90+,Rp249.900,Jakarta Pusat
23,Cooler Master MH670 | Headset Gaming,Terjual 26,Rp1.349.000,Jakarta Pusat
24,Earphone / Headset Gaming Roker FIGHTER,Terjual 250+,Rp259.000,Jakarta Pusat
25,Fantech VALOR MH86 Gaming Headset Multi Platform - Fantech MH-86,Terjual 750+,Rp499.000,Jakarta Pusat
26,Fantech VALOR MH86 Gaming Headset Multi Platform - Fantech MH-86,Terjual 750+,Rp499.000,Jakarta Pusat
27,Rexus Headset Gaming Vonix F30,Terjual 6 rb+,Rp269.000,Jakarta Utara
28,QKZ AK6 Headset with Mic Earphone Bass Headset Gaming,Terjual 3 rb+,Rp39.000,Jakarta Barat
29,QKZ AK6 Headset with Mic Earphone Bass Headset Gaming,Terjual 3 rb+,Rp39.000,Jakarta Barat
30,Headset Headphone Gaming Hyundai H6886 Headphone HP PC Laptop - Audio Splitter,Terjual 100+,Rp40.000,Jakarta Utara
31,Headset Gaming RGB LED Light Wire Audio Jack Input GH2100 GAMEN,Terjual 100+,Rp206.000,Jakarta Utara
32,JBL Quantum 910 Wireless Gaming Headset Headphone Quantum910 Q910,DUNIA COMPUTER & SERVICE,Rp3.999.000,7%
33,Edifier G1 SE BLACK - Gaming Headset,Terjual 100+,Rp260.000,Jakarta Pusat
34,Logitech G535 Lighspeed Wireless Gaming Headset G 535 - Headset Only,Terjual 50+,Rp1.999.000,Jakarta Barat
35,Fantech TRINITY MH88 Multiplatform Headset Gaming Mobile FREE SPLITTER,Terjual 70+,Rp159.000,Jakarta Pusat
36,Razer Hammerhead True Wireless X TWS Bluetooth Headset Gaming Earbuds,Terjual 250+,Rp1.199.000,Jakarta Barat
37,Headset Gaming Cooler Master MH751,Terjual 30+,Rp599.000,Jakarta Utara
38,Digital Alliance Headset Gaming Delta Armor Plus,Terjual 500+,Rp385.000,Jakarta Pusat
39,Fantech CHIEF II HG20 RGB Gaming Headset,Terjual 1 rb+,Rp349.000,Jakarta Barat
40,Headset Gaming/ Gaming Headphone HP H320 - USB+Jack RGB Gaming Headset,Terjual 500+,Rp510.000,Jakarta Pusat
41,Fantech FUSION HG22 RGB 7.1 Surround Sound - HG22 HG-22 Gaming Headset,Terjual 100+,Rp849.000,Jakarta Pusat
42,Fantech FUSION HG22 RGB 7.1 Surround Sound - HG22 HG-22 Gaming Headset,Terjual 100+,Rp849.000,Jakarta Pusat
43,"Logitech Pro X Gaming Headset 7.1, Blue Vo!ce for E-Sports",Terjual 1 rb+,Rp2.399.000,Dilayani Tokopedia
44,Headset Gaming Pc Laptop M-Tech A4,Terjual 1 rb+,Rp66.500,Jakarta Pusat
45,HD Mic KT-02 Bass Headset For Gaming Live Stream Sing Recording Smule,Terjual 1 rb+,Rp95.000,Kab. Tangerang
46,Cooler Master MH751 - Multi Platform Gaming Stereo Headset,Terjual 30+,Rp629.000,Jakarta Utara
47,Logitech G535 LIGHTSPEED Headset Gaming Wireless - Black,Terjual 100+,Rp1.999.000,Dilayani Tokopedia
48,earphone headset gaming razer hammerhead pro v2.0 Original,Terjual 4 rb+,Rp169.999,Bekasi
49,Rexus Headset Gaming Vonix F80,Terjual 1 rb+,Rp449.000,Jakarta Utara
50,Digital Alliance Headset Gaming Delta Art X Skarlet,Terjual 100+,Rp299.000,Jakarta Pusat
51,Headset Gaming Rexus Vonix F30 - Headphone RGB F 30,Terjual 500+,Rp179.000,Jakarta Pusat
52,Earphone Headset Gaming Razer Hammerhead Pro V2 Original,Terjual 250+,Rp169.999,Jakarta Selatan
53,Fantech FLASH HQ53 Gaming Headset With Red Lighting Effect,Terjual 250+,Rp218.000,Jakarta Pusat
54,Fantech FLASH HQ53 Gaming Headset With Red Lighting Effect,Terjual 250+,Rp218.000,Jakarta Pusat
55,MOVIO Stand Headphone Headset - Tempat Gantungan Head Phone Gaming,Terjual 250+,Rp59.000,Jakarta Barat
56,Sades T-Power SA-701 Gaming Headset,Terjual 2 rb+,Rp135.000,Jakarta Pusat
57,Cooler Master MH650 Gaming Headset [MH-650],Terjual 60+,Rp649.000,Jakarta Utara
58,Cooler Master MH650 Gaming Headset [MH-650],Terjual 60+,Rp649.000,Jakarta Utara
59,Cooler Master MH650 Gaming Headset [MH-650],Terjual 60+,Rp649.000,Jakarta Utara
60,Earphone / Headset Gaming Roker TANK,Terjual 100+,Rp199.000,Jakarta Pusat
61,Monster USB connection 7.1 gaming Rgb headphones Computer Headset,Terjual 750+,Rp4.980.000,Jakarta Barat
62,HyperX Cloud II Gaming Headset Kingston Hyper X Cloud 2 Headphone game,Terjual 250+,Rp1.216.000,Bandung
63,Kingston HyperX Cloud Alpha Pro Gaming Headset With Aluminum Frame,Terjual 250+,Rp1.350.000,Jakarta Barat
64,ECLE Headset / Earphone Gaming Noice Reduction Microphone Hitam,Terjual 2 rb+,Rp140.000,Kab. Bekasi
65,Logitech G331 Headset Gaming Stereo Flip to Mute Mic,Terjual 2 rb+,Rp999.000,Dilayani Tokopedia
66,Rexus HX25 Thundervox Stream Gaming Headset,Terjual 250+,Rp285.000,Jakarta Utara
67,Rexus HX25 Thundervox Stream Gaming Headset,Terjual 250+,Rp285.000,Jakarta Utara
68,ASUS ROG Delta S Animate Gaming Headset,Terjual 2,Rp3.526.000,Jakarta Pusat
69,Headset Rexus Gaming Vonix F30 Dual Jack with USB,Terjual 750+,Rp145.000,Bandung
70,Headset Rexus Gaming Vonix F30 Dual Jack with USB,Terjual 750+,Rp145.000,Bandung
71,Headset GAMING INCUS IN13,Terjual 40+,Rp30.000,Jakarta Pusat
72,Headset GAMING INCUS IN13,Terjual 40+,Rp30.000,Jakarta Pusat
73,Headset dbE GM150 GM 150 Professional 3.5MM - Gaming - Garansi Resmi,Terjual 250+,Rp140.000,Tasikmalaya
74,Headset dbE GM150 GM 150 Professional 3.5MM - Gaming - Garansi Resmi,Terjual 250+,Rp140.000,Tasikmalaya
75,ONIKUMA K9 Headset Gaming 7.1 Stereo Surround Telinga Kucing,Terjual 30+,Rp339.000,Jakarta Pusat
76,"Logitech Pro Gaming Headset Surround Sound, Noise Cancelling E-Sports",Terjual 1 rb+,Rp1.699.000,Dilayani Tokopedia
77,Razer Barracuda X 2022 Multi-platform Wireless Gaming Headset,Terjual 80+,Rp1.999.000,Jakarta Barat
78,Fantech VALOR MH86 Headset Gaming Mobile Multi Platform Gaming Headset,Terjual 500+,Rp500.000,Jakarta Barat
79,COPPER EXTRA BASS Series Earphone/Headset/Handsfree CP014 - Putih,Terjual 10 rb+,Rp110.000,Jakarta Barat
