,Title,Total,Price,Location
0,Headphone / Headset kabel Stereo HiFi quality Audio profesional RT-888 - Putih,Terjual 1,Rp33.000,Jakarta Barat
1,Headphone / Headset kabel Stereo HiFi quality Audio profesional RT-888 - Putih,Terjual 1,Rp33.000,Jakarta Barat
2,Baseus Encok Wireless headphone D02 Pro - NGD02-C,Terjual 50+,Rp489.000,Jakarta Utara
3,Inbox BI-03 Headphone Bando Gaming kabel Bass Stereo dengan Mic,Terjual 9,Rp100.750,Surabaya
4,dbE DJ100 High Quality Foldable DJ Headphone w/ Detachable Cable,Terjual 1 rb+,Rp305.000,Jakarta Selatan
5,Headphone Headset Kabel Anak Unitech J19 + Microphone Extra Bass,Terjual 1 rb+,Rp99.000,Jakarta Utara
6,Sony WH-CH700N Aux Cable Jack 3.5mm High End Headphone Cable,Terjual 100+,Rp35.000,Kab. Tangerang
7,MINISO Headset Earphone Kabel Earbuds In Ear Headphone Klasik Musik,Terjual 10 rb+,Rp59.900,Dilayani Tokopedia
8,Headphone Headset Kabel Anak Unitech J19 + Microphone Extra Bass,Terjual 100+,Rp99.000,Jakarta Utara
9,Headphone Kabel MDR-XB450 - Headphone / Headset XB-450 EXTRA BASS,Terjual 250+,Rp44.000,Jakarta Barat
10,High End Headphone Cable Aux 8 Braid Silver Plated M2M Audiophile,Terjual 100+,Rp150.000,Kab. Tangerang
11,Kabel Adapter iPhone -Splitter Converter Lightning 2in1 Headphone Jack,Terjual 1 rb+,Rp39.500,Jakarta Pusat
12,Acetech Headphone Headset Kabel XB450AP With Microphone Extra Bass,Terjual 500+,Rp25.000,Surabaya
13,Kabel iPhone to Headphone Jack Adapter Lightning to Headphone Aux Jack,Terjual 100+,Rp25.000,Jakarta Barat
14,Kabel iPhone to Headphone Jack Adapter Lightning to Headphone Aux Jack,Terjual 100+,Rp25.000,Jakarta Barat
15,UGREEN 40673 Kabel Extension Audio AUX Jack 3.5mm HiFi Headphone PC,Terjual 100+,Rp65.000,Jakarta Utara
16,KIIP WIRELESS TH30 HEADPHONE BLUETOOTH HEADSET EARPHONE,Terjual 1 rb+,Rp559.000,Tangerang
17,Inbox BI-06 Headphone Full Bass | Bando Gaming kabel Stereo Music | GA,Terjual 1,Rp108.250,Surabaya
18,UGREEN 40673 KABEL EXTENSION AUX 3.5MM AUDIO CABLE HIFI HEADPHONE PC,Terjual 13,Rp59.000,Jakarta Utara
19,Audio Technica ATH-CKD3C In - Ear Headphone with USB Type C Connector - Black,Terjual 40+,Rp465.000,Jakarta Utara
20,Kabel Audio Jack 3.5Mm Universal Iphone Adapter Lightning to Headphone,Terjual 250+,Rp15.500,Jakarta Selatan
21,dbE DJ100 High Quality Foldable DJ Headphone w/ Detachable Cable,Terjual 1 rb+,Rp305.000,Jakarta Selatan
22,dbE DJ100 High Quality Foldable DJ Headphone w/ Detachable Cable,Terjual 1 rb+,Rp305.000,Jakarta Selatan
23,HAVIT H2262D Wired/Kabel Foldable Headphone,Terjual 3,Rp79.900,Malang
24,kabel iphone to headphone jack adapter lighting to headphone aux jack,Terjual 70+,Rp30.000,Jakarta Utara
25,Recable Reterminate Servis Kabel Cable Headphone Earphone,Terjual 10 rb+,Rp10.000,Tangerang Selatan
26,UGREEN 50361 Kabel Aux Jack 3.5mm Audio Earphone Headphone Speaker,Terjual 250+,Rp55.000,Jakarta Utara
27,Conec Coil Cable Headphone Replacement / Kabel Spiral Headphone,Terjual 100+,Rp75.000,Jakarta Utara
28,Taffware Kabel Jack Audio AUX 3.5mm Speaker Headphone Spring Pendek,Terjual 90+,Rp9.900,Jakarta Barat
29,Business Headphone / Headset MPOW HC6 - Mic / Microphone & USB Cable,Terjual 250+,Rp239.000,Jakarta Utara
30,Philips TAH2005 Black Over-Ear Wired Headphone / TAH 2005 / TAH2005BK,Terjual 100+,Rp299.000,Jakarta Pusat
31,Earmax Headphone Cable Replacement For AKG K450 K451 K452 Q460 K480 - Black Braid,Terjual 6,Rp90.000,Kab. Tangerang
32,Headphone Headset Kabel Unitech J18 Macaron + Microphone Extra Bass - Merah Muda,Terjual 100+,Rp35.000,Surabaya
33,Headset | Handsfree | Headphone Bando JETE HB5,Terjual 500+,Rp235.001,Jakarta Pusat
34,Bose 2.5mm to 3.5mm Headphone Cable With Mic Volume Control,Terjual 250+,Rp50.000,Kab. Tangerang
35,Headphone JBL MDR-XB450 ExtraBass Headset Bando JBL Kabel Suara Bagus,Terjual 100+,Rp27.500,Depok
36,Kabel Audio Usb Type C To Jack Audio 3.5mm Adapter USB C To Headphone,Terjual 50+,Rp9.900,Jakarta Pusat
37,Kabel Audio Usb Type C To Jack Audio 3.5mm Adapter USB C To Headphone,Terjual 50+,Rp9.900,Jakarta Pusat
38,Kabel Audio Usb Type C To Jack Audio 3.5mm Adapter USB C To Headphone,Terjual 50+,Rp9.900,Jakarta Pusat
39,Sony INZONE H3 Wired Cable Kabel Gaming Headset Headphone MDR-G300,Terjual 30+,Rp1.499.000,Dilayani Tokopedia
40,UGREEN 40673 Kabel Extension Audio AUX Jack 3.5mm HiFi Headphone PC,Terjual 100+,Rp65.000,Jakarta Utara
41,Gaming Cable Replacement for Headphone SteelSeries Arctis 3 5 7 8P,Terjual 500+,Rp85.000,Kab. Tangerang
42,Kabel Audio Stereo Input AUX Headphone Kabel Head Skerem Meteran,Terjual 1 rb+,Rp5.500,Depok
43,Kabel Jack 3.5mm Audio AUX with Mic untuk Headphone Headset Marshall,Terjual 40+,Rp20.800,Kab. Bogor
44,Custom HiFi Headphone Cable Aux Replacement 2.5mm 3.5mm With Mic,Terjual 250+,Rp45.000,Kab. Tangerang
45,Custom HiFi Headphone Cable Aux Replacement 2.5mm 3.5mm With Mic,Terjual 250+,Rp45.000,Kab. Tangerang
46,HiFi Premium 3.5mm Aux Headphone Cable With Mic Volume Control,Terjual 250+,Rp58.000,Kab. Tangerang
47,Vention BAB - 1.5M Kabel Aux 6.5mm Male to 3.5mm Male kabel headphone,Terjual 90+,Rp34.000,Bandung
48,KABEL EXTENSION JACK AUDIO AUX 1.5 M MALE TO FEMALE EXTENDER HEADPHONE,Terjual 16,Rp6.900,Jakarta Barat
49,Dbe DJ100 DJ 100 Foldable DJ Headphone with Detachable Cable,Terjual 28,Rp279.900,Bandung
50,Adapter Audio iPhone Kabel Converter Lightning To Headphone Jack 3.5mm,Terjual 250+,Rp16.500,Depok
51,UGREEN Kabel Adaptor MFI Lightning To 3.5mm Headphone Jack 3.5mm,Terjual 4,Rp165.000,Jakarta Barat
52,Jack Microphone Cable Headphone Marshall Major 1 2 3 I II III Monitor,Terjual 80+,Rp120.000,Jakarta Timur
53,V-Moda Coil Pro Cable Headphones,Terjual 10,Rp556.000,Jakarta Utara
54,Kabel Splitter Audio 3.5mm Male to 3.5mm HiFi Microphone Headphone Red,Terjual 2 rb+,Rp6.888,Depok
55,High End 1.5m Headphone Aux Audio Cable HiFi Sound Quality Jack 3.5mm,Terjual 40+,Rp125.000,Kab. Tangerang
56,Headphone Kabel MDR-XB-450 AP EXTRABASS,Terjual 4,Rp21.000,Jakarta Barat
57,dbE DJ100 High Quality Foldable DJ Headphone Detachable Cable,Terjual 90+,Rp289.000,Semarang
58,Kabel Apple Lightning to 3.5mm Headphone Jack Adapter Iphone 7,Terjual 500+,Rp15.250,Jakarta Barat
59,Kabel Apple Lightning to 3.5mm Headphone Jack Adapter Iphone 7,Terjual 500+,Rp15.250,Jakarta Barat
60,Vention B06-M 2M - Kabel Extension 3.5mm perpanjangan headphone,Terjual 80+,Rp40.000,Bandung
61,Vention B06-M 5M - Kabel Extension 3.5mm perpanjangan headphone,Terjual 100+,Rp55.000,Bandung
62,CIJI 3.5 to Lightning Cable Adaptor Bluetooth Headphone Audio Jack,Terjual 250+,Rp29.000,Tangerang
63,PHILIPS SHP2500 - HEADPHONE KABEL 6 METER (for TV),Terjual 3,Rp165.000,Bekasi
64,Klip penjepit kabel headphone headset earphone kerah baju lavalier,Terjual 100+,Rp3.000,Surabaya
65,Kabel Aux Audio Jack 3.5mm Headphone Marshall Major 1 2 I II Monitor,Terjual 15,Rp118.000,Jakarta Timur
66,Vention Kabel AUX Audio Headphone 3.5mm Male to Male Premium Audio,Terjual 50+,Rp31.000,Tangerang
67,Headphone Marshall Major II Premium Headphone Wired Kabel,Terjual 90+,Rp325.000,Kab. Tangerang
68,UGREEN Kabel AUX Elbow Audio JACK 3.5mm Male to Male Speaker Headphone,Terjual 6,Rp39.000,Jakarta Barat
69,"Kabel Jack 3,5 MM Microphone Cable Aux Headphone Marshall Major II III",Terjual 9,Rp75.000,Kab. Tangerang
70,"Kabel Jack 3,5 MM Microphone Cable Aux Headphone Marshall Major II III",Terjual 9,Rp75.000,Kab. Tangerang
71,AVPRO AVL102 Replacement Headphone Cable w Mic f ATH-M50XBT 3.5mm,Terjual 11,Rp285.000,Jakarta Pusat
72,NIA Headphone/Headset Bluetooth Bisa Micro SD Radio Kabel Aux,Terjual 70+,Rp170.000,Jakarta Utara
73,NIA Headphone/Headset Bluetooth Bisa Micro SD Radio Kabel Aux,Terjual 70+,Rp170.000,Jakarta Utara
74,Kabel Audio Splitter 3.5mm 30CM Male To Dual Female Headphone Mic,Terjual 100+,Rp17.732,Jakarta Barat
75,UGREEN 50361 Kabel Aux Jack 3.5mm Audio Earphone Headphone Speaker,Terjual 250+,Rp55.000,Jakarta Utara
76,HGM-012 SOHA Headset Cute Unicorn SWAROVSKI DIAMOND Kabel Headphone - Rose Gold,Terjual 60+,Rp91.500,Jakarta Barat
77,JBL C150SI headphone with mic earphone headset original IMS c 150 si,Terjual 16,Rp110.000,Bandung
78,Headset Headphone JETE HB2 Noise Cancelling - Garansi 2 Tahun,Terjual 1 rb+,Rp194.800,Surabaya
79,Sony WH-CH700N Aux Cable Jack 3.5mm High End Headphone Cable,Terjual 100+,Rp35.000,Kab. Tangerang
