,Title,Total,Price,Location
0,Paket Combo Gaming Keyboard RGB with Mouse Gaming Bundle,Terjual 1 rb+,Rp99.500,Bandung
1,Paket Keyboard Gaming dan Mouse ZENOM G21B RGB USB Cable,Terjual 80+,Rp200.000,Jakarta Pusat
2,"LEAVEN K620 hotswap keyboard mechanical gaming TKL RGB typec mekanikal - hitam putih, blue switch",Terjual 500+,Rp269.000,Kab. Tangerang
3,Rexus Daiva RX-D68SF South Facing Keyboard Gaming RXD68 SF/ D68 RGB,Terjual 100+,Rp549.000,Jakarta Barat
4,Logitech G213 Prodigy Gaming Keyboard,Terjual 500+,Rp619.000,Jakarta Utara
5,GAMEN Titan Elite Mechanical Pluggable Switch Gaming Keyboard WiredRGB,Terjual 3 rb+,Rp500.000,Jakarta Utara
6,Keyboard Gaming / Gaming Keyboard HP K300 - RGB Membrane Keyboard USB,Terjual 2 rb+,Rp245.000,Jakarta Pusat
7,Logitech G213 Prodigy Keyboard Gaming RGB Lighting,Terjual 3 rb+,Rp1.099.000,Dilayani Tokopedia
8,Keyboard Gaming NYK TKL K-01,Terjual 1 rb+,Rp145.000,Jakarta Pusat
9,KEYBOARD INFORCE GAMING KB1822 1822 ILLUMINATED WATERPROOF WIRED,Terjual 250+,Rp106.000,Dilayani Tokopedia
10,Redragon Mechanical Gaming Keyboard DRAGONBORN WHITE - K630W,Terjual 2 rb+,Rp450.000,Jakarta Utara
11,Keyboard Gaming MSI Mechanical Vigor GK30 RGB,Terjual 80+,Rp415.000,Jakarta Pusat
12,Keyboard Gaming Multimedia Membrane AULA F2028 – RGB Macro Software,Terjual 1 rb+,Rp335.000,Jakarta Pusat
13,Aula Gaming Keyboard 61% Wired Membrane F3061 Led RGB Running,Terjual 60+,Rp745.000,Jakarta Pusat
14,Rexus Legionare MX5.2 - Gaming Keyboard,Terjual 250+,Rp379.000,Jakarta Barat
15,Rexus Keyboard Gaming K9E,Terjual 500+,Rp269.000,Jakarta Utara
16,Keyboard Gaming NYK Nemesis Eris K-06 RGB Wired With Phone Holder - Putih,Terjual 25,Rp135.000,Jakarta Pusat
17,Redragon Mechanical Gaming Keyboard 60% WHITE GREY RAINBOW FIZZ-K617-R,Terjual 750+,Rp420.000,Jakarta Utara
18,Redragon Mechanical Gaming Keyboard 60% WHITE GREY RAINBOW FIZZ-K617-R,Terjual 750+,Rp420.000,Jakarta Utara
19,Logitech G213 Prodigy Keyboard Gaming RGB Lighting,Terjual 3 rb+,Rp1.099.000,Dilayani Tokopedia
20,"Keyboard Gaming NYK Eris K06, NYK K-06 Eris / NYK K06 Eris / NYK K 06",Terjual 250+,Rp120.000,Jakarta Pusat
21,Gamen Titan III / 3 RGB Mechanical Gaming Keyboard,Terjual 750+,Rp352.000,Jakarta Utara
22,SKU-1233 KEYBOARD GAMING ONE HAND T-WOLF T19 BACKLIGHT SINGLE HAND,Terjual 100+,Rp83.000,Jakarta Barat
23,NYK Nemesis Underglow KR-301 RGB Keyboard Gaming,Terjual 100+,Rp189.000,Jakarta Barat
24,Keyboard Gaming / Gaming Keyboard HP K100 - RGB Membrane Keyboard USB,Terjual 1 rb+,Rp299.000,Jakarta Pusat
25,Keyboard Gaming Mechanical AULA F-2066 II Blue Switch -RGB Rainbow LED,Terjual 1 rb+,Rp750.000,Jakarta Pusat
26,Fantech Fighter K613 TKL - RGB Gaming Keyboard,Terjual 2 rb+,Rp349.000,Jakarta Barat
27,Rexus Legoinare MX3.2 - Gaming keyboard,Terjual 21,Rp348.000,Jakarta Pusat
28,Keyboard Gaming Mechanical AULA F-3287 TKL - K-RGD Blue Switch White,Terjual 100+,Rp750.000,Jakarta Pusat
29,Rexus Keyboard Gaming Mini Battlefire K68M,Terjual 250+,Rp329.000,Jakarta Utara
30,Rexus Daiva 68 SF Max D68SF DaivaSFMax SFMax Keyboard Gaming Wireless,Terjual 9,Rp685.000,Jakarta Utara
31,Rexus Daiva D68SF Max Wireless Mechanical Gaming Keyboard D68 SF,Terjual 18,Rp899.000,Jakarta Barat
32,Keyboard AOC GK500 GK 500 Gaming RGB Mechanical Switch,Terjual 18,Rp379.900,Depok
33,MONSGEEK MG75 KEYBOARD KIT - Keyboard Gaming,Terjual 2,Rp499.000,Cashback 5%
34,Logitech G413 TKL SE Keyboard Gaming TKL Mechanical G 413,Terjual 28,Rp1.009.000,Jakarta Barat
35,Keybord Gaming RGB G20 Leopard Keyboard RGB,Terjual 100+,Rp73.999,Surabaya
36,ASUS ROG Strix Scope RX Optical RGB - Gaming Keyboard,Terjual 7,Rp1.699.000,Jakarta Pusat
37,Keyboard Gaming Imperion Warrior 10 KG-W10C,Terjual 500+,Rp325.000,Jakarta Pusat
38,Rexus MX5.2 TKL Mechanical Gaming Keyboard,Terjual 500+,Rp375.000,Jakarta Utara
39,JETE Keyboard Gaming KBX1 RGB Wired 3600 DPI - Garansi 2 Tahun,Terjual 100+,Rp375.000,Jakarta Pusat
40,JETE Keyboard Gaming KBX1 RGB Wired 3600 DPI - Garansi 2 Tahun,Terjual 100+,Rp375.000,Jakarta Pusat
41,NYK Nemesis K-01 / K01 TKL Wired Gaming Keyboard,Terjual 100+,Rp125.000,Jakarta Utara
42,Fantech MK857 Maxfit61 Wired Mechanical Gaming Keyboard,Terjual 750+,Rp459.000,Jakarta Utara
43,Logitech G213 RGB Gaming Keyboard,Terjual 40+,Rp619.000,Dilayani Tokopedia
44,Logitech G512 Keyboard Gaming Mechanical RGB Lighting - Tactile Brown,Terjual 500+,Rp1.859.000,Dilayani Tokopedia
45,Keyboard Gaming Mechanical AULA F-2067 TKL - K-RGD Blue Switch-New LED,Terjual 1 rb+,Rp650.000,Jakarta Pusat
46,Keyboard Gaming Fantech Hunter PRO K511 Rainbow Edition,Terjual 80+,Rp122.000,Jakarta Pusat
47,Steelseries Apex 3 TKL - Gaming Keyboard,Terjual 70+,Rp895.000,Jakarta Pusat
48,Fantech K613L Pink Fighter II RGB Gaming Keyboard - Sakura Edition,Terjual 11,Rp200.000,Jakarta Pusat
49,Fantech K613L Pink Fighter II RGB Gaming Keyboard - Sakura Edition,Terjual 11,Rp200.000,Jakarta Pusat
50,Fantech K613L Pink Fighter II RGB Gaming Keyboard - Sakura Edition,Terjual 11,Rp200.000,Jakarta Pusat
51,Fantech K613L Pink Fighter II RGB Gaming Keyboard - Sakura Edition,Terjual 11,Rp200.000,Jakarta Pusat
52,ASUS ROG Claymore II Mechanical Gaming Keyboard with ROG RX Switch,Terjual 60+,Rp3.499.000,Jakarta Pusat
53,GAMEN Titan Elite Mechanical Pluggable Switch Gaming Keyboard WiredRGB,Terjual 250+,Rp500.000,Jakarta Utara
54,Batknight Keyboard Gaming T20 Multimedia Waterproof Membrane,Terjual 70+,Rp115.000,Jakarta Pusat
55,Logitech G213 Prodigy Gaming Keyboard,Terjual 500+,Rp619.000,Jakarta Utara
56,Redragon Gaming Wrist Rest Pad TKL Keyboard METEOR M - P036,Terjual 1 rb+,Rp90.000,Jakarta Utara
57,Rexus Daiva RX-D68SF South Facing Keyboard Gaming RXD68 SF/ D68 RGB,Terjual 100+,Rp549.000,Jakarta Barat
58,Rexus Keyboard Gaming Mechanical Legionare MX9 TKL RGB,Terjual 2 rb+,Rp549.000,Jakarta Utara
59,MSI Vigor GK30 - Gaming Keyboard,Terjual 80+,Rp416.000,Jakarta Pusat
60,MSI Vigor GK30 - Gaming Keyboard,Terjual 80+,Rp416.000,Jakarta Pusat
61,MSI Vigor GK30 - Gaming Keyboard,Terjual 80+,Rp416.000,Jakarta Pusat
62,Digital alliance Gaming Keyboard Meca 8X Plus,Terjual 250+,Rp599.000,Dilayani Tokopedia
63,keyboard gaming rexus K9TKL K9 TKL anti ghosting,Terjual 19,Rp152.900,Jakarta Barat
64,Tecware Phantom L TKL RGB Low Profile Mechanical Gaming Keyboard,Terjual 100+,Rp579.000,Jakarta Pusat
65,Tecware Phantom L TKL RGB Low Profile Mechanical Gaming Keyboard,Terjual 100+,Rp579.000,Jakarta Pusat
66,Tecware Phantom L TKL RGB Low Profile Mechanical Gaming Keyboard,Terjual 100+,Rp579.000,Jakarta Pusat
67,Keyboard Gaming Mechanical Digital Alliance Meca Fighter Ice SE TKL,Terjual 90+,Rp315.000,Jakarta Pusat
68,Keyboard Gaming Mechanical NYK Nemesis MKN-01 EZALOR,Terjual 250+,Rp377.400,Jakarta Pusat
69,Fantech MAXPOWER MK853 Mechanical Keyboard Gaming SPACE EDITION,Terjual 500+,Rp799.000,Jakarta Barat
70,Fantech MAXPOWER MK853 Mechanical Keyboard Gaming SPACE EDITION,Terjual 500+,Rp799.000,Jakarta Barat
71,Bloody S510N/S510R BLMS Mechanical Gaming Keyboard - Icy White,Terjual 23,Rp475.000,Jakarta Barat
72,Keyboard Gaming NYK K02 Sacred Backlight- NYK k-02,Terjual 70+,Rp110.000,Kab. Sleman
73,Rexus Keyboard Gaming K9E,Terjual 500+,Rp269.000,Jakarta Utara
74,Fantech K511 Hunter Pro Keyboard Gaming,Terjual 250+,Rp129.000,Jakarta Pusat
75,Gaming RGB mouse and keyboard Bundle,Terjual 100+,Rp119.500,Bandung
76,Divipard Keyboard Gaming GK-20 Kabel USB 2.0 Plus LED Lightning,Terjual 14,Rp200.000,Jakarta Utara
77,Rexus Daxa M64 Classic Gateron Hotswap Mechanical Gaming Keyboard,Terjual 40+,Rp749.000,Jakarta Barat
78,Keyboard Gaming Imperion Sledgehammer 10 KG-S10B Rainbow Backlight,Terjual 500+,Rp230.000,Jakarta Pusat
79,Keyboard Mouse Gaming Rexus Warfaction Vr1 Backlight,Terjual 3 rb+,Rp225.000,Jakarta Barat
