,Title,Total,Price,Location
0,kursi kerja kursi kantor kursi staf kursi gaming kursi gamer,Terjual 250+,Rp850.000,Jakarta Utara
1,kursi jaring kursi kantor kursi kerja kursi staff kursi gaming,Terjual 250+,Rp580.000,Jakarta Utara
2,Fantech Kursi Kerja Kantor OCA258 Premium Office Chair,Terjual 2 rb+,Rp1.999.000,Jakarta Barat
3,Deli Office Chair / Kursi Kantor / Kursi Kerja Sandaran Tangan E4931,Terjual 750+,Rp1.000.000,Kab. Tangerang
4,kursi kantor kerja kursi jaring staff direktur manager kursi komputer,Terjual 19,Rp580.000,Jakarta Utara
5,Kursi Kerja Kantor Staff KK 4005 E,Terjual 1 rb+,Rp317.000,Tangerang Selatan
6,Kursi Kerja Kantor Staff KK 4005 E,Terjual 1 rb+,Rp317.000,Tangerang Selatan
7,Kursi Kerja Kantor Staff KK 4005 E,Terjual 1 rb+,Rp317.000,Tangerang Selatan
8,KURSI DIREKTUR MANAGER OFFICE CHAIR MESH SDK KANTOR MEETING KERJA,Terjual 250+,Rp338.000,Bekasi
9,"Kursi kerja , Kursi Jaring , Kursi Gaming ASTUTE-A Chair (BARU)",Terjual 1 rb+,Rp714.000,Jakarta Selatan
10,Deli Office Chair / Kursi Kantor / Kursi Kerja Sandaran Tangan E4931,Terjual 750+,Rp1.000.000,Kab. Tangerang
11,Kursi Kantor Kursi Kerja Kursi Jaring Putar Kursi Hidrolik Kursi Staff,Terjual 4 rb+,Rp500.000,Jakarta Barat
12,Kursi Kantor Kursi Kerja Kursi Jaring Putar Kursi Hidrolik Kursi Staff,Terjual 4 rb+,Rp500.000,Jakarta Barat
13,Kursi Kantor Hidrolik Kursi Kerja Jaring Putar Kursi Belajar Komputer,Terjual 1 rb+,Rp500.000,Jakarta Barat
14,MBK KURSI KANTOR KURSI KERJA DIREKTUR KURSI GAMING,Terjual 1 rb+,Rp699.000,Kab. Tangerang
15,Kursi Kantor Kursi Kerja Kursi Hidrolik Kursi Staff Kursi Jaring Putar - 888 Black,Terjual 250+,Rp500.000,Jakarta Barat
16,kursi kantor kursi kerja kursi staff office chair kursi staf kursi,Terjual 100+,Rp940.000,Jakarta Utara
17,SitStand Office Chair Kursi Kerja Kantor Ergonomic Bangku Staff M76,Terjual 750+,Rp1.499.000,Jakarta Barat
18,Fantech OCA259 Kursi Kantor Kerja Jaring Premium Office Chair,Terjual 250+,Rp2.999.000,Jakarta Barat
19,KURSI KANTOR KURSI KERJA KURSI DIREKTUR KURSI STAFF,Terjual 3 rb+,Rp479.000,Kab. Tangerang
20,"Kursi kerja , Kursi Jaring , Kursi Gaming ASTUTE-A Chair (LUAR KOTA)",Terjual 100+,Rp714.000,Jakarta Selatan
21,kursi kantor kursi kerja kursi staff office chair kursi staf kursi,Terjual 100+,Rp940.000,Jakarta Utara
22,Kursi Kantor Kerja Hidrolik Kursi Komputer Jaring Putar Kursi Belajar,Terjual 2 rb+,Rp500.000,Jakarta Barat
23,"kursi kantor, kursi kerja, kursi jaring, kursi gaming ,kursi belajar",Terjual 250+,Rp309.000,Tangerang
24,KURSI KERJA KANTOR OFFICE RODA JARING MESH HIDROLIK MANAGER STAF RAPAT,Terjual 750+,Rp298.000,Bekasi
25,"kursi gaming, kursi jaring, kursi belajar, kursi kantor, kursi kerja",Terjual 250+,Rp374.000,Tangerang
26,Kursi Kerja Direktur Kantor Manager Bahan Kulit Hidrolik Gaming,Terjual 750+,Rp1.500.000,Jakarta Barat
27,kursi kerja kursi kantor kursi staf kursi gaming kursi gamer,Terjual 250+,Rp850.000,Jakarta Utara
28,kursi kerja kursi kantor kursi staf kursi gaming kursi gamer,Terjual 250+,Rp850.000,Jakarta Utara
29,Kursi Kantor Kerja Hidrolik Kursi Komputer Kursi Salon Roda - White,Terjual 50+,Rp427.000,Jakarta Barat
30,MBK KURSI KANTOR KURSI KERJA DIREKTUR KURSI GAMING,Terjual 1 rb+,Rp699.000,Kab. Tangerang
31,Kursi Kantor Jaring Kursi Kerja Kursi Gaming Kursi Murah Kursi Belajar,Terjual 250+,Rp299.000,Tangerang
32,Kursi Meeting Kursi Hadap Kursi Kantor Kursi Kerja,Terjual 250+,Rp399.000,Kab. Tangerang
33,Kursi Kantor Kursi Gaming Kursi Kerja kursi jaring kursi direktur,Terjual 30+,Rp1.500.000,Jakarta Utara
34,Kursi Kantor Kursi Kerja Kursi Staff Highline,Terjual 1 rb+,Rp680.000,Kab. Tangerang
35,"Kursi Jaring Kantor , Kursi Kerja , Kursi Putar Hidrolis",Terjual 2 rb+,Rp257.500,Jakarta Barat
36,Kursi Kantor Jaring Kursi Kerja Kursi Gaming Kursi Murah Kursi Belajar,Terjual 250+,Rp299.000,Tangerang
37,Kursi Kantor Kursi Kerja Kursi Staff Highline,Terjual 1 rb+,Rp680.000,Kab. Tangerang
38,"Kursi kantor, kursi staff, kursi kerja, kursi ergonomis, Office Chair",Terjual 100+,Rp309.000,Tangerang
39,KURSI KANTOR KURSI KERJA KURSI STAFF KURSI DIREKTUR,Terjual 1 rb+,Rp479.000,Kab. Tangerang
40,Kursi Kantor Hidrolik Kursi Mekanis Kursi Kerja Jaring Terlaris,Terjual 250+,Rp800.000,Jakarta Barat
41,Kursi Kantor Hidrolik Kursi Mekanis Kursi Kerja Jaring Terlaris,Terjual 250+,Rp800.000,Jakarta Barat
42,Kursi Kantor Hidrolik Kursi Mekanis Kursi Kerja Jaring Terlaris,Terjual 250+,Rp800.000,Jakarta Barat
43,Kursi Kerja Staf / Kursi Kerja Promo Insperra Miki Pro (instan),Terjual 24,Rp332.000,Tangerang Selatan
44,KURSI GAMING CHAIR KANTOR DIREKTUR MANAGER KERJA OFFICE KULIT OSCAR,Terjual 60+,Rp769.000,Bekasi
45,"Kursi kantor,kursi staff,kursi kerja,kursi direksi",Terjual 4 rb+,Rp375.000,Tangerang
46,Fantech OCA259 OC-A259 Kursi Kantor Kerja Premium Office Chair Gaming,Terjual 40+,Rp1.899.000,Jakarta Utara
47,kursi jaring kursi kantor kursi kerja kursi staff kursi gaming,Terjual 250+,Rp580.000,Jakarta Utara
48,Deli Office Chair/Kursi Kantor/Kursi Kerja Ada Bantalan Tangan E4930,Terjual 29,Rp567.900,Kab. Tangerang
49,Kursi Kerja Kursi Kantor Kursi Gaming Astute A ( Khusus Luar kota ),Terjual 250+,Rp714.000,Tangerang Selatan
50,Kursi Kerja Staff Insperra Alvio (Tidak Terpasang) (pickup showroom),Terjual 18,Rp307.000,Tangerang Selatan
51,Kursi Kerja Kantor Direktur Kursi Direksi Neo (INSTANT),Terjual 100+,Rp750.000,Jakarta Selatan
52,Kursi Kerja Kursi Kantor Kursi Gaming Kursi Jaring Astute-R,Terjual 90+,Rp995.000,Jakarta Barat
53,Kursi Kerja Kursi Kantor Kursi Gaming Kursi Jaring Astute-R,Terjual 90+,Rp995.000,Jakarta Barat
54,Kursi Meeting Kursi Hadap Kursi Kantor Kursi Kerja,Terjual 250+,Rp399.000,Kab. Tangerang
55,"PROMO KURSI KANTOR HADAP, KURSI KERJA MEETING, KURSI WARNET",Terjual 70+,Rp355.000,Jakarta Selatan
56,KURSI KERJA KANTOR JARING ( IMPORT ),Terjual 250+,Rp350.000,Jakarta Timur
57,Kursi Kerja Kursi Kantor Kursi Staff KK 4005 E,Terjual 90+,Rp310.000,Bekasi
58,Kursi Direktur Kantor Kerja Office Chair Hidrolik Kulit Premium Murah,Terjual 100+,Rp1.500.000,Jakarta Barat
59,Office chair kursi kantor kursi manager kursi kerja footrest,Terjual 90+,Rp980.000,Jakarta Utara
60,Office chair kursi kantor kursi manager kursi kerja footrest,Terjual 90+,Rp980.000,Jakarta Utara
61,Vusign Office Chair / Kursi Kantor / Kursi Kerja Jaring E4925 E4926,Terjual 50+,Rp530.900,Kab. Tangerang
62,Deli Office Chair / Kursi Kantor Kerja Dengan Sandaran Kaki E4935,Terjual 50+,Rp1.780.000,Kab. Tangerang
63,Kursi Kantor Kerja Hidrolik Kursi Komputer Kursi Salon Roda - Putih,Terjual 21,Rp427.400,Jakarta Barat
64,Kursi Kantor Kerja Hidrolik Kursi Komputer Kursi Salon Roda - Putih,Terjual 21,Rp427.400,Jakarta Barat
65,Kursi Kantor Kursi Kerja Direktur Direksi Premium Highline,Terjual 27,Rp2.490.000,Kab. Tangerang
66,"Kursi kerja , Kursi Jaring , Kursi Gaming ASTUTE-A Chair (BARU)",Terjual 750+,Rp714.000,Jakarta Barat
67,Kursi Kerja Kantor Jaring Direktur / Manager Vetto Pro( Instan ),Terjual 40+,Rp552.000,Tangerang Selatan
68,KURSI HADAP MEETING KANTOR MESH JARING R TUNGGU KERJA RAPAT TAMU,Terjual 500+,Rp375.000,Bekasi
69,KURSI KANTOR KURSI KERJA KURSI DIREKTUR KURSI STAFF,Terjual 3 rb+,Rp479.000,Kab. Tangerang
70,Kursi Kantor Kursi Kerja ECOS SKM 3303 - Mekar Furniture,Terjual 1 rb+,Rp550.000,Jakarta Pusat
71,Kursi Kantor Kursi Kerja ECOS SKM 3303 - Mekar Furniture,Terjual 1 rb+,Rp550.000,Jakarta Pusat
72,"Kursi Kantor, Kursi Gaming, Kursi Kerja AXEL",Terjual 100+,Rp816.000,Jakarta Selatan
73,Kursi Kerja Kursi Kantor Kursi jaring MOZA (Baru),Terjual 100+,Rp500.000,Jakarta Barat
74,Deli Office Chair / Kursi Kantor Kerja Jaring Bantalan Tangan E4930,Terjual 750+,Rp598.000,Kab. Tangerang
75,Kursi Kantor Kursi Kerja Kursi Belajar Kursi Gaming Kursi Belajar,Terjual 1,Rp389.350,Rp599.000
76,Kursi kantor hadap kursi kerja kursi kerja kursi staff kursi belajar,FURNITURESTOREE,Rp340.000,32%
77,kursi kerja hidrolik jaring staff manager kursi staff sandaran kepala,Terjual 250+,Rp1.050.000,Jakarta Utara
78,Kursi manager kursi direktur kursi kantor kursi kerja kayu tinggi A,Terjual 21,Rp3.000.000,Jakarta Utara
79,KURSI KANTOR KURSI KERJA KURSI STAFF KURSI DIREKTUR,Terjual 1 rb+,Rp479.000,Kab. Tangerang
