,Title,Total,Price,Location
0,Case Nintendo Switch Oled Spigen Rugged Armor Grip Cover Carbon Casing - Matte Black,Terjual 100+,Rp325.000,Jakarta Barat
1,Nintendo Switch Case Eva Ultra Slim Hardshell Carry Case,Terjual 40+,Rp250.000,Jakarta Utara
2,Meo/Memo Casing Nintendo Switch Case V1/V2 TPU Black Soft Case,Terjual 100+,Rp69.000,Tangerang
3,Case Pouch Nintendo Switch OLED Spigen Rugged Armor Pro Travel Sleeve,Terjual 250+,Rp425.000,Jakarta Barat
4,nintendo switch travel storage eva case,Terjual 80+,Rp599.000,Jakarta Utara
5,Nintendo Switch Lite DOBE Storage Case / Pouch TNS-19091 (Black),Terjual 500+,Rp75.000,Jakarta Utara
6,Nintendo Switch Nyko Thin Case,Terjual 750+,Rp125.000,Jakarta Utara
7,Nintendo Switch Lite DOBE TPU Case TNS-19072 (Bening/Clear/Transparan),Terjual 500+,Rp55.000,Jakarta Utara
8,Nintendo Switch Lite HKFZ TPU Protective Case Cover Shockproof Clear,Terjual 250+,Rp69.000,Jakarta Utara
9,Nintendo Switch V1 V2 OLED Airform EVA Pouch Carrying Case + Handle,Terjual 100+,Rp99.000,Jakarta Utara
10,Nintendo Switch Oled Dobe Crystal Case Clear Casing Mika TNS-1133B,Terjual 250+,Rp70.000,Jakarta Utara
11,Dobe Storage Eva Bag Tas Slempang Travel Case Nintendo Switch ALL Acc,Terjual 100+,Rp299.000,Jakarta Utara
12,Dobe Storage Eva Bag Tas Slempang Travel Case Nintendo Switch ALL Acc,Terjual 100+,Rp299.000,Jakarta Utara
13,Tas Case Casing Bag Nintendo Switch Oled Complete Set Travel Stand,Terjual 100+,Rp249.000,Jakarta Pusat
14,NINTENDO SWITCH NYKO THIN CASE (CLEAR),Terjual 750+,Rp122.000,Jakarta Barat
15,Smatree N500 Case for Nintendo Switch (Tas Casing),Terjual 100+,Rp648.000,Jakarta Barat
16,Nintendo Switch Case Airfoam,Terjual 40+,Rp225.000,Jakarta Utara
17,Case NINTENDO SWITCH OLED SUPCASE UB PRO Rugged Protective Cover,Terjual 30+,Rp425.000,Jakarta Barat
18,Full Hard Case Clear Nintendo Switch Protection Transparant Premium,Terjual 250+,Rp75.000,Surabaya
19,PROTECTIVE CASE/CHASING NINTENDO SWITCH OLED - Pink Puffy,Terjual 50+,Rp129.000,Jakarta Utara
20,Nintendo Switch DOBE Hard Shell Crystal Clear Case SUPPORT DOCKING,Terjual 100+,Rp79.000,Jakarta Utara
21,Skull & Co GripCase OLED for Nintendo SWITCH OLED TPU Case Tas,Terjual 30+,Rp339.000,Jakarta Pusat
22,Dobe Storage Case for Nintendo Switch Lite TNS 19091 / Pouch Lite,Terjual 1 rb+,Rp89.000,Jakarta Selatan
23,Nintendo Switch V1 V2 Oled Pouch Tas Bag Carry Case,Terjual 750+,Rp125.000,Jakarta Utara
24,Nintendo Switch Oled Dobe Protective Case Casing Crystal Clear 1173,Terjual 100+,Rp85.000,Jakarta Utara
25,Nintendo Switch Switch Lite Carrying Case Soft Pouch Simple Bag Case,Terjual 250+,Rp89.000,Jakarta Utara
26,Nintendo Switch Nyko Thin Case (Blue/Red),Terjual 14,Rp90.000,Jakarta Selatan
27,IPLAY HBS-156X Carrying Case Nintendo switch Lite console 10 in 1,Terjual 50+,Rp50.000,Tangerang
28,Nintendo Switch OLED DOBE Protective Case Grip Handgrip Tns-1190,Terjual 50+,Rp100.000,Jakarta Utara
29,Nyko Thin Case for Nintendo Switch (Thin Clear Transparent Case),Terjual 100+,Rp149.000,Jakarta Utara
30,Nintendo Switch OLED Tas Case Travel with Storage Hard Cover,Terjual 90+,Rp135.000,Jakarta Utara
31,Tas Case Casing Bag Nintendo Switch Oled Complete Set Travel Stand,Terjual 100+,Rp249.000,Jakarta Pusat
32,Game Card Case Storage Casing Nintendo Switch / Switch Lite Card Slot - CLEAR,Terjual 100+,Rp70.000,Jakarta Utara
33,STORAGE CASE / TRAVEL BAG 7 IN 1 FOR NINTENDO SWITCH OLED,Terjual 23,Rp149.000,Jakarta Utara
34,Case Nintendo Switch OLED Model Premium Rugged Silicone Soft Casing,Terjual 70+,Rp129.000,Jakarta Utara
35,Nintendo Switch Lite Dobe Silicone Case Curved TNS-19099 (Camouflage),Terjual 28,Rp75.000,Jakarta Utara
36,Nintendo Switch Oled Nyko Thin Case + Tempered Glass,Terjual 250+,Rp155.000,Jakarta Utara
37,Nintendo switch oled Tas Travel Storage carrying Case Mario Pokemon,Terjual 80+,Rp294.000,Jakarta Barat
38,Nintendo Switch Lite TPU Protective Case Cover Shockproof Silicon Lite,Terjual 100+,Rp69.000,Jakarta Selatan
39,Casing Mika Crystal Case Nintendo Switch Lite,Terjual 100+,Rp49.000,Bekasi
40,"Nintendo Switch HORI Premium Game Card Case Zelda BOTW ""Z""",Terjual 90+,Rp79.000,Jakarta Utara
41,"Nintendo Switch HORI Premium Game Card Case Zelda BOTW ""Z""",Terjual 90+,Rp79.000,Jakarta Utara
42,Nintendo Switch Lite Skull & Co. EDC Case Bundle Lite Case / TPU / EVA,Terjual 100+,Rp275.000,Jakarta Utara
43,Tas Airfoam Air Foam Pouch Hardcase Case Nintendo Switch,Terjual 500+,Rp99.000,Jakarta Pusat
44,Hardcase Hard Case Tas Travel Mini Bag Nintendo Switch V1 V2 OLED,Terjual 80+,Rp199.000,Jakarta Pusat
45,Hardcase Hard Case Tas Travel Mini Bag Nintendo Switch V1 V2 OLED,Terjual 80+,Rp199.000,Jakarta Pusat
46,Nintendo Switch Premium Game Card Case Question Block Edition,Terjual 24,Rp79.000,Jakarta Utara
47,Nintendo Switch Carrying Case Split Pad Pro Bag Monste Hunter Rise Ed,Terjual 40+,Rp249.000,Jakarta Utara
48,Switch Carrying Case u/ Nintendo Switch + Omelet Joycon,Terjual 100+,Rp159.999,Jakarta Timur
49,17 in 1 Nintendo Switch OLED Pouch Tempered Glass Crystal Case Switch,Terjual 30+,Rp299.000,Jakarta Pusat
50,BUBM Hardcase Storage Box Protective Case SWITCH-J for Nintendo Switch,Terjual 50+,Rp259.000,Jakarta Selatan
51,Nintendo Switch Premium Game Card Case Monster Hunter Rise,Terjual 24,Rp85.000,Jakarta Utara
52,Nintendo Switch Premium Game Card Case Pokeball Storage,Terjual 19,Rp79.000,Jakarta Utara
53,IINE Crystal Case SPLATOON Nintendo Switch Oled Protective Case L710,Terjual 40+,Rp150.000,Jakarta Selatan
54,Detachable Crystal Case Mika Protector Nintendo Switch,Terjual 250+,Rp98.000,Bekasi
55,Dobe Nintendo Switch Oled Protective Case Casing Crystal Clear w Grip,Terjual 19,Rp125.000,Jakarta Utara
56,Dobe Nintendo Switch Oled Protective Case Casing Crystal Clear w Grip,Terjual 19,Rp125.000,Jakarta Utara
57,Nintendo switch premium game card case / tempat cartridge game 12 slot,Terjual 100+,Rp85.000,Tangerang
58,Nintendo switch premium game card case / tempat cartridge game 12 slot,Terjual 100+,Rp85.000,Tangerang
59,Nintendo switch oled v1v2 storage bag pouch travel case,Terjual 250+,Rp59.000,Tangerang
60,Crystal Case Clear Nintendo Switch OLED Dobe TNS 1133B,Terjual 100+,Rp100.000,Jakarta Pusat
61,Crystal Case Clear Nintendo Switch OLED Dobe TNS 1133B,Terjual 100+,Rp100.000,Jakarta Pusat
62,Crystal Case Clear Nintendo Switch OLED Dobe TNS 1133B,Terjual 100+,Rp100.000,Jakarta Pusat
63,Nintendo Switch Lite HORI ORI TPU Case Pikachu,Terjual 4,Rp299.000,Jakarta Utara
64,Nyko Thin Case Nintendo Switch OLED Clear Transparent Case BODY ONLY,Terjual 30+,Rp109.000,Jakarta Utara
65,Nyko Thin Case Nintendo Switch OLED Clear Transparent Case BODY ONLY,Terjual 30+,Rp109.000,Jakarta Utara
66,Nintendo Switch Comfort And Protect Pack / Case Protection Grip 7 in 1,Terjual 19,Rp175.000,Jakarta Utara
67,Nintendo Switch Lite DOBE TPU Case TNS-19072 (Crystal Case/Transparan),Terjual 500+,Rp59.000,Jakarta Selatan
68,Nintendo Switch Skull & Co Maxcarry Grip Case Pokemon Edition,Terjual 30+,Rp539.000,Jakarta Pusat
69,Nintendo Switch Lite DOBE Crystal Case / Mika TNS-19071 (Bening/Clear),Terjual 500+,Rp59.000,Jakarta Utara
70,Skull & Co Maxcarry Case Tas Max Carry Nintendo Switch Oled,Terjual 40+,Rp399.000,Jakarta Pusat
71,Meo/Memo Casing Nintendo Switch Case V1/V2 TPU Black Soft Case,Terjual 100+,Rp69.000,Tangerang
72,Hard Pouch Case Pro Controller Nintendo Switch Stik Xbox One,Terjual 500+,Rp88.900,Bekasi
73,Nintendo Switch DOBE Joycon Joy Con Protective Case With Handle Grip,Terjual 7,Rp39.000,Jakarta Utara
74,Nyko Thin Case Nintendo Switch OLED Clear Transparent Case + Tempered,Terjual 30+,Rp155.000,Jakarta Utara
75,Tas Nintendo Switch Pouch UGREEN Hardcase Switch Case Hardshell,Terjual 100+,Rp125.000,Tangerang
76,Case Nintendo Switch / Switch Lite Rugged Silicone Carbon Soft Casing,Terjual 250+,Rp99.000,Jakarta Utara
77,Pouch Tas Airfoam Air Foam Hardcase Case Nintendo Switch ,Terjual 2,Rp50.000,Jakarta Barat
78,Pouch Dobe Storage Case Nintendo Switch OLED TNS-1130 / Storage Bag,Terjual 25,Rp85.000,Jakarta Barat
79,Nintendo Switch Oled V2 Neon Hard Pouch Tas Bag Carry Case Mario Zelda,Terjual 100+,Rp59.000,Jakarta Utara
