,Title,Total,Price,Location
0,X8 Mini Portable Proyektor Home untuk Android WiFi LED Rumah Projector,Terjual 2,Rp859.000,Jakarta Utara
1,Mini Projector LED YG300 Projector Theater Garansi,Terjual 30+,Rp299.000,Jakarta Timur
2,Yourday YRD300M Ultra Mini LED Proyektor Wifi Miracast,Terjual 2,Rp849.000,Kab. Bandung Barat
3,4K Smart Android Mini LED Portable Projector 4000 Lumens 1080p WIFI,Terjual 100+,Rp1.899.000,Jakarta Barat
4,Projector Mini LED M420H 2500 Lumens Support 1080P Android Proyektor,Terjual 9,Rp980.000,Surabaya
5,Proyektor / projector mini Portable Aukey RD-860 LED Wireless Support,Terjual 100+,Rp2.500.000,Jakarta Pusat
6,Projector Mini LED YG300 YG-300 YG 300 Portable Proyektor High Quality,Terjual 250+,Rp349.000,Surabaya
7,Lampu LED Motor Projector VOXX LED M30 36W H6 H4 H7 Hi-Lo Mini Projie,Terjual 100+,Rp144.950,Jakarta Timur
8,HEADLAMP H4 LAMPU LED VINYX V9 PROJIE MINI PROJECTOR LENS MOTOR MOBIL,Terjual 100+,Rp207.000,Jakarta Utara
9,Projector Mini LED YG 300 Proyektor Theater Mini Kuning Garansi YG300,Terjual 100+,Rp305.000,Jakarta Timur
10,Projie Led / Mini Projector Led RTD M01B H4 / RTD M01B Led Original,Terjual 1 rb+,Rp213.675,Jakarta Utara
11,Lampu LED Mobil Motor Projector T9 H4 Projie Mini Hi-Lo 72W 8000LM,Terjual 100+,Rp389.750,Jakarta Timur
12,Mini Proyektor LED YG300 / YG-300 / YG 300 LCD Portable Projector Home,Terjual 5 rb+,Rp319.000,Jakarta Barat
13,Super Mini Projector Led Motor H4 H6 M8 Sinar Terang,Terjual 2 rb+,Rp231.000,Jakarta Utara
14,Lampu LED V9 vinyx H4 mini Lens Projector 36 Watt,Terjual 100+,Rp214.500,Jakarta Barat
15,Projector Proyektor Mini Portable LED Asus ZenBeam L1 300 Lumens Wifi,Abditama Official,Rp8.669.900,Cashback 4%
16,Cheerlux C9 Mini LED 2800 Lumens Projector Proyektor TV Tuner,Terjual 1 rb+,Rp1.025.000,Jakarta Utara
17,Proyektor LED-tripsky-1080P HD home theater T3 mini proyektor - T5,Terjual 100+,Rp880.000,Jakarta Utara
18,ViewSonic M1 mini Plus - Ultra-Portable Smart LED Projector|120 LUMENS,Terjual 90+,Rp3.650.000,Jakarta Barat
19,ROCKWARE YT400 BASIC VERSION - Mini LED Projector 40 ANSI Lumens,Terjual 7,Rp559.000,Jakarta Barat
20,Cheerlux C9 Mini LED 2800 Lumens Projector Proyektor TV Tuner,Terjual 1 rb+,Rp1.025.000,Jakarta Utara
21,LAMPU LED MINI PROJECTOR MP1S 9NINE LUMINOS ORIGINAL SUPER TERANG,Terjual 250+,Rp149.900,Jakarta Barat
22,Lampu utama Led RTD M01X Mini Projector H4 cut off motor mobil,Terjual 90+,Rp236.000,Jakarta Utara
23,Wanbo Mini Portable LED Home Projector 1080P Supported 200 ANSI Lumens,Terjual 250+,Rp1.799.000,Jakarta Utara
24,Lampu LED Mobil H4 Projie Mini Projector Hi-Lo 60W 8000LM 6000K,Terjual 100+,Rp595.000,Jakarta Timur
25,Mini Projector LED YG300 Projector Theater Garansi,Terjual 30+,Rp299.000,Jakarta Timur
26,Lampu utama led rtd m8 projector mini h6 h4 hs1 projie proji cut off,Terjual 1 rb+,Rp231.000,Jakarta Utara
27,Lampu Led Luminos H6 Projector Mini h4 hs1 Projie proji cut off MP1s,Terjual 100+,Rp143.500,Jakarta Barat
28,YG300 Mini Projector LED 320 x 240 pixels YG-300 Proyektor YG 300,Terjual 250+,Rp317.000,Jakarta Pusat
29,Mini BILED Projector Autovision Celebes 40 Watt - 4 Mode Lampu Biled,Terjual 30+,Rp235.000,Jakarta Selatan
30,CHEERLUX C9 WiFi + TV TUNER - Mini LED Projector 2800 Lumens 1080p,Terjual 30+,Rp1.240.000,Jakarta Barat
31,Projector UNIC UC28CH Mirroring Screen Mini Portable LED Proyektor,4.6,Rp500.000,Cashback 2%
32,Cheerlux C9 Mini LED 720P Projector 2800 Lumens + Analog TV/TV TUNNER - No ATV,Terjual 100+,Rp1.000.000,Jakarta Barat
33,ROCKWARE RW-YT500 - Mini Portable LED Projector 24 ANSI Lumens - Hitam,Terjual 9,Rp473.000,Jakarta Barat
34,Ezzrale EZ320 Mini Led Projector (150 ANSI),Terjual 27,Rp1.500.000,Tangerang
35,HEADLAMP MOBIL H4 MODEL Y6 HEADLAMP PROJIE LED MINI PROJECTOR MOBIL,Terjual 17,Rp395.000,Jakarta Utara
36,V9 Aeslux | Lampu LED Headlamp V9 AESLUX Mobil Motor Mini Projector H4,Terjual 15,Rp650.000,Jakarta Utara
37,V9 Aeslux | Lampu LED Headlamp V9 AESLUX Mobil Motor Mini Projector H4,Terjual 15,Rp650.000,Jakarta Utara
38,Mini Proyektor Cheerlux C9 Android WiFi TV Tuner LED Projektor,Terjual 250+,Rp1.399.000,Jakarta Barat
39,Lampu led tembak 2 mata lampu led mini projector 2 mata u series,Terjual 12,Rp435.000,Tangerang
40,Lampu sorot mini driving projector motor mobil 2 pojie putih kuning,Terjual 12,Rp110.000,Jakarta Barat
41,Lampu sorot mini driving projector motor mobil 2 pojie putih kuning,Terjual 12,Rp110.000,Jakarta Barat
42,ViewSonic M1 mini Plus - Ultra-Portable Smart LED Projector|120 LUMENS,Terjual 90+,Rp3.650.000,Jakarta Barat
43,LAMPU LED MINI PROJECTOR PROJIE H4 Y7D SUPER BRIGHT MOBIL MOTOR,Terjual 250+,Rp185.000,Kab. Tangerang
44,Lampu utama led rtd m01x mini projector h4 projie cut off motor mobil,Terjual 250+,Rp236.000,Jakarta Utara
45,Mini Portable Projector LED 400 Lumens with Analog TV Receiver- VS320+,Terjual 29,Rp371.000,Jakarta Pusat
46,LAMPU LED 9NINE LASER MINI PROJECTOR 3 MATA CHIP CSP Q9 HI LOW 37 WATT,Terjual 21,Rp489.900,Jakarta Barat
47,Ezzrale EZ320 Mini Led Projector (150 ANSI),Terjual 27,Rp1.500.000,Tangerang
48,Lampu Utama LED RTD m8 projector mini h6 h4 hs1 projie HID NEW cut off,Terjual 100+,Rp225.000,Jakarta Barat
49,Lampu LED RTD Proyektor Mini M8 H4 H6,Terjual 250+,Rp231.000,Jakarta Barat
50,Lampu LED RTD Proyektor Mini M8 H4 H6,Terjual 250+,Rp231.000,Jakarta Barat
51,ROCKWARE YT400 BASIC VERSION - Mini LED Projector 40 ANSI Lumens,Terjual 9,Rp564.900,Jakarta Barat
52,Lampu utama Led RTD M01B Mini Projector H4 Cut off motor mobil,Terjual 40+,Rp213.675,Jakarta Utara
53,Mini BiLed Sniper 1.8 Inch E6 Projector Projie Led Bi led Bi-LED Vahid,Terjual 5,Rp450.000,Jakarta Utara
54,CHEERLUX C10 WiFi TV Tuner Mini LED Projector 2600 Lumens 720p,Terjual 250+,Rp975.000,Jakarta Barat
55,LED PROJECTOR MOBIL LAMPU MINIPROJIE SABER SR3 MINI PROJIE MINI LED,Terjual 80+,Rp1.700.000,Surabaya
56,H100 - MIni LED Projector 100 Lumens - Proyektor LED Portabel,Terjual 250+,Rp498.900,Jakarta Barat
57,LAMPU LED MOBIL MINI PROJECTOR SABER SR3 MINI PROJIE,Terjual 19,Rp1.800.000,Jakarta Pusat
58,LED H4 V9 VYNIX MINI PROJECTOR MOTOR MOBIL CUT OFF,Terjual 23,Rp290.000,Kab. Sragen
59,Y7 D RADIANCE LAMPU HEADLAMP MINI PROJECTOR H4 UNIVERSAL,Terjual 3,Rp620.000,Jakarta Utara
60,Mini Proyektor LED YG300 / YG-300 LCD Portable Projector Home - Kuning,Terjual 60+,Rp297.225,Surabaya
61,Mini Projector Led H4 RTD M01B H4 / RTD M01B Led Original HS,Terjual 1 rb+,Rp213.675,Jakarta Utara
62,Mini BiLed Sniper 1.8 Inch E5 Projector Projie Led Bi led Bi-LED Vahid,Terjual 8,Rp450.000,Jakarta Utara
63,Mini BiLed Sniper 1.8 Inch E5 Projector Projie Led Bi led Bi-LED Vahid,Terjual 8,Rp450.000,Jakarta Utara
64,Mini Proyektor LED YG300 / YG-300 / YG 300 LCD Portable Projector Home,Terjual 80+,Rp94.600,Jakarta Utara
65,LAMPU LED LASER MOBIL MINI PROJECTOR SABER SR1 NANO MINI PROJIE,Terjual 20,Rp1.100.000,Jakarta Pusat
66,Mini Projector YG300 LED Proyektor YG-300,Terjual 100+,Rp341.700,Bandung
67,LAMPU LED V88 MACRONE MINI PROJECTOR H4 6000K HIGH QUALITY,Terjual 100+,Rp850.000,Jakarta Pusat
68,Bi Led Fog Light Projector Autovision BiLED Foglamp Mini Projie 70Watt,Terjual 24,Rp845.500,Surakarta
69,Bohlam Bulb HID H1 Mini untuk Projie Projector,Terjual 100+,Rp112.500,Jakarta Utara
70,Bohlam Bulb HID H1 Mini untuk Projie Projector,Terjual 100+,Rp112.500,Jakarta Utara
71,LED LASER PROJECTOR MINI SABER SR1 NANO MINI PROJIE LAMPU LED MOBIL,Terjual 30+,Rp1.100.000,Jakarta Pusat
72,Mini Projector Led H4 H7 3000K 6000K RTD A8 Original,Terjual 100+,Rp760.000,Jakarta Utara
73,ROCKWARE RW-H88 - Mini Portable LED Projector 1000 Lumens YG300 Killer,Terjual 100+,Rp525.000,Jakarta Barat
74,ROCKWARE RW-H88 - Mini Portable LED Projector 1000 Lumens YG300 Killer,Terjual 100+,Rp525.000,Jakarta Barat
75,UNIC J21 - Proyektor LED Mini 2000 Lumens - Support Resolusi 1080P - Black,Terjual 11,Rp639.000,Jakarta Barat
76,YG300 Mini Projector LED 320 x 240 pixels YG-300 Proyektor YG 300,Terjual 3 rb+,Rp370.000,Jakarta Utara
77,Projector Mini LED YG300 YG-300 YG 300 Portable Proyektor High Quality,Terjual 250+,Rp349.000,Surabaya
78,Projector Proyektor Mini LED Canon MP250 250lm Wifi BT Android Speaker,Terjual 4,Rp6.299.900,Depok
79,Infokus Infocus Projektor Proyektor Projector CHEERLUX C6 Mini LED LCD,Terjual 8,Rp1.345.000,Jakarta Timur
