,Title,Total,Price,Location
0,KAOS POLOS PRIA COTTON COMBED 30S REGULER FIT LENGAN PENDEK - XS,Terjual 500 rb+,Rp48.000,Jakarta Barat
1,kaos baju polos unisex/t-shirt kaos polos lengan pendek,Terjual 100+,Rp18.500,Jakarta Barat
2,Kaos Polos KALOSTEE Premium Basic 28s 100% Cotton Black Size XS - XL - XS,Terjual 3 rb+,Rp50.000,Jakarta Barat
3,[TEBAL] KAOS POLOS COTTON COMBED 20S | KATUN COMBED PREMIUM | S-XXL,Terjual 5 rb+,Rp32.000,Jakarta Barat
4,Kaos Polos KALOSTEE Basic 30s 100% Natural Cotton Combed - HITAM,Terjual 1 rb+,Rp38.000,Jakarta Barat
5,KAOS ( POLOS DEWASA OBLONG) SIZE S M L XL XXL XXXL,Terjual 7 rb+,Rp18.000,Jakarta Barat
6,FortKlass Kaos Polos Premium Lengan Pendek Catton Combed 30S,Terjual 4 rb+,Rp116.000,Jakarta Barat
7,Sipolos Kaos Polos Lengan Pendek Twotone Misty Cotton 30'S,Terjual 10 rb+,Rp69.900,Bandung
8,KAOS POLOS PRIA COTTON COMBED 30S REGULER FIT LENGAN PENDEK,Terjual 500 rb+,Rp48.000,Jakarta Barat
9,[TEBAL] KAOS POLOS COTTON COMBED 20S | KATUN COMBED PREMIUM | S-XXL,Terjual 5 rb+,Rp32.000,Jakarta Barat
10,Otsky Kaos Polos Pocket Katun 24s Tshirt,Terjual 1 rb+,Rp210.000,Bandar Lampung
11,Kaos polos premium 100% cotton combed 30s,Terjual 10 rb+,Rp27.000,Tangerang
12,KAOS POLOS COTTON BAMBOO | S-XL | KATUN BAMBU 30S | PRIA WANITA DISTRO,Terjual 7 rb+,Rp36.900,Jakarta Barat
13,Kaos Polos Oblong Pendek Soft Combed 30s,Terjual 100 rb+,Rp25.000,Jakarta Barat
14,FortKlass Kaos Oversize Polos T-Shirt Cowo Premium Kaos Big Size,Terjual 1 rb+,Rp184.000,Jakarta Barat
15,KAOS POLOS KATUN COMBED PREMIUM 30S / KAOS PRIA / UNISEX / O NECK XXL,Terjual 10 rb+,Rp44.900,Kab. Tangerang
16,KAOS POLOS PREMIUM COTTON COMBED 24S REGULER FIT T-SHIRT LENGAN PENDEK - S,Terjual 2 rb+,Rp62.000,Jakarta Barat
17,Cottonology Kaos Polos Cotton Bamboo Lengan Pendek Navy,Terjual 250+,Rp150.000,Bandung
18,Kaos Polos Cotton Combed 20s Putih,Terjual 10 rb+,Rp24.000,Jakarta Barat
19,Zalmore Basic Men Oneck T-Shirt Premium Cotton - Kaos Polos Pria,Terjual 1 rb+,Rp90.000,Kab. Bandung
20,Zalmore Basic Men Oneck T-Shirt Premium Cotton - Kaos Polos Pria,Terjual 1 rb+,Rp90.000,Kab. Bandung
21,Kaos Polos New States Apparel 7200 Premium Cotton T-shirt,Terjual 10 rb+,Rp50.000,Jakarta Barat
22,Kaos Polos Premium Namako Tee Frameless - Japan Tshirt - KAOS SANTAI,Terjual 2 rb+,Rp35.500,Jakarta Utara
23,Otsky Kaos Polos Pocket CB Cotton Combed 24s,Terjual 90+,Rp210.000,Bandar Lampung
24,Kaos Polos New States Apparel NSA - Heavyweight 5400 Cotton Combed 24s,Terjual 750+,Rp61.000,Jakarta Selatan
25,Kaos Polos Katun Bambu [Cotton Bamboo] - SIZE L,Terjual 10 rb+,Rp31.900,Jakarta Barat
26,Part 2 - Kaos Polos New States Apparel 7200 Premium Cotton T-shirt,Terjual 5 rb+,Rp50.000,Jakarta Barat
27,Kaos Polos New States Apparel Premium Cotton T-shirt 7200 24s Built Up,Terjual 4 rb+,Rp50.000,Jakarta Barat
28,Kaos Polos Pria Hitam Putih Merah Navy Abu Murah Bahan PE Baju Oblong,Terjual 10 rb+,Rp13.000,Jakarta Barat
29,VM Oblong Polos Basic JUMBO BIG SIZE XXL XXXL - Kaos pendek,Terjual 1 rb+,Rp35.000,Jakarta Utara
30,"Kaos Katun 30s, Kaos Oblong Polos, Cotton Shirt",Terjual 10 rb+,Rp28.000,Jakarta Barat
31,Kaos Polos TEBAL COTTON COMBED 24 S Lengan Pendek Unisex,Terjual 3 rb+,Rp34.800,Kab. Bekasi
32,kaos polos cotton combed 30s unisex,Terjual 750+,Rp19.000,Jakarta Utara
33,"Kaos Oblong Katun 100%, Kaos Katun 30s , Kaos Polos Katun",Terjual 10 rb+,Rp28.000,Jakarta Barat
34,Kaos Polos Cotton PE Combed,Terjual 2 rb+,Rp17.999,Jakarta Barat
35,Kaos Polos cotton combed 24s,Terjual 1 rb+,Rp29.900,Kab. Bandung
36,VNECK KAOS POLOS COTTON COMBED 30S V-NECK LENGAN PENDEK KERAH V NECK,Terjual 9 rb+,Rp56.000,Jakarta Barat
37,KAOS POLOS LENGAN PENDEK KATUN BAMBU / COTTON BAMBOO TSHIRT,Terjual 10 rb+,Rp45.000,Surabaya
38,"Kaos Oblong Katun 100%, Kaos Katun 30s , Kaos Polos Katun",Terjual 10 rb+,Rp28.000,Jakarta Barat
39,KAOS POLOS BIG SIZE UNISEX LENGAN PENDEK COMBED 30S UKURAN JUMBO BESAR,Terjual 9 rb+,Rp70.000,Jakarta Barat
40,KAOS POLOS PRIA BASIC POCKET TEE PRIA T-SHIRT KANTONG KAOS SAKU COMBED,Terjual 1 rb+,Rp125.000,Tangerang
41,kaos gildan polos softstyle 63000 JAKARTA,Terjual 9 rb+,Rp44.000,Jakarta Selatan
42,Otsky Kaos Polos Lengan Pendek Tshirt Cotton Combed 24s - 5C,Terjual 250+,Rp225.000,Bandar Lampung
43,KAOS POLOS MURAH PRIA DAN WANITA / KAOS OBLONG MURAH / COD,Terjual 9 rb+,Rp19.000,Jakarta Barat
44,Turtle neck shirt kerah tinggi lengan pendek kaos polos houseofcuff,Terjual 250+,Rp180.000,Jakarta Barat
45,Kaos Polos Katun Bambu Organik (Cotton Bamboo T-Shirt Organic),Terjual 10 rb+,Rp55.500,Jakarta Utara
46,kaos polos cotton combed 30s,Terjual 6 rb+,Rp19.000,Jakarta Utara
47,Kaos Polos KPM Apparel Classic Premium Size Dewasa Part 1,Terjual 10 rb+,Rp117.500,Jakarta Barat
48,RISRUS KAOS POLOS OVERSIZE UNISEX OVERSIZED TSHIRT,Terjual 250+,Rp184.000,Jakarta Barat
49,KAOS KIMONO LENGAN PANJANG PRIA/KAOS RAGLAN PRIA/KAOS POLOS PRIA,Terjual 2 rb+,Rp21.000,Jakarta Barat
50,KAOS POLOS OVERSIZE COTTON COMBED 24S OVERSIZED TSHIRT BIG SIZE UNISEX,Terjual 7 rb+,Rp90.000,Jakarta Barat
51,kaos polos lengan panjang pria Katun Combad 30S,Terjual 2 rb+,Rp26.000,Jakarta Utara
52,"Tshirt Polos New State Apparel Premium cotton, made. in Bangladesh",Terjual 1 rb+,Rp50.000,Jakarta Selatan
53,Kaos Polos COTTON COMBED 20s Lengan Pendek UNISEX SIZE S-XXL,Terjual 10 rb+,Rp31.300,Jakarta Barat
54,Kaos Polos NSA SOFT ( New State Apparel ) persis GILDAN softstyle,Terjual 10 rb+,Rp40.000,Jakarta Selatan
55,Kaos Polos 16s Real Heavy Goods Black - Kaos Polos Hitam Katun,Terjual 2 rb+,Rp110.000,Tangerang Selatan
56,kaos polos goodfellow original,Terjual 100+,Rp79.500,Jakarta Utara
57,KAOS POLOS OBLONG KANCING HENLEY COKLAT MISTY KATUN PREMIUM PRIA TB2,Terjual 4 rb+,Rp39.900,Bandung
58,KAOS POLOS COTTON COMBED 20S - S-XXL | KATUN,Terjual 5 rb+,Rp29.000,Jakarta Barat
59,Kaos Polos KALOSTEE Premium Basic 28s 100% Cotton ( Putih / WHITE ),Terjual 4 rb+,Rp47.000,Jakarta Barat
60,Infinide T-Shirt Kaos Polos BIG OVERSIZE HITAM Cotton Combed 24s,Terjual 2 rb+,Rp59.000,Kab. Tangerang
61,Kaos Polos Warna Hitam Pria Wanita Bahan Premium Cotton Combed 20s,Terjual 3 rb+,Rp58.750,Jakarta Barat
62,KAOS POLOS COTTON COMBED 30S PREMIUM - LENGAN PENDEK,Terjual 7 rb+,Rp28.000,Jakarta Barat
63,Kaos Polos New States Apparel 7280 Premium Cotton Lengan Panjang,Terjual 5 rb+,Rp69.000,Jakarta Barat
64,New States Apparel NSA 7200 T-Shirt Premium Cotton Kaos Polos,Terjual 10 rb+,Rp47.000,Jakarta Barat
65,Garaf Kaos Polos Oversize T-Shirt Cowok Premium,Terjual 250+,Rp184.000,Jakarta Barat
66,Kaos Polos Doxa Apparel PREMIUM Seperti Gildan / NSA T-Shirt Part-1,Terjual 1 rb+,Rp43.000,Jakarta Barat
67,SIZE XS | Kaos Polos Cotton Combed 20s Lengan Pendek,Terjual 100+,Rp29.600,Jakarta Barat
68,"Kaos Polos Katun Bambu 24s, Cotton Bamboo, Original Bergaransi",Terjual 250+,Rp57.000,Jakarta Barat
69,Kaos polos COTTON MODAL 30s PREMIUM DI ATAS KATUN BAMBOO LENGAN PENDEK,Terjual 750+,Rp44.999,Bandung
70,Infinide T-Shirt Kaos Polos Big Oversize GRREN Cotton Combed 24s Prem,Terjual 500+,Rp59.000,Kab. Tangerang
71,Kaos Polos Combed 24s Original -NSA Premium Cotton 7200 -WHITE / PUTIH,Terjual 1 rb+,Rp47.000,Jakarta Pusat
72,Kaos Polos Combed 24s Original -NSA Premium Cotton 7200 - WARNA (Cool),Terjual 3 rb+,Rp50.000,Jakarta Pusat
73,Kaos Polos Import - Gildan Hammer HA00 Cotton Combed 20s Built Up S-XL,Terjual 250+,Rp89.845,Jakarta Selatan
74,Kaos Polos New States Apparel Heavy Weight Long Sleeve 5480,Terjual 2 rb+,Rp84.000,Jakarta Barat
75,Kaos Polos Premium Namako Tee Frameless - Japan Tshirt - KAOS SANTAI,Terjual 2 rb+,Rp35.500,Jakarta Utara
76,Kaos Polos COOLSOFT COTTON BAMBOO 100% Ringspun Katun Bambu Reaktif 30,Terjual 6 rb+,Rp37.900,Kab. Bekasi
77,KAOS POLOS LENGAN PANJANG PREMIUM KATUN COMBED 30S TANGAN RIB NAVY,Terjual 1 rb+,Rp38.900,Bandung
78,KAOS POLOS - KAOS OBLONG -KAOS POLOSAN COTTON 30S PUTIH,Terjual 3 rb+,Rp28.900,Bandung
79,"Kaos Polos NSA Premium Cotton 7200 Tshirt New States Apparel Original - White, M",Terjual 10 rb+,Rp47.000,Surabaya
