,Title,Total,Price,Location
0,Speaker Bluetooth Robot RB520 Bluetooth 5.0 Portable Audio Wireless,Terjual 500+,Rp400.000,Jakarta Utara
1,LENOVO SPEAKER BLUETOOTH PORTABLE STEREO MINI HIFI WIRELESS SPEAKER K3,Terjual 1 rb+,Rp129.000,Dilayani Tokopedia
2,JBL CLIP 4 PORTABLE WIRELESS SPEAKER BLUETOOTH BASS CLIP4 WATERPROOF,Terjual 1 rb+,Rp399.000,Jakarta Barat
3,Acome A5 Speaker Bluetooth 5.0 Jam Alarm LED Display Ultra Bass,Terjual 10 rb+,Rp159.000,Jakarta Utara
4,JETE S5 Pro Bluetooth Wireless Soundbar Speaker Superbass Garansi 2 Th,Terjual 500+,Rp499.900,Jakarta Pusat
5,Lenovo K3 Pro Ori Speaker Bluetooth Wireless Stereo Mini HiFi Portable,Terjual 1 rb+,Rp80.000,Jakarta Barat
6,Eggel Fit 3 Waterproof Portable Bluetooth Speaker,Terjual 9 rb+,Rp250.000,Bandung
7,SPEAKER BLUETOOTH KARAOKE 6.5 INCH FREE MIC KARAOKE FM SUPER BASS 3381,Terjual 3 rb+,Rp259.000,Tangerang
8,SPEAKER BLUETOOTH KARAOKE 6.5 INCH FREE MIC KARAOKE FM SUPER BASS 3381,Terjual 3 rb+,Rp259.000,Tangerang
9,Oontz Angle 3 Cambridge SoundWorks Bluetooth Speaker - Hitam,Terjual 6 rb+,Rp549.000,Dilayani Tokopedia
10,ACOME Speaker Bluetooth 5.0 TWS 10W IPX6 Waterproof RGB Garansi A10,Terjual 4 rb+,Rp875.000,Jakarta Utara
11,speaker bluetooth jbl J006,Terjual 10 rb+,Rp50.000,Jakarta Pusat
12,Advance H801N Speaker Bluetooth Speaker Karaoke Portabble with mic,Terjual 750+,Rp455.000,Jakarta Utara
13,ROBOT RB210 Speaker Bluetooth Support Flashdisk & MicroSD,Terjual 5 rb+,Rp150.000,Jakarta Utara
14,Speaker Advance M180BT Advan Aktif Bluetooth USB Radio,Terjual 1 rb+,Rp319.000,Jakarta Barat
15,Speaker Bluetooth Anker Soundcore Boost - A3145,Terjual 100+,Rp1.299.000,Jakarta Utara
16,Edifier R33BT bookshelf active Computer Speakers Bluetooth V5.0 10W,Terjual 24,Rp1.089.998,Jakarta Barat
17,YS-203 50+50W Voice Change Karaoke Speaker Bluetooth for Mobile Phone,Terjual 100+,Rp580.000,Jakarta Utara
18,Simbadda Portable Bluetooth Speaker CST 350N Mini Soundbar,Terjual 750+,Rp310.000,Jakarta Barat
19,Edifier R1280DBs Powered Bluetooth 5.0 Speakers - Brown/Coklat,Terjual 500+,Rp1.560.000,Jakarta Utara
20,OontZ Angle solo Super Portable Bluetooth Speaker,Terjual 7 rb+,Rp349.000,Dilayani Tokopedia
21,ROBOT RB110 Speaker Bluetooth 5.0 Mini Portable Support Micro SD & USB,Terjual 1 rb+,Rp132.000,Jakarta Barat
22,"Speaker Bluetooth Portable 6,5inch KM-3381 Plus Microphone",Terjual 3 rb+,Rp112.000,Jakarta Barat
23,Xiaomi Mi Soundbar TV Wired & Wireless Bluetooth with 8 Speaker Aktif,Terjual 1 rb+,Rp939.000,Jakarta Barat
24,Bohlam Speaker Musik Bluetooth 2 in 1 - Lampu Speaker LED,Terjual 4 rb+,Rp29.000,Jakarta Pusat
25,Eggel Terra 3 Mini 360 Waterproof Portable Bluetooth Speaker,Terjual 2 rb+,Rp449.000,Dilayani Tokopedia
26,Eggel Terra 3 Mini 360 Waterproof Portable Bluetooth Speaker,Terjual 5 rb+,Rp449.000,Bandung
27,Eggel Terra 3 Mini 360 Waterproof Portable Bluetooth Speaker,Terjual 5 rb+,Rp449.000,Bandung
28,LENOVO SPEAKER BLUETOOTH PORTABLE STEREO MINI HIFI WIRELESS SPEAKER K3,Terjual 500+,Rp109.000,Dilayani Tokopedia
29,SOUNDTECH Bluetooth Wireless Soundbar Speaker AUX Mini Audio,Terjual 2 rb+,Rp209.000,Jakarta Utara
30,Xiaomi MiFa M1 Bluetooth Portable Speaker Cube - Putih,Terjual 500+,Rp229.000,Jakarta Barat
31,Marshall Emberton Speaker Bluetooth Portable Stereo Waterproof,Terjual 27,Rp788.000,Jakarta Barat
32,Zealot S32 TWS Bluetooth Portable Speaker Outdoor WATERPROOF 3D Hi-Fi,Terjual 1 rb+,Rp168.000,Jakarta Utara
33,Eggel Terra 3 Mini 360 Waterproof Portable Bluetooth Speaker,Terjual 5 rb+,Rp449.000,Bandung
34,Bohlam Speaker Musik Bluetooth 2 in 1 - Lampu Speaker LED,Terjual 6 rb+,Rp23.500,Kab. Tangerang
35,PINZY Portable Wireless Speaker T5 | Speaker Bluetooth mini,Terjual 10 rb+,Rp90.000,Jakarta Barat
36,"Robot RB520 Speaker Bluetooth 5.0 Speaker Portable USB,MicroSD,AUX",Terjual 250+,Rp252.000,Jakarta Pusat
37,Speaker Bluetooth Portable TABLEPRO G2,Terjual 2 rb+,Rp40.000,Jakarta Barat
38,Eggel Elite XL 2 Waterproof Portable Bluetooth Speaker with RGB Light,Terjual 500+,Rp1.000.000,Bandung
39,Speaker Bluetooth 9inch SQRS 885 Bonus 2 microphone,Terjual 50+,Rp149.000,Jakarta Pusat
40,Speaker Bluetooth 9inch SQRS 885 Bonus 2 microphone,Terjual 50+,Rp149.000,Jakarta Pusat
41,Robot RB20 TWS Bluetooth Speaker 5.1 Mini Portable With RGB Colorful,Terjual 1 rb+,Rp71.000,Dilayani Tokopedia
42,ANKER PowerConf Bluetooth Speaker with Mic Meeting Conference A3301,Terjual 100+,Rp1.488.000,Jakarta Pusat
43,ANKER PowerConf Bluetooth Speaker with Mic Meeting Conference A3301,Terjual 100+,Rp1.488.000,Jakarta Pusat
44,ANKER PowerConf Bluetooth Speaker with Mic Meeting Conference A3301,Terjual 100+,Rp1.488.000,Jakarta Pusat
45,ANKER PowerConf Bluetooth Speaker with Mic Meeting Conference A3301,Terjual 100+,Rp1.488.000,Jakarta Pusat
46,ANKER PowerConf Bluetooth Speaker with Mic Meeting Conference A3301,Terjual 100+,Rp1.488.000,Jakarta Pusat
47,ANKER PowerConf Bluetooth Speaker with Mic Meeting Conference A3301,Terjual 100+,Rp1.488.000,Jakarta Pusat
48,Eggel Terra 3 Plus + Waterproof Bluetooth Speaker with RGB Lights,Terjual 2 rb+,Rp750.000,Bandung
49,Speaker Bluetooth Mini model laca retak,Terjual 9 rb+,Rp18.900,Jakarta Utara
50,Eggel Active 2 Waterproof Portable Bluetooth Speaker,Terjual 1 rb+,Rp350.000,Dilayani Tokopedia
51,Nubwo Gaming Speaker Bluetooth System 2.1 CRANEO NS-38 Super Bass,Terjual 30+,Rp199.000,Jakarta Timur
52,Speaker Bluetooth Portable Mitsuyama MS - 4020 - 4078 Radio / USB,Terjual 750+,Rp115.000,Jakarta Pusat
53,Edifier R1700BT Bluetooth Bookshelf Speakers 2.0 - 66W rms,Terjual 1 rb+,Rp1.282.500,Jakarta Barat
54,Edifier R1700BT Bluetooth Bookshelf Speakers 2.0 - 66W rms,Terjual 1 rb+,Rp1.282.500,Jakarta Barat
55,Eggel Active 2 Waterproof Action Portable Bluetooth Speaker,Terjual 1 rb+,Rp350.000,Dilayani Tokopedia
56,Speaker Bluetooth GMC 881B SUPER BASS support usb radio bluetooth aux,Terjual 23,Rp210.000,Jakarta Pusat
57,Edifier R1700BT Wireless Bluetooth Speaker Multimedia 2.0 Wooden Audio,Terjual 1 rb+,Rp1.599.999,Jakarta Barat
58,Eggel Terra 3 Plus 3EQ / Terra 3+ 3EQ Waterproof Bluetooth Speaker RGB,Terjual 100+,Rp679.000,Dilayani Tokopedia
59,Speaker Portable Wireless DAT DT1210 FT Original Bluetooth 12 inch BA,Terjual 100+,Rp825.000,Jakarta Barat
60,Harman Kardon Onyx Studio 7 Speaker Bluetooth Stereo Portable,Terjual 250+,Rp3.059.000,Dilayani Tokopedia
61,Speaker TV Soundbar Mi Wired Wireless Bluetooth HiFi,Terjual 250+,Rp999.000,Jakarta Utara
62,Bose SoundLink Mini II SE Portable Wireless Bluetooth Speaker - Black,Terjual 1 rb+,Rp3.299.000,Jakarta Utara
63,Eggel Elite XL 2 Waterproof Portable Bluetooth Speaker with RGB Light,Terjual 100+,Rp1.000.000,Dilayani Tokopedia
64,Oontz Angle 3 Cambridge SoundWorks Bluetooth Speaker - Black,Terjual 1 rb+,Rp359.000,Jakarta Utara
65,Robot RB150 LED Alarm Clock With FM Radio Speaker Bluetooth,Terjual 1 rb+,Rp149.000,Jakarta Barat
66,Robot RB150 LED Alarm Clock With FM Radio Speaker Bluetooth,Terjual 1 rb+,Rp149.000,Jakarta Barat
67,VIVAN VS2 Fabric Bluetooth Speaker IPX6 Waterproof,Terjual 100+,Rp223.000,Jakarta Barat
68,Harman Kardon Onyx Studio 7 Speaker Bluetooth Stereo Portable Onyx7,Terjual 100+,Rp4.499.000,Jakarta Barat
69,LENOVO SPEAKER BLUETOOTH PORTABLE STEREO MINI HIFI WIRELESS SPEAKER K3,Terjual 1 rb+,Rp129.000,Dilayani Tokopedia
70,Speaker Portable SOUNDBEST FT 15 FT15 Original 15inch Bluetooth USB,Terjual 60+,Rp1.400.000,Jakarta Barat
71,ACOME Super Bass Speaker Bluetooth 5.0 20W IPX7 RGB Rave Party A20,Terjual 2 rb+,Rp799.000,Jakarta Utara
72,JBL Flip 6 Bluetooth Speaker Flip6 Portable Waterproof Resmi PT IMS,Terjual 250+,Rp1.499.000,Jakarta Utara
73,Speaker Advance Aktif Portable M10BT Bluetooth Subwoofer BASS -T403,Terjual 1 rb+,Rp279.000,Jakarta Barat
74,Eggel Terra 3 Plus + Waterproof Bluetooth Speaker with RGB Lights,Terjual 1 rb+,Rp750.000,Dilayani Tokopedia
75,Eggel Fit 3 Waterproof Portable Bluetooth Speaker,Terjual 9 rb+,Rp250.000,Bandung
76,Advance M15BT Speaker Stereo Bluetooth Xtra Bass Subwoofer Free Mic,Terjual 70+,Rp875.000,Jakarta Timur
77,JBL Clip 3 Portable Bluetooth Speaker,Terjual 1 rb+,Rp1.199.000,Jakarta Utara
78,GMC SPEAKER BLUETOOTH 887G KARAOKE,Terjual 30+,Rp695.000,Jakarta Barat
79,Venom Baby Gear VBG 1 Speaker Bluetooth Portable with Stereo Mode,Terjual 500+,Rp610.000,Jakarta Utara
