,Title,Total,Price,Location
0,HYDRA+ Semua Tipe Anti Gores Hydrogel - Tempered Glass Full,Terjual 10 rb+,Rp118.000,Jakarta Barat
1,Uneed Hybrid Pro Anti Break Screen Protector Handphone Full Cover,Terjual 10 rb+,Rp199.000,Jakarta Pusat
2,HYDRA+ Extra Back Cover Semua Tipe Anti Gores Hydrogel -Tempered Glass,Terjual 2 rb+,Rp80.000,Jakarta Barat
3,Tempered Glass Nintendo Switch Oled 7 Spigen Glas tR EZ Fit Anti Gores,Terjual 250+,Rp235.000,Jakarta Barat
4,Tempered Glass Screen Protector Nintendo Switch,Terjual 4 rb+,Rp7.990,Jakarta Barat
5,Anti Gores Switch Nintendo Tempered Glass Premium,Terjual 2 rb+,Rp49.000,Jakarta Pusat
6,Tempered Glass Nintendo Switch Screen Protector Anti Gores Switch,Terjual 250+,Rp45.000,Jakarta Pusat
7,Tempered Glass Nintendo Switch Lite Anti Gores Screen Protector Switch,Terjual 1 rb+,Rp45.000,Jakarta Pusat
8,Nintendo Switch Oled Model Screen Protector Tempered Tempred Glass,Terjual 750+,Rp40.000,Jakarta Utara
9,Nintendo Switch Lite Dobe Screen Tempered Glass 9H Hardness,Terjual 500+,Rp49.000,Jakarta Utara
10,Tempered Glass Nintendo Switch Lite Screen Protector Anti Gores Switch,Terjual 100+,Rp35.000,Jakarta Pusat
11,Tempered Glass Nintendo Switch Lite Screen Protector Anti Gores Switch,Terjual 100+,Rp35.000,Jakarta Pusat
12,Anti Gores Tempered Glass Kaca Nintendo Switch OLED Temper,Terjual 500+,Rp49.000,Jakarta Pusat
13,TEMPERED GLASS NINTENDO SWITCH LITE SCREEN GUARD PROTECTOR,Terjual 250+,Rp12.500,Tangerang Selatan
14,Nintendo Switch Lite Screen Tempered Glass 9H Hardness Anti Bubble,Terjual 60+,Rp39.000,Jakarta Utara
15,"PREMIUM TEMPERED GLASS / ANTI GORES FOR NINTENDO SWITCH - SWITCH V1, V2",Terjual 750+,Rp17.500,Jakarta Utara
16,Tempered Glass Nintendo Switch Oled 7 Spigen Glas tR EZ Fit Original - Clear,The_Beatles.Acc,Rp435.000,Diskon 50 rb
17,TEMPERED GLASS FILM / ANTI GORES 9H NINTENDO SWITCH OLED,Terjual 100+,Rp29.000,Jakarta Utara
18,Iphone X / XS - COPPER Tempered Glass Full Glue PREMIUM Glossy,Terjual 100+,Rp100.000,Surabaya
19,XIAOMI 12T / MI 12T PRO TEMPERED GLASS FULL COVER ANTI GORES KACA,Terjual 23,Rp15.000,Jakarta Pusat
20,Nintendo Switch Oled Nyko Thin Case + Tempered Glass,Terjual 250+,Rp155.000,Jakarta Utara
21,17 in 1 Nintendo Switch OLED Pouch Tempered Glass Crystal Case Switch,Terjual 30+,Rp299.000,Jakarta Pusat
22,Nintendo Switch HORI CN Clear Tempered Glass 9H Fit to Screen,Terjual 100+,Rp149.000,Jakarta Utara
23,Nintendo Switch OLED Console Mesin Neon Red Blue + Tempered Glass,Terjual 60+,Rp4.450.000,Jakarta Pusat
24,Premium Tempered Glass SCREEN Protector Nintendo Switch NS 9H,Terjual 2 rb+,Rp11.500,Tangerang Selatan
25,Tempered Glass Nintendo Switch OLED Screen Protector Switch OLED,Terjual 250+,Rp45.000,Jakarta Pusat
26,Tempered Glass Nintendo Switch Lite / Screen Protector N Switch Li,Terjual 750+,Rp45.000,Jakarta Selatan
27,Tempered Glass Nintendo Switch OLED,Terjual 100+,Rp125.000,Jakarta Utara
28,Gulikit NS11 2pc Tempered Glass Screen Protector Nintendo Switch V1/V2,Terjual 40+,Rp65.000,Jakarta Barat
29,Tempered Glass Screen Protector Nintendo Switch V1 V2 No box,Terjual 80+,Rp30.000,Jakarta Utara
30,V7+ TEMPERED GLASS CERAMIC FILM FULL COVER VIVO V7+,Terjual 3,Rp3.000,Tangerang
31,Tempered Glass SAMSUNG Galaxy A51 Full Cover Black -Premium Glass Pro,Terjual 500+,Rp90.000,Jakarta Barat
32,Tempered Glass Pelindung Layar Screen Guard Protector Nintendo Switch,Terjual 70+,Rp10.000,Surakarta
33,REDMI 12C SOFT CASE AIORIA WOOD CROSS PATTERN - BLACK,Terjual 3,Rp55.000,Jakarta Pusat
34,nintendo switch travel storage eva case,Terjual 80+,Rp599.000,Jakarta Utara
35,nintendo switch travel storage eva case,Terjual 80+,Rp599.000,Jakarta Utara
36,Nintendo Switch Glass Screen PRO Premium Tempered 9H,Terjual 3 rb+,Rp50.000,Jakarta Utara
37,Nintendo Switch OLED Premium Tempered Glass Temper Guard HORI CN,Terjual 30+,Rp44.000,Jakarta Utara
38,Tempered Glass MATTE Nintendo Switch / Antigores Nintendo Switch Glare,Terjual 100+,Rp65.000,Jakarta Barat
39,Tempered Glass Screen Protector Nintendo Switch,Terjual 500+,Rp40.000,Bekasi
40,TEMPERED NINTENDO SWITCH OLED / TEMPERED GLASS SWITCH OLED KJH-NS-062,Terjual 250+,Rp49.000,Jakarta Selatan
41,PREMIUM TEMPERED GLASS / ANTI GORES FOR NINTENDO SWITCH,Terjual 750+,Rp17.500,Jakarta Utara
42,DOBE Nintendo Switch OLED Premium Tempered Glass Temper Guard TNS-1156,Terjual 100+,Rp59.000,Jakarta Utara
43,Gulikit NS12 2pc Tempered Glass Screen Protector Nintendo Switch LITE,Terjual 30+,Rp66.000,Jakarta Barat
44,Nintendo switch Anti Gores Kaca Tempered Glass Nintendo Switch OLED,Terjual 4,Rp45.000,Jakarta Utara
45,AKITOMO Tempered Glass Nintendo Switch Monster Hunter Rise 9H,Terjual 6,Rp149.000,Jakarta Utara
46,PREMIUM Tempered Glass Nintendo Switch - Anti Gores Premium Pro 9H,Terjual 100+,Rp39.000,Jakarta Utara
47,Tempered Glass Nintendo Switch Lite / Screen Protector Lite / TEMPER,Terjual 250+,Rp45.000,Jakarta Selatan
48,Nyko Dockable Thin Case + Temper Glass Nintendo Switch (Smoke Grey),Terjual 100+,Rp149.000,Jakarta Utara
49,Premium Tempered Glass Nintendo Switch V1 V2 Screen Guard Anti Gores,Terjual 26,Rp28.500,Jakarta Timur
50,AKITOMO Tempered Glass Nintendo Switch Animal Crossing Frame 9H,Terjual 9,Rp175.000,Jakarta Utara
51,NINTENDO SWITCH LITE TEMPERED GLASS,Terjual 40+,Rp25.000,Bandung
52,Tempered Glass Switch Lite Nintendo Switch Lite,Terjual 250+,Rp8.000,Bekasi
53,Gulikit NS11 2pc Tempered Glass Screen Protector Nintendo Switch V1/V2,Terjual 8,Rp65.000,Jakarta Barat
54,Tempered Glass / Temper Glass / Screen Protector Nintendo Switch Lite,Terjual 500+,Rp20.000,Surabaya
55,Tempered Glass / Temper Glass / Screen Protector Nintendo Switch Lite,Terjual 500+,Rp20.000,Surabaya
56,DOBE TEMPERED GLASS SCREEN PROTECTOR NINTENDO SWITCH,Terjual 30+,Rp39.000,Bandung
57,Tempered Glass Nintendo Switch / Lite Spigen tR SLIM Screen Protector,Terjual 500+,Rp125.000,Jakarta Barat
58,Nintendo Switch Lite GATZ Tempered Glass Protector Premium Quality,Terjual 8,Rp90.000,Jakarta Selatan
59,Nintendo Switch OLED Dobe Tempered Glass Film,Terjual 70+,Rp25.000,Bandung
60,DOBE Screen Protector Tempered Glass Nintendo SWITCH OLED,Terjual 50+,Rp59.000,Jakarta Utara
61,Tempered Glass 9H Nintendo Switch OLED,Terjual 30+,Rp50.000,Jakarta Utara
62,NINTENDO SWITCH ANIMAL CROSSING EDITION/FREE TEMPERED GLASS,Terjual 100+,Rp3.865.000,Depok
63,Nintendo Switch Oled Tempered Glass,Terjual 80+,Rp50.000,Jakarta Utara
64,Nyko Screen Armor Premium Tempered Glass 9H for Nintendo Switch OLED,Terjual 100+,Rp159.000,Surabaya
65,Nintendo Switch Tempered Glass Protector Lite,Terjual 6,Rp80.000,Jakarta Pusat
66,TEMPERED GLASS PREMIUM PRO HIGH HARDNESS FOR NINTENDO SWITCH LITE,Terjual 7,Rp30.000,Jakarta Barat
67,Tempered Glass Anti gores Screen Protector Nintendo Switch,Terjual 12,Rp15.500,Jakarta Barat
68,Nintendo Switch OLED Hard Clear Tempered Glass 0.18mm ORI GameTech,Terjual 21,Rp99.000,Jakarta Utara
69,Dobe Tempered Glass Temper Glass Film Nintendo Switch OLED w Bracket,Terjual 16,Rp65.000,Jakarta Utara
70,NINTENDO SWITCH TEMPERED GLASS PREMIUM PRO HIGH HARDNESS,Terjual 500+,Rp31.000,Jakarta Barat
71,Tempered Glass SWITCH OLED SCREEN Protector Nintendo SCREEN PROTECTOR,Terjual 40+,Rp15.000,Tangerang Selatan
72,Nintendo Switch / NS / N Switch Tempered Glass 9H Protector HORI,Terjual 80+,Rp252.500,Jakarta Utara
73,Nintendo Switch Lite Tempered Glass Screen Protector,Terjual 70+,Rp40.000,Bandung
74,Nintendo Switch LITE Tempered Glass,Terjual 60+,Rp49.000,Jakarta Utara
75,HYDROGEL ANTIGORES LUFFY PRO / ANTIGORES HYDROGEL LUFFY PRO ANTI GLARE,Terjual 500+,Rp75.900,Tangerang
76,Tempered Glass Nintendo Switch Oled 7 Spigen Glas tR EZ Fit Anti Gores,Terjual 5,Rp235.000,Medan
77,REDMI 12C TEMPERED GLASS FULL COVER TEMPERED FULL,Terjual 15,Rp15.000,Jakarta Pusat
78,Samsung A50 - COPPER TEMPERED GLASS FULL CLEAR,Terjual 80+,Rp100.000,Surabaya
79,Tempered Glass Nintendo Switch Lite Anti Gores Screen Protector - Switch LITE,Terjual 250+,Rp12.500,Jakarta Utara
