,Title,Total,Price,Location
0,Soul Ultra Wireless 2 Wireless Over-Ear Headphones,Terjual 80+,Rp1.600.000,Jakarta Barat
1,[NEW RELEASE] JBL Tune 510BT Wireless On-Ear Headphone Purebass Sound,Terjual 3,Rp1.500.000,Jakarta Utara
2,Nokia Wireless Headphone Bluetooth 5.0 with Mic E1200 PLUS ANC - Beige,Terjual 25,Rp2.350.000,Jakarta Barat
3,ThePods Max Lite 2022 Wireless Bluetooth Headphones,Terjual 19,Rp479.000,Jakarta Utara
4,Nakamichi OW1300ANC Active Noise Cancelling Wireless Headphone ANC HD,Terjual 70+,Rp1.300.000,Jakarta Barat
5,Nakamichi OW1300ANC Active Noise Cancelling Wireless Headphone ANC HD,Terjual 70+,Rp1.300.000,Jakarta Barat
6,Baseus Encok D02 Pro Headphone Bluetooth Wireless Noise Reduction,Terjual 250+,Rp269.000,Jakarta Utara
7,JBL Tune 510BT / T510BT Wireless On-Ear Headphones,Terjual 2 rb+,Rp629.000,Jakarta Utara
8,Nakamichi OW1100ANC Active Noise Cancelling Wireless Headphone - Black,Terjual 100+,Rp950.000,Jakarta Barat
9,KIIP WIRELESS TH30 HEADPHONE BLUETOOTH HEADSET EARPHONE,Terjual 1 rb+,Rp559.000,Tangerang
10,KIIP WIRELESS TH30 HEADPHONE BLUETOOTH HEADSET EARPHONE,Terjual 1 rb+,Rp559.000,Tangerang
11,Sony WH CH520 Wireless Headphones / WH-CH520 / WHCH520 / Sony WH-CH520,Terjual 100+,Rp829.000,Jakarta Selatan
12,Headphone Bluetooth Kucing LED Wireless Light Kuping Rechargeable,Terjual 1 rb+,Rp100.000,Jakarta Pusat
13,Baseus Bowie H1 Headphone ANC Noise Cancelling Bluetooth Wireless,Terjual 80+,Rp604.000,Jakarta Utara
14,Lenovo TH10 Headphone Bluetooth Wireless Headset Earphone V5.0 - Putih,Terjual 250+,Rp189.000,Jakarta Pusat
15,SENNHEISER HD 250 BT Wireless Headphone,Terjual 500+,Rp1.499.000,Jakarta Barat
16,KIIP WIRELESS TH30 HEADPHONE BLUETOOTH HEADSET EARPHONE - Hitam,Terjual 1 rb+,Rp559.000,Tangerang
17,Nakamichi OW1100ANC Active Noise Cancelling Wireless Headphone ANC,Terjual 100+,Rp950.000,Jakarta Barat
18,Sony WH-1000XM4 Wireless Headphone WH1000XM4 WH 1000XM4 WH1000 XM4,Terjual 2 rb+,Rp4.999.000,Jakarta Barat
19,Philips TAH4205 Blue On-ear Wireless Headphones / TAH 4205,Terjual 80+,Rp999.000,Jakarta Pusat
20,Headphone Headset Bando Bluetooth Wireless Stereo P47 EDR P-47,Terjual 500+,Rp40.000,Jakarta Pusat
21,1MORE PistonBuds True Wireless In-Ear Headphones+Silicon CoverProtecto,Terjual 2 rb+,Rp300.000,Tangerang Selatan
22,Headphone Zealot N85 FM Radio TF Micro SD Slot & Mic Wireless Recharge,Terjual 250+,Rp58.888,Depok
23,Edifier W240TN True Wireless Noise Cancellation In-Ear Headphones,Terjual 500+,Rp1.999.000,Dilayani Tokopedia
24,SONY WH-1000XM5 Black Wireless Noise Cancelling Headphone / WH1000XM5,Terjual 250+,Rp5.999.000,Jakarta Pusat
25,MINISO Headset Bluetooth Headphone Wireless Henset Bloetooth TeksturCD,Terjual 100+,Rp499.900,Dilayani Tokopedia
26,Baseus D02 Pro Foldable Headphone Bluetooth Wireless/Wired V5.0,Terjual 500+,Rp289.000,Jakarta Barat
27,Sony WH-1000XM5 Wireless Headphone Auto Noise Cancellation Headset,Terjual 40+,Rp4.585.000,Jakarta Pusat
28,P47 Headphone Wireless Bluetooth Stereo 5.0+EDR,Terjual 6 rb+,Rp31.000,Jakarta Pusat
29,1MORE PistonBuds True Wireless In-Ear Headphones,Terjual 8 rb+,Rp279.000,Tangerang Selatan
30,Sony WH CH520 Wireless Headphones / WH-CH520 / WHCH520 / Sony WH-CH520,Terjual 100+,Rp829.000,Jakarta Selatan
31,Baseus D05 Bowie Wireless Headphone Bluetooth Wired Bass Headphones,Terjual 30+,Rp399.000,Jakarta Utara
32,Sony WH-CH520 WHCH520 CH 520 Wireless Bluetooth On Ear Headphones,Terjual 10,Rp829.000,Dilayani Tokopedia
33,Sony WH-CH720N WHCH720N CH720 Wireless Noise Cancelling Headphone,Terjual 19,Rp1.989.000,Jakarta Utara
34,Jabra Elite 45h On Ear Wireless Headphones - Titanium Black,Terjual 500+,Rp1.490.000,Dilayani Tokopedia
35,Jabra Elite 45h On Ear Wireless Headphones - Titanium Black,Terjual 500+,Rp1.490.000,Dilayani Tokopedia
36,HEADPHONE MACARON WIRELESS Y08 / HEADPHONE BLUETOOTH MACARON Y08,Terjual 11,Rp44.500,Jakarta Barat
37,HEADPHONE MACARON WIRELESS Y08 / HEADPHONE BLUETOOTH MACARON Y08,Terjual 11,Rp44.500,Jakarta Barat
38,Nokia Wireless Bluetooth 5.0 Headphone / Headset with Mic E1200- Black,Terjual 1 rb+,Rp1.850.000,Jakarta Barat
39,SONY WH-CH510 Wireless Headphones WH CH510 CH 510 WHCH510,Terjual 750+,Rp699.000,Jakarta Barat
40,Lenovo TH10 Headphone Bluetooth Wireless Headset Earphone 5.0,Terjual 500+,Rp229.000,Dilayani Tokopedia
41,Lenovo TH10 Headphone Bluetooth Wireless Headset Earphone 5.0,Terjual 500+,Rp229.000,Dilayani Tokopedia
42,Lenovo TH10 Headphone Bluetooth Wireless Headset Earphone 5.0,Terjual 500+,Rp229.000,Dilayani Tokopedia
43,HEADPHONE BANDO JBL T450BT WIRELESS STEREO BLUETOOTH,Terjual 100+,Rp112.500,Kab. Tangerang
44,Headphone Bluetooth Pure Extra Bass Headset Wireless P47 PRO,Terjual 500+,Rp129.000,Tangerang
45,Sony WH-XB910N Wireless Noise Canceling EXTRA BASS™ Headphones,Terjual 30+,Rp2.499.000,Jakarta Pusat
46,Sony WH-XB910N Wireless Noise Canceling EXTRA BASS™ Headphones,Terjual 30+,Rp2.499.000,Jakarta Pusat
47,Sony WH-XB910N Wireless Noise Canceling EXTRA BASS™ Headphones,Terjual 30+,Rp2.499.000,Jakarta Pusat
48,P47 Headphone Wireless Portable Bluetooth Headset Bass Handsfree Earph,Terjual 10 rb+,Rp28.000,Jakarta Utara
49,MINISO Headphone Bluetooth Headset Wireless Gaming Coloful Light Mic,Terjual 250+,Rp379.900,Dilayani Tokopedia
50,BASEUS D02 PRO FOLDABLE HEADPHONE BLUETOOTH WIRELESS / WIRED V5.0,Terjual 500+,Rp299.999,Dilayani Tokopedia
51,Fantech たまこ TAMAGO Wireless Bluetooth Headset Headphone,Terjual 100+,Rp799.000,Jakarta Barat
52,DBE HBT80 Bluetooth Headphone Wireless Headset HBT 80,Terjual 250+,Rp239.000,Bandung
53,DBE HBT80 Bluetooth Headphone Wireless Headset HBT 80,Terjual 250+,Rp239.000,Bandung
54,Lenovo TH10 Headphone Bluetooth Wireless Headset Earphone V5.0 - Pink,Terjual 100+,Rp189.000,Jakarta Pusat
55,P47 Headphone Wireless Portable Bluetooth Headset Bass Handsfree Earph,Terjual 4 rb+,Rp28.000,Jakarta Utara
56,Nakamichi OW1300ANC Active Noise Cancelling Wireless Headphone ANC HD,Terjual 70+,Rp1.300.000,Jakarta Barat
57,Bowers & Wilkins B&W PX7 S2 Wireless Over-Ear Headphones,Terjual 17,Rp7.000.000,Jakarta Barat
58,Bowers & Wilkins B&W PX8 Wireless Over Noise Canceling Headphone,Terjual 10,Rp10.700.000,Jakarta Barat
59,JBL Tune 510 BT 510BT Wireless On-Ear Headphones Headset Tune510BT,Terjual 250+,Rp999.000,Jakarta Barat
60,Nokia Wireless Bluetooth 5.0 Headphone / Headset with Mic E1200,Terjual 100+,Rp450.000,Jakarta Utara
61,SONY WH 1000XM4 / WH1000XM4 Premium Wireless Noise-Canceling Headphone,Terjual 100+,Rp3.899.000,Jakarta Pusat
62,Nakamichi NHP X1 Headphone Headset Wireless Bluetooth HD HIFI FM Mic,Terjual 1 rb+,Rp599.000,Jakarta Barat
63,Lenovo TH30 Headphone Bluetooth Wireless Headset Earphone V5.3-Pink,Terjual 19,Rp199.000,Jakarta Pusat
64,SONY WH-1000XM4 Wireless Noise Cancelling Headphones Black Original,Terjual 28,Rp3.699.000,Jakarta Pusat
65,SONY WH-1000XM4 Wireless Noise Cancelling Headphones Black Original,Terjual 28,Rp3.699.000,Jakarta Pusat
66,Baseus Encok Wireless headphone D02 Pro - NGTD0103,Terjual 100+,Rp366.000,Jakarta Utara
67,Baseus Encok Wireless headphone D02 Pro - NGTD0103,Terjual 100+,Rp366.000,Jakarta Utara
68,Baseus Encok Wireless headphone D02 Pro - NGTD0103,Terjual 100+,Rp366.000,Jakarta Utara
69,Baseus Encok Wireless headphone D02 Pro - NGTD0103,Terjual 100+,Rp366.000,Jakarta Utara
70,AITU Lenovo TH10 Headphone Bluetooth Wireless Headset Earphone 5.0,Terjual 40+,Rp159.000,Jakarta Barat
71,HEADPHONE BLUETOOTH JBL P951 WIRELESS & WIRED,Terjual 100+,Rp118.898,Jakarta Utara
72,Nakamichi NHP-X2 Headphone Headset Wireless Bluetooth HD HIFI FM Mic,Terjual 500+,Rp699.000,Jakarta Barat
73,Nakamichi NHP-X2 Headphone Headset Wireless Bluetooth HD HIFI FM Mic,Terjual 500+,Rp699.000,Jakarta Barat
74,Jabra Elite 45h On Ear Wireless Headphones - Titanium Black,Terjual 500+,Rp1.490.000,Dilayani Tokopedia
75,Marshall Major III Bluetooth APTX Major 3 Wireless On Ear Headphones B,Terjual 100+,Rp796.000,Jakarta Barat
76,Sennheiser Momentum 4 Wireless Noise-canceling Wireless Headphones,Terjual 9,Rp5.499.000,Jakarta Utara
77,SONY WH 1000XM4 / WH1000XM4 / Wireless Noise Canceling Headphones,Terjual 750+,Rp5.049.000,Jakarta Selatan
78,Sony WH-1000XM5 / WH1000XM5 / WH 1000XM5 Headphone Wireless NC - Black,Terjual 100+,Rp4.899.000,Jakarta Utara
79,USAMS YN001 WIRELESS NOISE CANCELLING/HEADPHONE BT,Terjual 1 rb+,Rp495.000,Tangerang
