,Title,Total,Price,Location
0,BEIENS TABLET LCD WRITING PAD PAPAN TULIS GAMBAR BOARD DRAWING TAB,Terjual 2 rb+,Rp219.000,Tangerang
1,"12"" Drawing Tablet Writing Tablet Papan Tulis Board warna-warni",Terjual 1 rb+,Rp300.000,Jakarta Utara
2,LCD Writing Tablet 8.5inch Drawing Pad Mainan Papan Tulis anak,Terjual 1 rb+,Rp1.500,Jakarta Utara
3,LCD Writing Tablet Papan Tulis Untuk Anak Dewasa / Writing Pad,Terjual 250+,Rp58.888,Jakarta Utara
4,Papan Tulis Gambar LCD Drawing Writing Tablet Pad Anak Dewasa 8.5 Inch - Hitam Mono,Terjual 250+,Rp45.000,Jakarta Barat
5,Writing tablet / LCD writing pad / Drawing pad / papan tulis LCD 8.5,Terjual 10 rb+,Rp28.800,Jakarta Utara
6,"LCD DRAWING WRITING TABLET 8.5""/PAPAN TULIS GAMBAR ANAK DAN DEWASA",Terjual 9 rb+,Rp16.000,Jakarta Utara
7,"LCD DRAWING WRITING TABLET 8.5""/PAPAN TULIS GAMBAR ANAK DAN DEWASA",Terjual 9 rb+,Rp16.000,Jakarta Utara
8,"LCD Drawing Writing Tablet 8,5'' - Papan Tulis Gambar Anak 8,5inch",Terjual 2 rb+,Rp37.000,Jakarta Barat
9,BEIENS TABLET LCD WRITING PAD PAPAN TULIS GAMBAR BOARD DRAWING TAB,Terjual 2 rb+,Rp219.000,Tangerang
10,LCD Drawing Writing Tablet Mainan Papan Tulis Hapus Board Digital Pad,Terjual 250+,Rp11.999,Jakarta Barat
11,"AVEN Papan Tulis Tablet Digital Anak Tab LCD Drawing Writing 8.5""",Terjual 1 rb+,Rp12.485,Jakarta Selatan
12,LCD Writing Tablet Papan Tulis Untuk Anak Dewasa/Writing Pad 12 inch,Terjual 1 rb+,Rp114.999,Jakarta Barat
13,LCD Writing Tablet Papan Tulis Untuk Anak Dewasa/Writing Pad 12 inch,Terjual 1 rb+,Rp114.999,Jakarta Barat
14,LCD Drawing Writing Tablet 8.5 inch Mainan Anak Model Papan Tulis,Terjual 1 rb+,Rp15.600,Surabaya
15,Writing Tablet LCD 16 inch Warna Drawing Tablet Papan Tulis Anak,Terjual 100+,Rp800.000,Jakarta Utara
16,LCD Writing Tablet Papan Tulis Untuk Anak Dewasa/Writing Pad 12 inch,Terjual 1 rb+,Rp114.999,Jakarta Barat
17,"LCD Drawing Writing Tablet Anak dan Dewasa 8.5"" | Papan Tulis Gambar",Terjual 250+,Rp22.000,Jakarta Barat
18,"LCD Drawing Writing Tablet Anak dan Dewasa 8.5"" | Papan Tulis Gambar - Hijau",Terjual 10 rb+,Rp11.990,Jakarta Selatan
19,Miijia lcd blackboard writing drawing tablet papan tulis 13inch,Terjual 13,Rp233.000,Jakarta Timur
20,LCD Writing Board Drawing Tablet Papan Tulis Anak Karakter 6.5 inch,Terjual 2 rb+,Rp349.000,Tangerang
21,LCD Writing Tablet Papan Tulis Untuk Anak Dewasa / Writing Pad,Terjual 250+,Rp58.888,Jakarta Utara
22,Mainan Tab LCD Writing Drawing Tablet Papan Tulis Gambar LCD 202-9,Terjual 3 rb+,Rp18.888,Depok
23,"LCD Drawing Writing Tablet Anak dan Dewasa 8.5"" | Papan Tulis Gambar",Terjual 250+,Rp22.000,Jakarta Barat
24,LCD Writing Tablet 8.5in Drawing Pad Mainan Papan Tulis anak,Terjual 10 rb+,Rp15.500,Jakarta Barat
25,"LCD Drawing Writing Tablet Anak dan Dewasa 8.5"" | Papan Tulis Gambar",Terjual 10 rb+,Rp11.990,Jakarta Selatan
26,"LCD Drawing Writing Tablet 8.5"" Mainan Papan Tulis ipad Anak",Terjual 2 rb+,Rp17.950,Bandung
27,Papan Tulis Anak Tablet Belajar Menulis Menggambar LCD Writing 8.5 Inc,Terjual 3 rb+,Rp46.000,Jakarta Pusat
28,Writing Tablet LCD 16 inch Warna Drawing Tablet Papan Tulis Anak,Terjual 100+,Rp800.000,Jakarta Utara
29,MIISOO LCD Writing Tablet Papan Gambar Anak Elektronik 8.5 Inci Tablet,Terjual 250+,Rp50.000,Kab. Tangerang
30,Xiaomi Mijia LCD Blackboard Writing Digital Drawing Tablet with Pen,Terjual 250+,Rp235.000,Jakarta Selatan
31,LCD Writing Tablet 8.5in Drawing Pad Mainan Papan Tulis anak - Random,Terjual 10 rb+,Rp15.500,Jakarta Barat
32,LCD WRITING TABLET 8.5 INCH. TABLET PAPAN TULIS - Hitam,Terjual 24,Rp19.999,Medan
33,LCD Writing Tablet Drawing 12 Inch - Papan tulis LCD anak Papan tulis,Terjual 1 rb+,Rp47.500,Tangerang
34,MIISOO LCD Writing Tablet Papan Gambar Anak Elektronik 8.5 Inci Tablet,Terjual 250+,Rp50.000,Kab. Tangerang
35,LCD Writing Board Drawing Tablet Papan Tulis Anak 8.8 inch,Terjual 2 rb+,Rp99.000,Tangerang
36,LCD Writing tablet board 8.5in drawing pad mainan papan tulis anak,Terjual 250+,Rp22.000,Bandung
37,OLIKE LCD DRAWING BOARD PAD WRITING TABLET 8.5 10.5 INCH PAPAN DIGITAL,Terjual 3 rb+,Rp99.000,Kab. Tangerang
38,LCD Writing Tablet Drawing 12 Inch - Papan tulis LCD anak Papan tulis,Terjual 1 rb+,Rp47.500,Tangerang
39,LCD 16 Inch Writing And Drawing Tablet Papan Tulis Menggambar Anak,Terjual 50+,Rp152.000,Jakarta Pusat
40,Lcd Digital Drawing Pad Writing Tab Writting Pen Stylus Tablet Laptop,Terjual 70+,Rp470.000,Jakarta Barat
41,Lcd Digital Drawing Pad Writing Tab Writting Pen Stylus Tablet Laptop,Terjual 70+,Rp470.000,Jakarta Barat
42,LCD WRITING - 8.5Inch TABLET MAINAN - PAPAN TULIS GAMBAR ANAK,Terjual 250+,Rp30.000,Jakarta Utara
43,NETPAC LCD Writing Tablet Drawing Board ABS frame Writing Tablet,Terjual 250+,Rp359.000,Kab. Tangerang
44,LCD WRITING TABLET 8.5 INCH / PAPAN TULIS ANAK DAN DEWASA,Terjual 100+,Rp15.999,Surabaya
45,LCD WRITING TABLET 8.5 INCH / PAPAN TULIS ANAK DAN DEWASA,Terjual 100+,Rp15.999,Surabaya
46,LCD WRITING TABLET 8.5 INCH / PAPAN TULIS ANAK DAN DEWASA,Terjual 100+,Rp15.999,Surabaya
47,LCD Writing Tablet 8.5 Inch Papan Tulis Digital Mainan Edukasi Anak,Terjual 30+,Rp25.000,Jakarta Utara
48,LCD Writing Tablet 8.5 Inch Papan Tulis Digital Mainan Edukasi Anak,Terjual 30+,Rp25.000,Jakarta Utara
49,LCD Writing Tablet 8.5 Inch Papan Tulis Digital Mainan Edukasi Anak,Terjual 30+,Rp25.000,Jakarta Utara
50,BELLA - 8.7 INCH LCD TABLET DRAWING WRITING NOTEBOOK | PAPAN GAMBAR,Terjual 250+,Rp13.999,Surabaya
51,BELLA - 8.7 INCH LCD TABLET DRAWING WRITING NOTEBOOK | PAPAN GAMBAR,Terjual 250+,Rp13.999,Surabaya
52,"LCD Writing Tablet Board 8,5"" / Papan Tulis Led / Papan Tulis Anak",Terjual 750+,Rp15.499,Jakarta Barat
53,LCD Writing Drawing Tablet 8.5 Inch Papan Tulis Gambar Kantor Dewasa,Terjual 1 rb+,Rp50.000,Jakarta Utara
54,Papan tulis anak 8.5inch lcd writing drawing tablet magnetic drawing,Terjual 100+,Rp18.000,Jakarta Barat
55,LCD 8.5 Inch Colour Animal Writing And Drawing Tablet Papan Tulis Anak,Terjual 500+,Rp45.000,Jakarta Pusat
56,LCD 8.5 Inch Colour Animal Writing And Drawing Tablet Papan Tulis Anak,Terjual 500+,Rp45.000,Jakarta Pusat
57,LCD 16 Inch Drawing And Writing Tablet Papan Menggambar Tulis Anak,Terjual 100+,Rp150.000,Jakarta Pusat
58,lcd drawing writing tablet 8.5 inch/mainan papan tulis ipad anak,Terjual 500+,Rp17.800,Jakarta Utara
59,"Mainan Edukasi Anak Ipad Writing Tablet 8,5 inchi LCD Digital",Terjual 30+,Rp16.750,Kab. Sukoharjo
60,LCD WRITING TABLET 8.5 INCH / PAPAN TULIS ANAK DAN DEWASA,Terjual 21,Rp19.000,Makassar
61,PAPAN TULIS LCD DRAWING 12 INCH LCD Writing Tablet Papan Tulis anak,Terjual 24,Rp45.000,Kab. Bekasi
62,"LCD Drawing Board 8,5 Inch Papan Tulis Writing Tablet Gambar Magic Pad",Terjual 100+,Rp16.200,Tangerang
63,Papan Tulis Gambar LCD Drawing Writing Tablet Pad Anak Dewasa 8.5 Inch,Terjual 250+,Rp45.000,Jakarta Barat
64,"Xiaomi Mi LCD Writing Tablet 13.5""",Terjual 70+,Rp249.000,Jakarta Pusat
65,RB-M298 LCD Writing Tablet 8.5inch Mainan Papan Tulis Hapus Board Tab,Terjual 60+,Rp51.000,Kab. Tangerang
66,"LCD writing Tablet 8.5 inc Tablet Gambar Anak Papan Tulis Drawing 8,5""",Terjual 70+,Rp13.500,Jakarta Pusat
67,"[100% ORIGINAL] LCD WRITING TABLET 8,5"" PAPAN TULIS ANAK BISA DIHAPUS",Terjual 80+,Rp16.999,Bekasi
68,LCD WRITING TABLET 8.5 INCH / PAPAN TULIS ANAK DAN DEWASA,Terjual 4 rb+,Rp18.000,Jakarta Barat
69,"LCD Writing Drawing Pad Tablet 8,5"" Papan Tulis Gambar Anak Dewasa",Terjual 250+,Rp35.000,Bandung
70,"LCD WRITING TABLET 8,5 INC, DRAWING PAD, MAINAN PAPAN TULIS ANAK",Terjual 100+,Rp15.750,Medan
71,LCD DRAWING WRITING TABLET / PAPAN TULIS GAMBAR ANAK / BOARD WRITING,Terjual 90+,Rp13.700,Surakarta
72,LCD DRAWING WRITING TABLET / PAPAN TULIS GAMBAR ANAK / BOARD WRITING,Terjual 90+,Rp13.700,Surakarta
73,LCD Writing Tablet 8.5inch Drawing Pad Mainan Papan Tulis anak,Terjual 1 rb+,Rp1.500,Jakarta Utara
74,LCD Writing Tablet 8.5 Inch Drawing Papan Gambar Tulis,Terjual 17,Rp20.000,Jakarta Pusat
75,"LCD Writing Board Drawing Tablet Papan Tulis Anak Karakter 6.5 inch - WhitePolarBear, Tablet 1 Warna",Terjual 2 rb+,Rp349.000,Tangerang
76,"LCD Drawing Writing Tablet 8.5 inch new"" - Papan Tulis Gambar - RABBIT BIRU",Terjual 100+,Rp75.000,Tangerang
77,lcd writing tablet anak 8.5 inch/DRAWING PAD /PAPAN TULIS GAMBAR ANAK,Terjual 10,Rp21.500,Kab. Sukoharjo
78,"KUKE LCD Writing Karakter Kelinci / LCD Writing tablet 8.5” - Hijau, 8.5 inch",Terjual 16,Rp35.000,Kab. Tangerang
79,"AIKOSIA LCD DRAWING WRITING 12Inch TABLET MAINAN / PAPAN TULIS GAMBAR - LCD12Inch,HIJAU",Terjual 250+,Rp36.400,Tangerang
